id,text,label
3276,Rest in peace? Til Kim Larsen? Seriøst? Hvad fanden er der nu galt med “hvil i fred”?,1
1508,Vigsø er det bedste danske jeg har hørt længe. Det andet er for meget bling-bling lort,1
1212,@USER hvem skriver du til,0
735,Ak ja. Generation ondt i røven slår til igen,1
21,"Det var det. Unsubscribed, lorte sub med lorte posts.",1
123,Indtil lortet begynder at hvæse og går amok...,1
3003,"Jesus Christ, prøver du at give mig et hjerteanfald?",0
3382,Jeg er i Edmonton Alberta og alt hvad OP siger er FULDSTÆNDIG korrekt.  Elsker det alligevel.,0
1814,URL,0
509,Alle for at skifte upvote logoet til HKH og downvotes til ~~kongen af sverige~~ fjeldaben over alle fjeldaber,0
457,Hvis du melder en for vold eller voldtægt og det viser sig det ikke er sandt med beviser og diverse ting. Så burde du få ligeså mange år i fængslet som personen du meldte. Sådan noget shit her gør det svære for kvinder og mænd at stå frem og folk faktisk tror på dem og dem der gjorde det kommer i spjældet hvis der er sådan nogle mennesker her der gør shit Like This,1
2827,Personligt kan jeg bedre lide rosinboller end chokoladeboller...,0
2220,Speak danish or die!,1
577,De får ikke en krone under nogen omstændigheder. Jeg gider ikke finansiere de skyhøje lønninger.,0
1294,Det var en god migmig :) Vær hilset bror nord.,0
668,"Som randrussianer, I approve. Værste lort. Butikker kommer og lukker til højre og venstre. Intet kan køre særlig længe",1
980,Håber de fucking hunde blir kneppet,1
1463,Hmmm danske mænd altså...når der ikke er hudfarve så går jeg ud fra det dansk,0
1168,"Jeg synes idéen er glimrende. Har i ikke en prins eller prinsesse vi kan gifte med Prins Christian? Så kalder vi lortet Danmark-Norge, lader København være hovedstad, med Oslo som sekundær hovedstad (tænker nogle ministerier kan ligge der) og invaderer Svensken snarest muligt. I skal nok lige lære sproget igen, men jeg kan godt med til at bruge jeres tal officielt (på penge og sådan). I producerer også noget fantastisk humor, det sender vi live på DR1 hver fredag i stedet for XFactor. I har også en masse oliemilliarder vi kan smide efter grøn omstilling og en togbro fra Jylland til Norge (så skal man ikke gennem Sverige for at komme med toget til Norge). Nå ja, vi kan også godt begynde at sige kanske i stedet for måske:)",1
306,"@USER har kun læst halvdelen af artiklen, men de fleste kommentar alene for, at more mig over folks, til tider, kryptiske indlæg. Og du ramte lige ned her.",0
2658,lol,0
115,"I stedet for at tildække det svenske flag, burde man [UDRADERE DET](URL",1
3232,Analgafler,1
110,"Når, det var ellers et cool repost, motherfuckker! URL",1
1220,"Den er god nok, det er lige udenfor Spjald, det der.",0
212,"Jeg bliver sjældent glad for lort jeg læser på internettet... Men lige i dag er en undtagelse  Længe leve det frie internet, længe leve folket, længe leve frihed",1
799,hvorfor i den fucking store helvede skal man fejre kristne helligdage for at blive dansker er danskere ikke vildt ateistiske jeg mener jeg kunne forstå om det var i afrika eller noget ekstremt kristent noget manden lever jo i en boble,1
3408,Oh for fuck sake.. Kan vi ikke godt lade være? @USER er lige så meget politiker som jeg er Narhval..... Han er nutidens @USER. One big joke..,1
835,Helt enig med KU. Offentlige socialister bare grådige pattebørn.,1
1179,LOL. Det er da også for plat at prøve at fremstille Kristendommen som en pacifist religion. Det er den på ingen måder. Men det er den blevet efter reformationen og mange års banken på plads. Der er meget få kristne der mener at folk skal dræbes hvis de arbejder om Søndagen.,0
3555,Jeg var overbevist om at han allerede var død..,0
820,ER,0
3365,"Når jeg ser tykke mennesker tøffe rundt i løbesko, føles det sgu altid lidt mærkeligt...  Mest af alt fordi jeg aldrig selv har haft udfordringer med vægten. Men jeg ved hvor hårdt det kan være at komme i form som “normalvægtig”, så KÆMPE respekt herfra, for at du magter at tage al den ekstra vægt med ud og gøre noget ved det! Keep going, man!",0
3564,Så det er dig der spiser de færdigpakkede sandwich man kan købe på tankstationer!!!  Jeg vidste en eller anden person købte dem! ,0
154,derfor skulle hele familen også kunne sendes retur hvor de kom fra hvis deres børn og unge gentagende gange har lavet lort i den,1
1855,---> 9gag.com,0
2201,Får svensken joina?,0
3587,"Bitcher du på Roskilde, så er du ikke gammel nok.",1
1958,Straight outta /pol/,0
679,Oh ffs skal vi nu til at snakke om det lort igen..,1
366,Åh nej! Svensk lorteret!,1
2026,Vi takker vor allierede!,0
2754,Damn. Godt lavet!,0
2713,Kvalitet på /r/Denmark !?,0
1172,"@USER ja lad os lave en statue af @USER, det også historie! Retard!",1
2172,Eller måske få skotterne med?,0
2290,Jeg er helt færdig HAHAHAHAH,0
49,i stolen med den trunte,1
1161,"Klog?? Ha ha for mig at se har hun taget den nemme løsning, klog ville være at tjene dine penge på andre måder. men det finder hun vel ud af, når hun engang ikke kan sprede ben for penge mere. idioti",1
550,de andre to deltog jo på falsk respekt de sku skamme sig de hader nationalisme deres socialime har udviklet islamisme der spreder sig men det der ingen der er harm over,0
181,Brænd hele lortet ned og start forfra.,1
2387,Er begge dele ikke Disney?,0
803,Danmark suger! /Sverige ,1
476,Hun skal ind og sidde resten af hendes klamme liv den møg kost,1
747,studerende.,0
900,"der er ingen udlændinge ved grænsen, heller ikke kriminelle. De kan køre lige igennem den symbolske grænsekontrol. Hvis man ikke kan komme på sygehuset uden at betale, så er det jo fordi at blå blok, anført af DF, har indført brugerbetaling. For sådan går det, når nazister og griske kapitalister rotter sig sammen.",1
269,"alle styreformer der ikke er demokratiske er jo diktatoriske. At man føler at islam er et diktatur er derfor ikke nogen undskyldning for at støtte et nazistisk diktatur. Men det er jo lidt det vi har sagt hele tiden: Højreekstremisme - islamisme, same shit. DF vælgerne er ikke et hak bedre end islamisterne.",1
3195,Klap dig selv på skulderen!,0
958,"@USER Du er helt betændt i kysen, men der er håb, Oringes personale i Vordingborg står klar til at hjælpe dig.",1
1487,Vi er til grin! Totalt til grin. Stik ham en madkupon i lufthavnen og en enkeltbillet hjem hvor han kom fra,0
3375,Ja tak. Og jeg kører selv mc. ,0
229,"For 33 år siden døde Simon Spies, og huset på Christianshavn blev ryddet - Du har bragt ånden som gør Danmark stærk tilbage! ",0
195,"Selvfølgelig. Ikke iorden, men lidt frisk alligevel",0
671,Hun kunne sku da også bare gøre det på den rigtige måde..,0
2939,Var det virkelig sådan at Mohammad skulle forestille at se ud den gang?,0
241,Dyp dem i surströmming og rul dem i fjer. Vi tager ikke let på landsforræderi!,1
2451,"Hvor er Svensken?! Dér, når du har brug for ham. Tak! ",0
2524,Det nederste billede er så meget smukkere!,0
1285,De forældre har ikke lært opdragelse. Så de kan ikke lære kioskhår om opdragelse,1
956,"Jeg leger lige djævelens advokat:  Jantelov er helt ok, men hvis statsministeren skal flyve budget-class, og borgmesteren i vores hovedstad skal pryde kontoret med kjötbulla lamper fra Ikea - Hvem fanden henvender PH og busines-class sig så til?  Jeg ved ikke hvor længe de gamle lamper har hængt på rådhuset, eller om de var lavet af guld eller elfenben - men ting af god kvalitet og i tidløst design har tendens til at holde længere og generelt have længere nydelsesværdi. Det er svært at holde trit med bilkas trend-modeller inden for modeinteriør - det er jo heller ikke gratis at få hængt lamper op i tide og utide.   Desuden handler det også om de signaler man sender - som ambassadør for en millionby og et helt land.  Jeg synes nogengange vi danskere er lidt pylrede når vores politikere og ledere har noget vi ikke selv har.  130.000 kroner er virkelig småpenge (som i SERIØST små penge) og det er da lidt ærgerligt at skulle sidde ved sit hvide melamin skrivebord under hjemmeflettede lampeskærme på borgmesterkontoret, og kikke ned på alle de private virksomheder, apoteker, kontorer og almindelige hjem og se på PH lamper som er for gode til byens ledelse.   Djævlemode:off  Det egentlige spørgsmål her er, om borgmesteren bruger A++ LED sparepærer i de dyre PH lamper. ",0
854,Jeg tror en da at netop *dette* Dannebrog er så flot at det har brug for et nsfw tag ;),0
573,Jeg skal binde dem til en seng,1
2766,Nu må i fandme lige hæve niveauet lidt. Hvis du skal shitposte så få mig til at puste luft ud af næsen i det mindste.,1
2598,Lel hvor har du fundet den? Det er vidst det jeg ville kalde et tamt meme.,1
3068,"De fleste danskere er ikke andet end til at grine over nu til dags.    Det eneste man hører råb og skrig om er USA, imens vi bare lader den rigtige fjende liste ind i USA's skygge. E-stonia virker som en test-hub for EU's nuværende E-governance model. Der har lige været i nyhederne enten igår eller forgårs at vores regering herhjemme ønsker at gøre vores land kontantfrit. Dette ville være det værste som kunne ske for vi danskere, da vi ved dette træk afgiver store dele af vores privatliv.    [URLår større ting i verdenen som vi danskere burde være bekymret over, end spørgsmålet om vores syge må have lov at indtage cannabis olie. VÅGN FUCKING OP DANMARK.",1
1117,"Hahaha, hvor er jeg enig! :D  Selveste [Kongen af Hundige har lavet et meget moderne NSFW-nummer](URLå personligt gerne, at det blev årets Roskilde-hit foran alt det andet lort.",1
2613,Det forklarer busserne.,0
326,Patetisk svar på det der foregår i [/r/schland](URL,0
591,"Jeg vil hellere give de 3 unge drenge en skilling, end at støtte op om røde kors og deres utallige skandaler.",0
1246,Jeg har lige lavet mad. Det gik IKKE godt.Ligegyldig info,0
2294,Og så er det fandme mørk chokolade! Alle og enhver ved jo at pålægschokolade skal være lys!,0
2447,"Hvordan var det nu den R.E.M. sang lød?  *""Would you beliiiieve, the danes won EM'92!""*",0
3326,Det fandme en fugtig migmig det der,1
2602,KANEL FUCKING GIFFler,1
2277,"I DET MINDSTE ER ""FLAGET"" BESKIDT SOM DET LAND DET REPRÆSENTERER.  PÅ EN MÅDE ER SKILTET SANDT - THI SVERIGE BØR RETTELIGEN TILHØRE DANMARK!",1
72,"Hvad fanden sagde du lige om mit lands indvadrerpolitik, din lille kælling? Jeg kan fortælle dig, at jeg dimitterede som den bedste i min årgang i frømandskorpset, og jeg har været involveret i adskillige hemmelige angreb mod IKEA, og jeg har over 300 bekræftede drab. Jeg er trænet i elgekrig, og jeg er den ypperste finskytte i hele Danmarks Riges væbnede styrker. Du er intet andet for mig end bare endnu en satans svensker. Jeg vil udslette dig med præcision, hvis lige aldrig er blevet set før på denne Jord, du skal satme mærke dig mine ord. Du tror, du kan slippe afsted med at sige sådan noget lort til mig over internettet? Tro om, bror lort. Imens vi taler, er jeg ved at kontakte mit hemmelige netværk af spioner på tværs af Norden og din stank af surströmning bliver sporet lige nu, så du må hellere forberede dig på stormen, orm. Stormen, der udsletter den ynkelige lille ting, du kalder dit liv. Du er kræftædeme død, knægt. Jeg kan være hvor som helst, når som helst, og jeg kan dræbe dig på over 700 måder, og det er bare med LEGO-klodser. Ikke blot er jeg omfattende trænet i at kunne styre min brandert, men jeg har adgang til hele Siriuspatruljens arsenal, or jeg vil bruge det til dets fulde effekt til at udslette din stakkels røv fra kontinentets overflade, din lille lort. Hvis bare du kunne have vidst, hvilken ugudeligt grusom gengældelse din smarte lille “kommentar” var ved at bringe ned over dig, så måske du havde varet din skide mund. Men det kunne du ikke, det gjorde du ikke, og nu betaler du prisen, din forbandede idiot. Jeg vil skide raseri ud over dig, og du vil drukne i det. Du er fandme død, knægt.",1
3157,Danmarks nye national ret,0
661,"Han er en torsk, der er så teknologisk udfordret at han ikke burde sidde i den magt han gør.",1
3309,"Du kunne prøve hæren. der kan du tage en uddanelse og få penge mens du gør det. mener da også at man for en bolig af dem mens man er hos dem. og man behøver jo ikke at være soldat for at arbejde for hæren. Det var lidt hårdt at høre din historie og håber for din skyld at du kommer ud af det miljø så hurtigt som muligt, det med din familie er nok lidt hårdt at tænke på men det lyder som om de tænkere mere på deres tro en de gør på dig, og derfor ville jeg personligt nok sige farvel og nok stoppe med at have kontakt indtil du har bygget et liv væk fra dem.",0
1640,**Dette** er en ægte daner  URL,0
2709,/r/PeopleFuckingDying,1
2763,"Fantastisk stykke kunst, håber Andrea er feature på nummeret “Loyalitet”",0
339,Manden er idiot.. End Of Story,1
57,Smid dem på den anden side af grænsen hvor de kom fra og byg et hegn som Trump,1
330,Han er et kæmpe fjols.,1
169,Sindsyge kælling. Hun burde sgu spærres inde i meget lang tid,1
1391,hey ja og DU hảr den altid med og lige ved handen,0
493,[Norsk udgave af Olsen Banden](URL,0
873,"Folk kommer til at få det vildt over hvor organisk deres organiske vanilje i virkeligheden er hvis sådan noget her kom til at ske...  Tænk at betale negere for at plukke en lille frugt for derefter at sejle dem over på den anden side af jorden for at pakke dem enkeltvis i plastic og karton for derefter at sælge dem til en kunde der bærer lortet hjem i en plasticpose.   Men folk er jo ligeglade, så hvorfor skulle vi ikke være det?",1
248,Burde næsten være et tripple-E,0
2758,Det er sgu god dank satire det her. Er det OC?,0
328,@USER. Han skal selvfølgelig ha det engangsbeløb han har krav på.,0
209,"Ja løget mindst om, ud af alle de ting der bliver løget med er muligt, men derfor er det skam stadig meget. Tror blot på det sidste år jeg har hørt om det 3-4 gange, og det er 3-4 gange for meget.  Hvordan man end vender og drejer det, så er det en syg kællings løgn.",1
1976,Jeg vil lige prøve det:  Fuck Svensken.,1
3306,Er jeg den eneste der er monster bekymret over 20 graders vejr i midten af oktober? Like wtf...,1
1065,hold nu op - I er vanvittige,1
1254,"Ja ja, hun er en idiot og hun lyver, men er det virkelig så svært at forstå hovedpointen?  Det minder nærmest om Fox News agenda, som folk vælger at misforstå det, fx denne tråd.  Hendes pointe:  Dem som siger at socialismen fungerer, peger altid på lande som Danmark, hvor det siges at det går rigtig godt.  De peger aldrig på lande som Venezuela, hvor det åbenlyst går af lort til.  Hun ville så påpege at drømme-eksemplet Danmark ikke er så godt som folk tror.  Hun siger dermed ikke at Danmark er lige så dårlig som Venezuela, eller at de kan sammenlignes.",1
1475,FUCK NU SOVER JEG BEDRE I NAT,1
2495,[Her er det bedste interview med ham nogensinde](URL,0
970,Fortnite er fandme da også noget lort...   :>,1
2932,Smirking ~~bitch~~ bastard from ~~Highgarden~~ Høje-Taastrup.,1
3040,"fødevarer der direkte er gude mad"" ""cumshot på cumshot"" - Shout-out til ham den tykke jyde med selerne, der anmelder grillbarer",0
3015,Er de nede igen?,0
1187,Hahaha hold nu kæft han er kær!,1
1869,"Hvis du hellere vil have et kalifat end sverige, kan du fandme fucke ud af mit land din luder. ",1
3089,"Racer cyklister er de absolut værste, typisk arrogante og flokdyr. Samme kan blive sagt for XC ryttere på 40+ på de lokale Trails med 60k full suspensions, vandblærer, gopro og mens de råber af hinanden som om de kørte verdensmesterskab. Jeg har tit haft nogle interessante samtaler på de lokale trails med de her asshats. Gudskelov er det meget få af dem i MTB ved os pga. En lokal stærk og god klub, helt generelt er Mtb et godt miljø med plads til alle, også på shitty cykler og hvor man giver fysisk plads til folk kan køre modsat sporet og prøve noget dumt af og til... Men det er måske bare regionalt, for når jeg tænker efter er mængden af asshat proff XC ryttere ved Hareskov og Hillerød satme også for høje - Gad vide om det er racercyklister som får sig et afbræk??",1
1248,Nu synes Jamil nok ikke det er så sjovt længere nu hvor han ikke længere kan bestemme,0
987,"Tak, fordi du ikke vanærede @USER ved at sætte @USER grimme fjæs oven på ham. ",1
2296,Kalle er faggot..,1
2206,"På mit historiehold er vi begyndt at sige ""Fuck Sverige"" i stedet for skål. ",1
1883,Hvem?,0
3441,Det var dråben NATIONALISER,0
2001,Ingen kan rocke dannebrog som Bamse!,0
2141,"What's one bastard boy against a kingdom?  Spøg til side. Det ser ikke godt ud [på video](URLå ekstrabladet, desværre), hverken for soldaten eller de børn der så på. :s ",0
3103,Tor er også en korrekt stavemåde.  Vi er jo ikke ugudelige englændere.,1
1309,@USER ro og orden i Afrika. tror du selv på den. de har altid ført stamme/ hullabulla krige der nede. og det vil de altid gøre.,1
531,"Det ville faktisk være ideelt, det er på ydersiden at de kommer til at smage som lort.",1
1868,###VOGT JER. HOLGER DANSKE VENTER!,0
323,Det er jo ikke kun dine bryster du tjener penge på du spreder jo også ben,1
1083,"Føj for satan🤮🤢 det var dog sindssygt.👏🏻Det ligner kraftædme din farfar👴🏼 valgte at begå selvmord🔪, så klamt det er.😣🤯 Du skulle skamme dig🙅🏼‍♀️ over at vise sådan noget pis🤮💦. Jeg har aldrig nogensinde i mit lange liv,👌🏼set magen til lort.💩🤮 Bare tankenom at du kan få dig selv👉🏼👩🏼🧔🏼 til at vise noget så ualmindeligtklamt😖, gør at jeg mister troen🙌🏼 på os mennesker.😔👬👭👫 Din kone👫 er en klam bunke kartofler🥔 i en kørestol. ♿️Hold nu kæft🤬 du kraftedme dum🤦🏼‍♀️ og klam.😖🤮 Du kan bare sende📬 dine klamme🤢 lastbilvenner🚛 efter mig,👏🏻din fucking stodder. 😡Jeg fucking pifter dækkene🔪 på din kones klamme kørestol♿️ og klapper👏🏻👊🏼alle dine venner i gulvet.😡 Klamme sæk.👏🏻🤢 Spænder et reb⛓ fast i din klamme kones kørestol♿️ og sætter det fast🔐 bag på min bil🚗💨, og så kører jeg fandme en tur med hende!🚗💨⛓♿️ Skam dig, din sæk!👏🏻😡👊🏼🤢  Credit til u/depresso_excesso",1
513,@USER dig når jeg laver ris og formår at fucke det op,1
559,Dagens største grin!   For satan det er godt. Overlegen lort .,1
3504,"Jeg har et værktøj der tillader mig at markere og kopiere tekst i billeder. Her er hvad jeg får: ""w h m""",0
788,Det beviser jo kun det vi andre har vidst længe: ASYLSHOPPERE der ikke er en skid i fare hjemlandet,0
257,Det var en lidt uheldig stavefejl størrelsen taget i betragtning.  Godt at lortet faldt.,1
11,"Det var da en omgang sludder, der ville noget. Men Yah! død over svensken. ",1
832,Hva' fanden??,1
2747,I did not,0
92,"Jeg vil gerne købe det...Jeg er ikke nynazist,men WW2 er en af mine helt store interesser..",0
824,Fandme heller ikke noget værre end udkogt pasta.,1
2888,"Jord og beton arbejde er pisse hårdt og skal gøres rigtigt første gang, da det er svært at flytte beton og jord efterfølgende. Jeg har respekt for den vigtige arbejdsopgave de gør. ",1
2048,Er der ikke lige en som kan indføre mig i denne meta?,0
2922,"Vent, hvor pokker er Ejderen?? Jeg troede det var hele Danmark vi snakkede om her",0
986,Ses på forsiden,0
544,"Normalt synes jeg Marx var lige højreorienteret nok. Men på dette punkt kan jeg mærke en ekstremt liberal tilgang til emne. Til denne debat vil jeg sige, at krænkelseskulturen er en af de dummeste importer, vi har gjort os fra Nordamerika.  Jeg afventer personligt, at vi kollektivt vedtager, at det er fløjtende ligegyldigt om man er født med tap eller ej, hvad farve man har, og hvem man bedst kan lide at kysse på.  Nej, vi vil ikke have hate crimes. Nej, vi gider ikke se på passiv humor på bekostning af andre. Men man skulle fandme tro, at Danmark havde assimileret den Mellemøstlige aversion overfor selvironi. Hvilket er noget beklageligt eftersom selvironi er et ret stort interpersonligt fænomen for danskere.   Men er en joke om, at nogen gange ventede jeg lidt længe på, at min eks gjorde sig klar på bekostning af hende? Eller er den relaterbar for andre mænd og kvinder, der godt lidt kan se, at der (for mange) er noget om snakken? I virkeligheden siger jeg jo med en sådan kommentar, at jeg fandt hende naturligt smuk og glasuren overflødig.  Jeg bliver så evigt træt af, at man skal have bonuspoint for at være født som noget specielt, hvor specielt på nymarxistisk vis blot betyder anderledes fra den mest dominerende gruppe; den hvide heteromand. Jeg tænker, at det må være rimeligt, at alle har lige vilkår, og at alle må deltage i den kultur vi har her på stedet. Lad os nu i stedet for at skælde ud på alle jokes prøve at isolere dem, der er sagt med had, fra dem, der ikke er.  Jeg var engang på en Tinder-date med en såkaldt queer feminist. Hun sagde en masse ting, som jeg i årevis har set nærmest ordret fremført i debatter fra USA og Canada. Bomben smed hun dog først til sidst, da hun sagde, at alle mænd er sexister og alle hvide mennesker er racister. Fordi begge grupper angiveligt vinder på, at andre er dem undertrykt.  Og det er da bare super, at man skærer alle over én kam på den måde. Så jeg er åbenbart som hvid mand racist. Ligesom Hitler. Det er super, at regnbuebevægelsen er så blind overfor gråzoner.   Det handler selvfølgelig om, at sprogpsykologien fra de franske filosoffer fra 60erne lærte os, at sproglige udtryk har deres endelige effekt hos modtageren. Derfor træder vi ofte folk over tæerne uden at vide det, når vi sådan går og joker ""som man altid har gjort"". En fin tanke at ville være progressiv og optimere sprogets brug. Men humor kan ikke bandlyses uden konsekvenser.   /rant",1
347,"Jeg studerer selv i England, i en af de dyreste byer i landet - i forhold til Danmark så ligner det LORT. Hjemløse og folk tabt af systemet over alt, skrald over det hele, alle mine venner er ved at drukne i studie lån og meget misundelige på min SU, biler på den forkerte side a vejen... Jeg kunne blive ved. Vi er ikke perfekte i Danmark, men hold op hvor er det markant bedre end andre lande. ",1
534,Hold hold hold. Det er Tobias og hans kumpaner igen. Ja og Ole var ham med kniven. Jo jo den er god nok. Sådan en flok racister det skriver her,1
979,Hun burde sættes ind for falsk anklage 99år som den stakkels unge mand kunne havde fået,0
194,##SVENSKEN KAN SLET IKKE FØLGE MED.,1
122,"Der findes for mange syge mennesker i verden, der ikke kan finde ud af at koge pasta",0
532,Ja tak! Det er simpelthen så ulækker en forretningsmodel. Lavet udelukkende for at ramme børn og teenagere.   Har hadet på det i COD siden de indførte det lort. Men så længe folk køber dem forsvinder det ikke... ,1
1860,Jeg ved sgu ikke om jeg havde lyst til at få at vide Malmö nu var vores ansvar.,1
3130,Danny Sørensen deres Coach går under navnet Zonic,0
318,Gad ellers godt se det hår blive vådt. Er der nogen frisører der kan sige hvordan man får den frisure for mit hår ser da kun sådan ud når jeg børster det for meget og jeg kan da ikke få det til at sidde fast sådan med hårspray.,0
1679,"Hvordan fuck er de kommet frem til det, er vi ikke de første på banen når cowboyderne er på krigsstien? Vi har sku' da aldrig fortjent en 5. eller en 3. plads. Fake news Costa Rica er røget fra en 1. plads til en plads omkring de 30, og de har ikke haft militær i over 50 år, vi har været involveret i minimum 3 krige i den tid, jeg forstår tydeligvis ikke fred.",1
2065,URL,1
1037,Synes hun har en okay pæn krop... men vil gerne se din Gitte @USER for den må være perfekt...,0
3571,SHADILAY,0
1377,det fortjener hun også. Føj for en ulykke at gøre. Aldrig har jeg set noget værre,0
2527,Han var norsk inte svensk! Typiskt danskjävleri och fejk propaganda!,1
647,Tosse. Skulle have fløjet med helikopter. Han skulle have lov til at gå,1
189,Og svensken er som Amdi. INGEN STEDER AT SE!,1
1137,"Gammel aktiv i hæphop i 90’erne her.  For at være rigtig gammel og vrissen, så tror jeg at manglen på en scene, der IKKE er online baseret, betyder at meget lort bliver udsendt. Lort som ville være blevet sorteret fra til jams, battles, demobånd etc.   Det er simpelthen for let at komme ud i dag - derfor udgiver folk dagen efter de har snøvlet lidt i mikrofonen for første gang. Den var ikke gået i midthalvfemserne, hvor du blev savet over på scenen, hvis du var en online rapper (Oraklet er et fint eksempel)  Langt de fleste nye danske rappere har stort set ingen skills hvad angår lyrik, teknik og flow. Der er undtagelser.  Hvis folk skulle betale for musikken ville hovedparten af den playlist aldrig sælge noget som helst. ",1
467,"Du er lige tyben på en kummunist @USER så vidt jeg ved har de slået mange millioner mennesker ihjel, i det hellige kommunistisk navn , husk at når du peger på andre er det altid en finger der peger på dig selv, og lige for at præciserer er jeg venstre mand, men kan kan godt tåle andre partier, selv sf og andre der ligger langt til venstre",1
299,[EVIGT OG ALTID.](URL,0
866,syge ko,1
