id,text,label
819,"Efter at have boet i Japan i et stykke tid, endte jeg også med at holde endnu mere af DK. Ikke at sige at vi ikke har lort der skal rengøres for, vi har da vores share of problemer, men overall så bor vi i et enormt godt land.  Der er så meget omkring Japan jeg kunne skrive om, men hvis man mener vi har for meget bureaukrati herhjemme, så prøv at tage til et land hvor en statsminister gennemsnitligt kun sidder omkring 14 måneder før de bukker af for en skandale - og så tænk lige over hvor meget DE når at få igennem på den tid (ikke en skid).  Og ja, som sidste note: det er super super fedt at man bare kan drikke vandet fra posthanen, og at det hverken er usundt eller smager af bæ.",1
3027,"Kim Larsen var god, men hans død blev alt for hyped",0
1046,@USER shit. Heldigvis kan vi begge finde ud af at lave det ordenligt.,1
1395,bare hun huske at betale skat og ik kommer hjem når hun bliver syg og nasser på der danske sundhedsvæsen,0
2182,Vil du komme sammen OP?,0
3438,Det er fandme et stærkt album! Tak for grinet :),1
1067,"Hun skulle satme ind og sidde i meget lang tid, samt kæmpe erstatning til ham fordi hun har skadet ham. Kunne have ødelagt ham og hans families liv. Møgso",1
1859,fuck sverige,1
1433,"så må vi se om du tør fucke ris op næste gang vi skal have ris, jeg sir’ det bar’",1
1845,straight up pimpin,0
1088,"Køb jer dog en fucking blæser tudefjæser. Som om i nogensinde har været i en vandtæt dragt fra top til tå med gasmaske på i det her vejr, der er varmere de fleste andre steder i verden end her.. 😂",1
954,Sikke en svag regering vi har i landet. Hvornår gør de noget?,1
537,God bedring,0
430,Hva fanden er der galt med folk??!!,1
2138,Hvornår begynder vi vor togt?,0
1317,"Sejrherren skriver historien, Stalin og Mao's forbrydelser glemmes i farten med mange andre der har slået millionvis ihjel i kommunismens/socialismens navn. Man kunne stærkt mistænke venstrefløjen for at ha' en andel i fortielserne.",0
3063,HVER fucking tirsdag...   ^(er tartelettirsdag) ,1
240,Skal vi lege: Gæt en farve ?,0
352,"Nu cykler jeg meget sjældent inde i Kbh, men jeg er ret overbevist om at det med at være cykelidiot er noget som folk er fælles om. Det er et enormt stressende sted at køre hvis man ikke er vant til det. At blive sur på folk der kører på racercykel virker lidt indskrænket for der bliver generelt kørt temmelig alternativt. Men selvfølgelig har man en ekstra dårlig oplevelse en gang imellem og så er en rant da en god måde at få luft på. Det kan vi alle sammen have brug for. ",1
2962,"Brian Saaby er en genial kunstner, ville ønske jeg havde råd til et af hans originale malerier ",0
2823,URL,0
909,Dungarn lyder bare som et lorte sted på Nørrebro...,1
376,"Hvad er det for noget?  [Jeg har i et par dage forsøgt at finde ud af, hvad det der flag repræsenterer](URL",0
2901,"ked af at hører om din situation, nu blev du jo introduceret til koranen i en tidlig alder, som 7 årig som du selv siger, hvilket nok mere har været i din forældres interesse end din egen, hvis de så ikke acceptere at det ikke er noget for dig, er det jo frihedsbedrøvelse, vær fri, vær dig selv, dine forældre burde helt klart støtte dig, selvom du ik vil være muslim, men man ved jo aldrig hvordan de selv har haft det i deres opvokst, kom væk, skab dit eget liv, så ka du jo beslutte dig om du vil banke på deres dør om 10 år og se om de stadig har den samme holdning, hvad angår din ven, så fuck ham eller dem? Rigtige venner støtter squ en ligemeget hvad, om det så er pga religion eller i nødenstund, håber du finder et nyt sted at bo, får stiftet din egen familie og ikke mindst finder nogen gode venner rundt omkring dig, nu har jeg aldrig selv været religiøs, men jeg har flyttet langt væk fra mit hjemsted, for at starte en ny tilværelse alene, uden næsten nogen penge på lommen, ;Det er hårdt, men det kan skam godt la sig gøre,  Held og lykke! :) ",1
554,Ja typer som sigøjnerbossen hilser venligfolket velkommen,1
652,kæft en lortepæl,1
1972,Det var en nordmand,0
1577,Ja lige så sandsynligt som lyserøde elefanter.. Det er da bare at levere dem på genbrugsstationen som glas/metal.,0
1275,"Så længe det ikke skader dansk erhvervsliv eller samfundets allerrigeste, kommer den nuværende regering ikke til at gøre noget ved problemet. Så nej, sandsynligvis ikke.",0
2675,Et drømme scenarie,0
1708,Shitty AMA? De har vel bare realiseret at der er INTET shitty ved at være dansk!,1
2299,jeg har nu altid tænkt at svensk lyder som nogle der prøver at tale mens de har anal samleje på en trampolin,1
563,Selvfølgelig mener han ikke det skal ties ihjel. Han har jo penge på højkant,0
807,Vi har bare totalt fået et internationalt 12-tal i Natur og Teknik med Hygge Bosonen. Hvor er det fedt!,0
1306,"Igen en ubegavet kvinde , som får taletid",1
126,Fantastisk at du gad lave al den research :D,0
955,"En Grand danois är en tysk hundras kallas också för Deutsche Dogge. Den ""lille lorthunden"" är en Dansk-Svensk Gårdshund.   Påminner om Peruanernas och Bolivianernas skämt om Titicakasjön.   Båda sidor hävdar bestämt att ""caka"" sidan återfinns på grannlandets sida. ",1
395,"Da jeg vågnede i morges kløede min arm. Jeg kan se at der er er et lille hvidt rundt mærke. Tænker det må være en blodsugende svensker, som sneg sig ind på mit soveværelse og bed mig ",1
3527,lol,0
277,Ikke noget andre kvinder ikke har men ser bedre ud med tøj på,0
762,"@USER hvad mener du med det skal vi til at være herrefolket igen ,",0
1013,Kælling,1
117,"Det danske flag er rødt og hvidt, og det tyske flag er møg beskidt.",1
701,"@USER hvis hun ikke kan koge pastaen rigtigt, fortjener hun heller ikke et ben",1
3144,Alt med måde kan man vel sige? :),0
1945,"HAHAHAHA, Dumme fan. De enda ni kunde styra över var Skånejäveln och Norge behöver alltid en mästare, oavsett om det är danskjäveln, den perfekta Svensken eller Nato",1
2793,"Lol, klassisk",0
3220,"Skideflot. Et stk. upvote til Dem, mon signor. ",1
1342,Sorte aber,1
1069,"Vi er røde, vi er hvide, og nu skal vi fandme da være stive!",1
2573,I det mindste hvis du drikker benzin så ser du syner.,0
2202,Hierbij claimt /r/cirkeltrek uw fietsnetwerk in naam van Willem.,0
2790,Lige til r/Copenhagen,0
770,"@USER håber for din egen skyld du ved hvordan man koger pasta, tør ikke gætte på hvad @USER kan finde på",0
796,Kilde: URL,0
555,"Den praktikant, der har fundet på det dér, har vist aldrig siddet med til et SF-møde. Kom med til et SFs valgfest i morgen, så skal jeg vise dig socialisme; sådan rigtig socialisme.",0
2990,Med hård G. Ligner jeg en fanme svensker?,1
663,..forstår ikke. Har Svensken ingen fremmedsprog?,0
2071,"forstår ikke hvorfor Danmark, der ellers bliver anerkendt som en af de bedste lande til engelsk som andet sprog, bliver vist som så dårlig til engelsk",0
2718,"@USER er en uudholdelig hykler. Optræder altid påtaget puritansk som om hans tro på gud alene, forbyder ham at træffe amoralske, egoistiske valg. Han er et Dansk førsteklasseseksemplar på en Republiansk Evangelical.   Greatest of Esben gennem de første 7 år i Folketinget:  * Fusket med sit CV så hans første 5 år på Norsk Missionskole blev erstattet af ""Københavns Universitet"" (hvor han slet ikke var optaget før bagefter)  * Ph.D Plagiat som efterfølgende fik en tvivlsom frifindelse  * Plagieret Christiansborgtale  * Kvotekonge sagen (Esben er valgt i vestjydsk valgkreds)  * Misvisende informationer op til vedtagelse af landbrugspakke",1
2006,[Bra](URL,0
1596,nederen alligevel,0
1559,"Nu igen,det er snart hver eneste dag,forfærdeligt",0
2424,Stoppede svensken nogensinde med at gøre det?,0
1953,Ballade eller behandling.,0
2476,holy mother of fucking God... Det er måske den lækreste bøfsander jeg nogensinde har set.... Drooooooooooooool,1
1114,Det går indtil hun en eller anden dag kommer i hænderne på en tosset person eller bliver påført en kønssygdom som ikke kan helbredes.  Så det er meget risikabel levevej.,0
2877,Tid til at kæmpe mod global opvarmning så. Man kan jo starte med at finde et parti med klima på programmet.,0
546,Norge er nu ikke så slemt igen... AKA Svensken ain't got shit on us...,1
2961,"Damn, jeg troede ærlig talt løbet var kørt.  Det giver mig troen på det europæiske demokrati tilbage.  ~~Nogen der sidder inde med en liste over hvad de danske MEP'er stemte ?~~  EDIT: Listen er andet sted i tråden.",0
2099,Danskjävlar,1
510,"Alle i min by hører udenlændinge ""danske"" rapper. Det lyder ad lort til. Kender fanme ikke til god musik i den her by, det er fucking træls!",1
3284,Tog vi os ikke af 2 giraffer? Som begge hed Marius?,0
1595,"Jo, jeg har også, og måske oftere hørt om små mandslinger, som nægter et overgreb mod en kvinde. Jeg ved godt den slags sker, desværre, og jeg sympatiserer på ingen måde, med den bitch, jeg håber hun får sin velfortjente straf. Det der støder mig, er den nedladende vending “alene af den grund en kvinde” det krænker mig, for det tror jeg aldrig vil kunne finde sted, med omvendt fortegn. Forestil dig lige det",1
1226,"Ind og ruske tremmer med hende,Den syge kælling!!",1
2053,"At kalde Racial profiling er måske lige i overkanten, men udover det er jeg med ham. Ned med svensken og alt det der.",1
1242,"@USER som en billig vare, tænker de tjener langt mere end dig, så hvem sælger sig selv billigst?  Disse 2 som laver noget der giver dem nydelse og som de ikke bliver nedslidt af eller dig som knogler røven ud bukserne på arbejdsmarkedet til lorte løn og nedslidt krop?",1
1685,Danskjævel?,1
1590,Bare få dem offentlig gjort så kan forældrene se hvad deres unger render og laver,0
159,"Fuck perkerne. ses på 4chan, tabere.",1
2193,Risengrøden skal have lurpark på. Og kanelsukker. O g en god øl vef siden af!,0
519,Det sgu heller ikke okay. jeg havde sgu også blevet sur !,1
1237,"Bare tag et eksempel som fx. Kurt Cobain-sagen, som er veldokumenteret. Han lå på jorden med et gevær ved siden af sig, så må det være selvmord, CASE CLOSED. I dag er der flere betjente som var involveret i den sag, der sagde at det var sjusk, og man ikke søgte efter beviser.",0
1861,HVOR,0
1127,"Det her bør være øverst, fordi han er en røv med øre og hans hoved bør være nederst, fordi han kun kan lukke lort ud.  Og det er sagt af en som er mørkeblå.",1
499,"Kender det godt, av",0
3143,"Det her giver mig håb, som en indvandrer fra England, så mange tak. :-) Nu hvis jeg kan bare få min dansk kæreste at svare på mig på dansk og ikke engelske vil det være helt flot. ",0
675,Det er på tide en del kvinder skrider tilbage til det køkken de er stukket af fra. Syge kællinger på fri fod er der squ for mange af,1
1839,Danskjävlar,1
1467,"Sålænge gøre de det efter deres eget valg, skal man respektere deres valg. Jeg ser ikke noget problem i det, de har de rette kompetencer for denne branche. Der er sgu mange,som gøre det samme herhjemme, men de skjuler det, eller de kalder det sugerbabe. Potato eller kartoffel, same shit but different name",1
2870,"Har selv en datter, den første gang (hvis nogensinde) hun gør det der. Bliver den hidtil værste dag i hendes liv, beskytter min unge med næb og kløer. Men slår hun i bollerne, ramler verden ned over hende, med en kraft så hun forhåbentlig græder hver gang hun overhovedet får lysten til at røre ved en mands skridt igen. Hvilket jo vil være win/sin, så behøver jeg ikke få det planlagte jagttegn 😁",0
2287,"Klogt! Er selv på vej hjem til fædrelandet efter et job i Sverige - dårlige lønninger, manglende lederegenskaber og så er de pænt kedelige! Burde jeg måske have regnet ud, inden jeg tog afsted...",0
1780,I det mindste er Holland også blevet indlemmet i det Stortyske Rige. Så kan man tage på coffeeshop uden at tage sit pas med.,0
2307,"Født og født er nok for meget sagt. Første benævnelse af Finland kom allerede i omkring år 75-100 efter vor tidsregning. Finland kom under det svenske rige i 1323, hvoraf Rusland snappede det i 1809. Det blev oprettet som storfyrstendømmet Finland under Ruslands styre, hvor det stod og passede sig selv indtil 1917, hvor Finland blev selvstændigt som følge af det sovjetiske kup.  Hvis Finland ikke var Finland før uafhængigheden, hvad var det så?  Fra 1860-1917 brugte finnerne, og især de finske forfattere, tiden på at skabe en identitet, som kunne adskille sig fra Rusland og Sverige. Og det er det resultat, vi hører og ser i dag. ",0
158,KONGEN I NORDEN,0
623,Det var klokt gjort av dig! Bra val.,0
1357,Møgsæk.,1
2799,Hvor mange hurtigere alternativer var der dengang?,0
2081,"Yep endnu en dagli kæde jeg ikke handler i! Er det her et mareridt? Ligesom da jeg var i runde torn og jeg kunne se over til sverige. Det var skræmmende, men det var heldighvis bare et mareridt, håber aldrig jeg skal se det gudforladte sted igen!",1
1638,Vi skal tilbage til vores storhedstid!  Her tænker jeg naturligvis på vores enorme udbredelse under vikingetiden,0
1098,"@Mods Kan vi ikke få det her lort sparket over på Dankmark, hvor det hører til ifgl. reglerne? Den her sub obersvømmes i usjove memes på Finn Nørbygaard-niveau.",1
1627,"Nä nu jävlar, vilken av er postade de där, Danskjävlar?",0
3000,Det er fandme de bedste nyheder idag. Vi burde dele en skål,1
1756,Og uændret! URL,0
947,Intet nyt her.,0
2909,Kan vi få en international version uden den danske tekst? Evt kortet ned så den slutter lige efter han bliver ramt? På forhånd tak :),0
3501,Det er endnu en barriere for bønder uden for EU...,0
441,"Feminisme burde blive ulovligt at dyrke, og kvinderne skal have frataget stemmeretten, alle de steder de har stemmeret. Straffen for feminisme, skal være en tur i Peter Madsen’s ubåd, MED Peter Madsen, saven og skruetrækkeren.",1
4,"Har en gang fået et trælår af min kæreste, fordi damen overfor mig havde verdens dybeste udskæring. Det var som et sort hul der tiltrak alt lys. Senere, efter højlydt skænderi på hovedgaden, checkede hun op på alle sine drengevenner. Alle havde selvfølgelig checket kavalergangen ud hvert minut, fordi man er et menneske. Jeg blev tilgivet, tak drenge......",0
211,En ven i gym havde altid det med. Han kaldte det en leverlort (med mayo),1
1266,HOLD KÆFT JEG FÅR JO HELT LYST TIL AT ÅBNE ENDNU EN TØNDE MJØD,1
2241,"JÄVLAR FITTA, HOLD KAEFTE! DRA ÅT HELVETE!",1
2177,Du glemmer 1992 - NYA ULLEVI ER HELLIG DANSK JORD!,0
3554,"Sider manden rent faktisk og hævder de logger når der er en dommerkendelse? At politiet går ud og får en dommerkendelse først?   *edit* Ja sørme så, ca. 2 minutter og 52 sekunder inde siger han at logning handler om a politiet kan få oplysninger gennem en dommerkendelse. Hvis jeg vidste ingenting om det her ville jeg regne med at at der skulle en dommerkendelse til.",0
869,Vil gerne lige påpege denne sandhed:  URL,0
401,Kvalitets lorteopslag min ven!,1
3059,r/kidsarefuckingstupid,1
3454,Kamelåså!,0
826,Gik da slet SLET ik amok,0
2017,Pff.. tog mig bara 2 veckor..,0
226,De skal have en gratis enkelt billet ! vi gider ikke et danmark fyldt med velfærdsturister og om 50-100år overtal af muslimer med hjernedød mentalitet der ikke hører til i norden.,1
3007,SÅ DER DØMT OP-STEMME FEST!!!,0
336,"Indvandrere, de kender intet til dansk gerrighed og smålighed.",1
2846,"Alle drivhusgasser skal da være med i regnskabet, ikke bare co2.   Det vil også give bedst mening at give det et pointsystem, på samme måde som dyrevelfærd har pointsystem af animalske produkter. ",0
562,"sendes retur ! Hvortil! Det er er såmænd blege asparges lign.unge ,med andre ord danske børn og unge",1
162,Det er simpel hen ikke i orden vis respekt for de døde og fam,0
2595,Gyldent stunt.  -Dét er sgu den ægte vikingeånd!,0
