id,text,label
1151,"Skattelettelser, hvor det er samme procentvise gevinst til alle, rig som fattig, vil jo uden tvivl være mere til gavn for bankdirektøren end SOSU assistenten. Dermed vil SOSU assistenten være dét dårligere stillet. Og når skattelettelser samtidig bygger på afskedigelse af SOSU assistentens kollegaer, og et krav om at der sku bare kan løbes hurtigere, så er det primært en ulempe for denne person. Hvordan kan det være svært at forstå?  Det hele har lidt klang af Republikanernes kampagner i USA, hvor de på magisk vis får overbevist den fattige hvide del af befolkningen om at de vil være bedre tjent med selv at skulle smide X antal tusind $ om året på en sundhedsforsikring frem for at få den gratis af staten.",0
772,"De skulle have en røvfuld så stor, at de ikke ved hvad de selv hedder, og så skal de, eller deres forældre selv betale regningen",1
1182,"> ”Vi kan jo ikke faktatjekke alting. Og når det handler om, at der er meget varmt på sygehuset, og en mand kommer ud og siger, der altså var 37 grader, der hvor han lige har været, så citerer vi ham for det,” siger han.  Fuck en omgang lort at fyrre af. ""Vi kan ikke faktatjekke alting""... Njah, måske ikke men måske man kunne starte med lige at FAKTATJEKKE DET FUCKING UDSAGN HELE DIN LORTEARTIKEL BYGGER PÅ?  Sig mig lige en gang, hvad fanden er det de underviser på journalisthøjskolen nu om dage? ",1
364,"Selv hvis man lader tvivlen komme ham tilgode, og der rent faktisk kun var rod i sagerne, kan vælgerne vel spørge sig selv, om de virkelig vil have en folkelig repræsentant som roder så meget med vores penge, og, når lortet brænder på, sygemelder sig selv?",1
2386,"Hahaha. Hvilken tråd er det i? Endnu et eksempel på svenskens ynkelige brug af censur, som de efterhånden bruger til at censurere alt fra køn, nationalitet og sikkert snart også deres modbydelige ""ködböllër""",0
2229,Selv Japaneren vil være som de stolte Danere.,0
397,Tror mere hun har hård hud i kussen.,1
1771,Et trefoldigt leve for hendes majestæt!,0
588,"Hellere være ærlig overfor sig selv, end at gå og have det dårligt med sig selv.",0
3339,[Han kneppede jo de unger synder og sammen](URL,1
103,[Stop lige en halv unge mand. Husk lige de rigtige dimensioner på vores kære Dannebrog.](URL,0
2012,"uha, jeg tror det er en farlig vej at bevæge sig ud ad: antallet af svenskens medaljer i skiløb og atletik er formentlig frygtelig meget højere end vores samlede antal i alle sportsgrene. Fx har vi kun fået én medalje nogensinde ved vinter-OL (men den var FLOT og STOR og af ÆGTE SØLV).",0
470,"Overskriften, når man ikke kan lave mad ",0
1567,"Jeg har nok haft tilsvarende dårlige dage, men med meget mindre lort, så du vinder den her.",1
1408,"Se lige alle de kristne der råber og skriger om at OP skal tæskes pga et provokerende opslag!! Nårh nej vent, jeg tænker på muslimer. Min fejl. ",1
2614,Det er så langt fra verdens største E-sport event...,0
273,Jeg vil aldrig mere klage over en lorte sommer.. Bare giv mig regn..,1
1032,"Sjovt du bruger udtrykket ""lortesommer"". I går modtog min mor et opkald fra et nummer hun ikke kendte hvor vedkommende blot sagde ""det er lortevarmt"" og straks lagde på derefter.",1
2944,[Muslim](URL,0
1174,"Her havde jeg scannet lortet ind på pc, markeret og taget hendes underskrift over i et nyt dokument og skrevet det på korrekt engelsk. Gad vide om hun fik jobbet som vennetjeneste.",1
2994,lol,0
3397,Hold nu kæft det er grineren!,1
1216,så elakt :( ;),0
1974,"RIP Svensken, du vil ikke blive savnet.",1
303,tvivler på at manden ikke kommer kun pga lidt regn i året.. tror i virkelig at det er den eneste grund? fordi så er i da lige så dumme som i påstår at trump er...,1
2250,Det er så typisk danskere at være mere ekstatiske over at vi vandt EM end at menneskeheden proppede mennesker på månen.  ^^^Jeg ^^^stemte ^^^selv ^^^på ^^^EM,0
451,De kunne sende dem til den nærmeste grænse pog smide dem af...,1
2535,"Tillykke med den flotte andenplads til Holland! Det er jo ingen skam at være nr. 2, når nr. 1 er DANMAG! Det er ligesom at lade 1000 Serie 5-hold og EM-TRIUMFATORHOLDET fra 1992 spille turnering. ",0
2460,Så det är svenska arla som gör er koldskaal?,0
494,"ja men lad os få nogle flere muslimer til landet, de er jo så fredelige og misforståede. det er sikkert postmændene der har ægget de søde og rolige knægte fordi de er racister i den virksomhed",1
2508,"Helt ärligt era danska jävlar, tyckte ni verkligen den där skitlåten var bra??",1
2354,Sign me up! Det kan da kun blive godt.,0
3056,malitetskveme!,0
842,@USER kæft et ensom liv du å have,1
2461,"Hørte engang Steno foreslå at vi dansken burde bygge en Niels Bohr statue på størrelse med Frihedsgudinden ude i vandet foran Kastrup lufthavn, så når alle folk lettede og landede ville de se denne mand som muliggjorde alt for lasere til computerchips. Jeg holder på at vi alle betaler 0,5 procent mere i skat næste år, og giver det et go. I Rio har de Jesus, I København har vi Bohr.",0
346,"Ohhhhh shit, shots FIRED!!! Eller... jeg mener, åhhh lort, skud affyret!!!",1
642,"Ævl!  En stikker, er en der sælger sine medborgere til en fremmed invasionsmagt.  En whistleblower er en, der afslører ulovlige handlinger i et firma.  &#x200B;  Ja, ""stikker"" var tidligere også brugt i kriminelle miljøer om udbrydere - lidt som whistleblowers - men sådan opfattes ordet ikke rigtigt i almindelig tale i mine omgangskredse.",1
1307,Det er lort!,1
3224,Hun er nok elendigt opdraget,1
3462,Gad vide hvordan Kjaerbye har det lige nu Aka 🐍bye,0
468,"Det er offentlig information, hvad er det, folk tror der er kontroversielt?  Hun har ingen indflydelse omkring rygning. Det er lovgivet fra Christiansborg, og hun er i borgerræpresentationen.  Hvad er det odiøse?  I øvrigt svært ikke at få et crush på hende. Hun lader til at have en fed fuck you attitude.",1
3320,[...](URL,0
15,"Idioter... selvom man ikke Kan lide manden kan man godt vise respekt for dagen idag, og anledningen",1
1944,"Jeg tror ikke at /r/Polandball/ synes godt om, at du stjæler deres tegneserie...",0
751,100% enig  jeg har droppet alle danske radio kanaler undtagen p1 og radio24syv... bare for at undgå det. jeg plejede ellers at høre en del P3. men nu spiller de kun dansk lortemusik.,1
2078,For satan hvor jeg savner det shit der.,1
145,@USER sgu da ikke hans skyld at hun ikke han finde ud af at koge fucking pasta,1
1979,"Låt bli den svenska marken, danskjävel!",1
353,"Eller folk der er ""ligeglade"" med hvad man skal have at spise, men ligegyldigt hvad man foreslår er der altid noget galt... ""Det fik jeg i sidste uge"", ""det synes jeg ikke lige"", ""Nej det er for stærkt"", ""nej det tager for lang tid"".",0
822,Tror mere hun har en lufthavn dernede,1
1249,Hvis bare vi kunne få /r/MURICA eller /r/INGLIN med på den,0
2753,Glædelig nationaldag til Grønland!,0
253,Kildekritik.... Manage,0
2322,Ni tar efter storebror ser jag :),0
1300,"Det er jo et gammelt trick blandt lorteunger.. Det ses jo også foran div supermarkeder hvor der sælges kort til SOS børnebyerne osv.. For et par måneders tid siden blev jeg stoppet foran LIDL af tre unger der spurgte om jeg ville give 50 kr for et kort, jeg sagde nej, stod så i indgangen og hørte de samme unger spørge den næste om han ville give 30 kr for det samme kort. Jeg nævnte at de sgu da godt lige kunne vente til jeg var uden for hørevidde inden de hustlede videre",1
1043,"Jeg læste med det samme det første billede som ""pludder"".",0
150,Hvad er det dog for et kort? Hvorfor er Nykøbing blevet omdøbt til Skaldyrscenter?,0
204,Carsberg er lort.,1
469,URL,0
2963,Han har metaldetektorer indbygget i hænderne! Fedt!,0
48,@USER blir altså ikk en sjov tid du “går” i møde!,0
196,"så længe der er mænd som villigt betaler 5000 for et knald, det er ikke pigerne som er dumme ?",0
1653,Ud og nyd en af vores prægtige og billige øl. Hold kæft hvor er Danmark bare det bedste land i verden.,0
2773,Hold da op jeg synes det er hårde sager det der. Jeg håber virkelig du kommer ud af det hurtigt muligt. Det må være frygteligt ikke at kunne være sig selv når man er omgivet af sin familie.   Jeg ønsker dig virkelig alt held og lykke. ,0
1574,"**Bike brothers, UNITE!**",0
2486,Sådan går det når svensken stiller op med en bumset teenager med klisterhår!,1
1245,"Jeg har altid undret mig over vores placering, i de her statistikker.  Da jeg boede i skotland (2011, bevares) blev jeg fuldstændig overvældet af hvor meget (og ofte!) mine skotske venner drak sig ned. Det var seriøst hver dag, fordi byen var altid åben. Og når jeg kigger på deres FB-billeder den dag i dag, har de stadig en drink i hånden på hvert eneste billede der ryger op.  &#x200B;  &#x200B;",0
898,"Verdens dårligste præsident. Obama dukkede op til ALT, uanset vejr.",0
1036,Verdenskort - Improved edition,0
725,"Det næste skridt er så opfordring til vold imod denne syndebuk. Denne fase er politikerne i DF for længst gået i gang med. Og det er ikke overraskende, idet vold er hjørnestenen i nazismen.",1
1843,Det mest episke billede ever! Burde være en del af billedet for denne subreddit,0
2978,Vi har i øvrigt også brug for et dansk alternativ til ‘WTF’.  HF [**H**vad **F**anden] er ikke ret sexet.,1
1139,Var vi de eneste røvhuller som dyppede karamellerne i et tyndt lag olivenolie og satte dem i køleskabet? Det var som at kaste med sten xD,1
1028,Hvorfor er svensken så humorforladt og skindød? Og lad da så for helvede Skåne komme hjem.,1
2858,Jeg elsker Danmark for meget til at overholde loven i danmark  ~ @USER  wtf,1
2820,URL,0
595,Tror mere det er det sindsyge antal indvandrere som prøver at lære sproget deroppe,0
305,"De små får fri på vores skole fordi en knægt blev blind for nogle år siden da han blev ramt i øjet  Edit: kun det ene øje, grammatik nazister... /s",1
3067,Ikke pænt at beskylde et barn for at ligne den ***,0
965,om jeg gad og kik på de araber sure fjolser,1
907,[Det er bare PostNord](URL,0
2009,Det finns ett visst mått av klassförakt med sådant här. Som om @USER eller @USER var mindre statsmannamässiga bara för att de inte läst på universitet.,0
3536,"Men husk nu på, at [A new normal demands new standards](URL",0
2575,"Ja, de satans nordmænd skal sgu ikke komme her og tro de er noget.. Det har altid irriteret mig ved den norske ostehøvl at den altid er mindre end den ost man skærer. Og man ender med sådan nogle fesne spåner..",1
2453,Har de andre flag?,0
2841,Frosne karameller og flækkede øjenbryn er da ellers sådan en dejlig tradition,0
1224,"Jeg føler vi er et overset segment som *også* er imod cykelløb, marathoner og triatlons inde i byen. Det kan sgu da ikke passe at jeg ikke kan komme ud, bare fordi 5000 idioter har bestemt sig for at løbe en tur sammen. ",1
685,"Fucking højrøvet tåbe. Det var da USA'S største fejl at vælge det fjols som president, hold kæft en tegneserie figur",1
2474,Hvordan ser man forskel på om det er en hund eller en svensker der er blevet kørt over?   Der er bremsespor foran hunden.,1
893,Jamen hvad pokker er det der sker for folk som ham ? Han er jo bindegal,1
1180,Jeg kunne aldrig gætte lorten. Til gengæld var Dr. Pjuskebusk min favorit!,1
1576,"Vi er også glade for jer :)  Vi kan altid blive enige, at svensken er dum haha",1
301,"Kæft det er sejt. Jeg droppede selv pot da jeg begyndte på universitet. Jeg har mange venner der stadig ryger.. rigtigt meget - er bange for de ender i det samme lort som du endte med at rode med.. men det er jo ligegyldigt, hvad jeg siger til dem, det kender du nok. Jeg håber du klarer den og alt falder i hak for dig - jeg regner med at have røget min sidste pind - har fundet ud af, at jeg synes det er uinteressant - måske du finder ud af det samme? Jeg føler mig i hvert fald end del skarpere og bare gladere i det hele taget. Held og lykke fremover OP. ",1
3539,Fucking Heimdal! Næsten ingen bolde kom over Bifrost i aften,1
2338,"For helvede, nu er mine trusser helt gennemblødte, jeg kan sgu ikke håndtere alle de pølser!! ",0
1005,"Af al mad, der kun fortæres ved højtider er hveder det mest kedelige som menneskeheden hidtil har opfundet.  Men fridagen er go' nok. Den skal de ikke tage fra os!",0
676,Dødsstraf,0
388,Det samme bør gælde for de der møgunger der skruer op for deres lorte musik på bluetooth højtalere..,1
65,"Jag fölar meg völdsömt stödt övar räkkefölgan äf bögstäver och täl - A-H og 1-8 ër, forütän ät vära antisemitisk (söm ï Adolf Hitler), också völdsamt älfäbët- och tällnörmätïvt.",0
2694,/r/dataersmuk,0
3188,En scene fra Peter Madsens ubåd.,0
2616,"Har ikke lige et photo, men faldt også over en kagebiks i Ueno station, Tokyo der hedder [Andersen](URLølgelig fyldt op Dannebrog, #Hygge og pølsehorn. Du ved, den danske treenighed.   Fantastisk land :) ",0
3016,"Mit eneste møde ved ham var på min snuskede stambar i Aalborg, hvor han altid kom ned og fik et par skarpe når han havde spillet heroppe. Jeg tror det var en sang jeg satte på vi lige udvekslede et par ord om. Jeg husker der i mellemtiden kom en starstruck person forbi der sagde ""wow, du er Kim Larsen, må jeg ikke tage et billede med dig?"". Hans svar var ""gu' fanden må du ej!"" Han var i fint humør og havde intet imod at snakke lidt med os almindelige dødelige og hygge sig som enhver anden på baren, men han ville have snak og ikke bare smiger fra fans, hvilket man godt kan forstå for (nok) Danmarks største stjerne.  Hvil i fred hr. Larsen",0
3222,Reverse glory hole.,0
3033,Fuck dig,1
538,Er det ikke lidt ironisk af r/all når der bogstaveligt talt er et kristent kors på vores flag?,0
882,"Hvordan kan EU sikre at vi har fri adgang til alle de amerikanske medier, hvis US indfører det her?  Hvis netflix osv bruge amerikanske servere, aka amerikansk ISP, så er de vel fucked for alle? Er det ikke derfor det er så stort et problem for hele verdenen at US skal til at stemme om det lort ENDNU en gang? Eller misforstår jeg det helt?",1
875,"Jeg havde umiddelbart tænkt lørdag formiddag/middag, vi har jo trods alt en times forspring på angelsakserne. Det vigtige er at vi kan blive enige om nogenlunde samme tid, så vi kan angribe overvældende. Desuden synes jeg vi bør holde angrebet til kun at vare lørdag, vi er der ikke for at erobre, men blot hærge.  Vi kan da lige udnytte denne tråd til at holde mønstring over skibene; Hvem er klar og hvad skyts bringer I?  Som jeg fik sagt i den anden tråd, synes jeg ikke vi skal poste alt muligt lort og vise hvor store idioter vi er, men holde det nogenlunde høfligt og blot gøre opmærksom på hvor meget vores to folk har haft med hinanden at gøre (dog gerne til dansk fordel). Hvis vi gør det høfligt, er der også en chance for at deres mods ikke bare sletter hele lortet.  F.eks. regner jeg personligt med at poste URL""Did you know, that England was once part of the North Sea Empire, ruled over by the Danish King Cnut?""  Edit: Og så måske senere poste en TIL om Anders Lassen, en dansker som modtog Victoria Cross, deres højeste militær hædersbevisning.  Og hvis man ikke kan finde noget at poste selv, så er det vigtigt at man støtter ved at upvote andre danske posts.",1
568,"Danskerne skal bare spytte i kassen til den udenlandske berigelse, og dermed deres egen undergang!!!",0
872,Ingen despacito?,0
168,Svin,1
45,Hun - og de øvrige femen - knald i låget!,1
485,"Er nogle af disse spiller på dansk? Jeg prøver at øve min dansk og som jeg kan godt lide computerspiller, troede jeg at det ville være en god måde at bruge sproget :)",0
1454,Stort set hele top 50 plejer at være lort. Gudskelov kan jeg selv vælge noget [ordenligt musik] (URL,1
276,@USER Hold munden din.,1
3148,"Sejt gået.    Altså hvis du ikke er bange for at tage toget, så vil jeg anbefale Ry-Silkeborg-Ry det er en rigtig dejlig tur.  Jeg gik den i sommers sammen med en god ven og vi brugte omkring 24 timer fordelt på dage.    Det var i sommers så det var til tider hårdt med 30-32 grader og ingen skygge, men det var fedt.  Smuk og forskellig natur, vi kom ""besteg"" Himmelbjerget som er noget af en udfordring på dag 2.  Vi modificerede vores rute lidt så vi var faktisk fri af landeveje.    Ruten leder dig rundt om Birkesø, Julsø, Borresø og Almindesø.",0
3156,Den kamp var satme en finale værdig! Landin spille sgu perfekt! Så flot fra drengene!,0
1962,Pia fældede en tåre da hun så dette smukke billede af en grænsebom.   Hvis der nogensinde er noget der har formået at holde de hedenske horder fra øst og syd ude af vores smukke land. Så er det Dannevirke og en grænsebom,0
58,Fucking smatso af en kælling,1
2230,Er de ikke synonymer?,0
84,Hvad med droide angrebet på Wookieerne??,0
2482,"Sjovt, jeg foretrækker på modsat vis min Red Bull med vodka uden Red Bull...",0
798,Fra DR's forside:  > **Donald Trump godkender offentliggørelse af omstridt notat**  > USA's præsident går imod anbefalinger fra FBI og Justitsministeriet og godkender offentliggørelsen af notat.  Hvilket omstridt notat er der mon tale om? Det kan man ikke vide før man klikker sig ind på artiklen.  En ikke-clickbait titel ville være mere i stil med:  > Donald Trump godkender offentliggørelse af notat vedrørende FBIs uretmæssige overvågning  Det er altid let at sortere imellem titler og lige finde et lille eksempel som styrker ens egen overbevisning.,0
2377,/r/SWARJE er den vej. gtfo -->,1
2699,Ej hvor er det smukt,0
1048,Manden er jo en klaphat - det er vel det som menes.,1
1288,Morsø - Diamanten mellem 2 store lorte :),1
3528,"Det lyder som en syg situation!  Jeg tror det er ved at være at der ikke er meget andet at gøre end at flygte og bryde med din familie fuldstændigt. Etinisk Ung som /u/WalkingHawking foreslog er nok det bedste bud for rådgivning til dette. Jeg kan se på deres hjemmeside de før har hjulpet folk med at bryde fra deres familie. Jeg forstår du bor på Sjælland, så at læse eller arbejde i Århus eller Ålborg kunne være en klar mulighed. Lad være med at fortæl din familie hvor du bor ligemeget hvor meget de tigger. Du kan sagtens få hemmelig adresse.  Jeg synes også du skal gå til politiet med dette her. Jeg ved ikke om de kan hjælpe dig nu og her, men sørg for at din sag bliver dokumenteret. Det vil hjælpe dig senere hvis du får brug for søge om polititilhold (hvor de lovligt ikke må komme i nærheden af dig).  Edit: Der er vist en anden der har foreslået det men jeg gentager den lige da jeg synes den var vigtig: [RED Safehouse](URLår) i æresrelaterede konflikter. Adressen er hemmelig så din familie kan ikke finde dig. De har så vidt jeg kan se en afdeling på sjælland. Deres telefonnummer er 45 11 78 00 (med døgnåbent) hvis du skulle få brug få det og de er vist eksperter i situationer som din.",0
2729,Kk?,0
1073,Sælg hele lortet og få nogle Japanere herop så vi kan installere MagLev tog.   Fra Flensborg til Ålborg med 300km/t,1
797,Ja og politet gør ikke en skid og de har heller ikke ressourcer til det,1
3336,"God ide. Jeg synes også at vi alle kollektivt skal blive enige om, at hvis man ser en af de her motorcykler, så giver man dem lige fingeren. Det bliver måske mindre fedt at køre på larmende motorcykel, hvis man får 15-20 fuckfingre hver gang man skal en tur ned i Netto. ",1
780,Desværre ramte de hende ikke,1
615,"Hellere være dum og tjene boxen, end at være klog og broke",0
3565,Det her er det bedste /r/Denmark nogensinde har produceret.  Det er ikke en kompliment.,0
496,Glemmer altid at han er den ældste. Joakim ser altid så formel ud.,0
2420,"This thread has been linked to from elsewhere on reddit.   - [/r/SWARJE] [Vi måste utföra välfärds-räder hos de smörlösa och hos Pölse knaprarna!](URLåste_utföra_välfärdsräder_hos_de_smörlösa_och/)   *^If ^you ^follow ^any ^of ^the ^above ^links, ^respect ^the ^rules ^of ^reddit ^and ^don't ^vote ^or ^comment. ^Questions? ^Abuse? [^Message ^me ^here.](URL",0
3221,Lol,0
3463,Hej fra Amerika . Kronprins Frederik som Fresh Prince er sjove. Jeg undskylder for eventuelle oversættelsesfejl .,0
1682,Hvis det var et glas pis og kostede 100kr i Matadorsedler ville det være korrekt.,0
761,Hvad er det for en Anglosaxisk leflen? Kan vi få et dansk banner!,0
630,Svenskens sprogfærdigheder: ½ Dansk + ½ Norsk + ½ Finsk + ½ Engelsk = 2 sprog. Svensken taler faktisk ikke noget sprog rent - Derfor den besynderlige lyd der kommer ud af dem.,1
2234,Det var lige før jeg faldt ned af stolen! NSFL!,0
2504,"Holy fuck, fik lige en orgasme takket være dette billede.",1
2779,Han er 100% sikkert Brøndbyfan.,0
2984,Hvilken luksus biograf bruger du hvis dine billetter koster 150kr? De koster omkring 95kr her i Frede og det er en helt fin biograf.,0
2739,"Fuckit, har upvoted dummere i dag.",1
295,phwoaarrrrr,0
740,For koldt om morgenen til shorts? Troede det var vikinger på den her reddit.  Dog mega nice meme.,0
141,Er blyanter blevet større eller er ~~@USER~~ børn blevet mindre siden jeg startede i skolen?,0
741,Fucking god humor,1
1437,Fuck polandball,1
704,"Ta er i akt, danskjävlar!!",1
890,"Syge kælling, hun skulle i fængsel for det stunt. ",1
3307,Oh fuck ja! Endelig.,1
3417,HE  HAS  NO   STYLE,0
1023,fucking lortememe,1
338,"Kan du ikke selv se, at din formulering, er krænkende “alene af den grund at en kvinde” ville det i din optik være mere troværdigt, hvis det havde været en mand. Jeg vil på ingen måde forsvare den bitch, men kvinde eller mand, så er vi lige for loven, ihvertfald i den vestlige del af verden. Jeg er godt klar over, at det kan se anderledes ud, i visse dele af verden, hvilket jeg i den grad finder både uretfærdigt, krænkende og tilhørende en for længst svunden tidsalder.",1
1191,Sikken unødvendig debat.Gør som undertegnede og støt cancer herhjemme.Vi kan og vil ikke redde hele den ganske klode,0
1138,"Hollandsk, selvreizend bakmeel.....",0
912,Så må man da håbe at hun får de 99 år istedet syge k......,1
2635,"Du skal tale dansk som hvis Google translate havde oversat det. ""naviger Til Gentofte hospital"" ville sikkert have virket. ",0
787,hvad fanden foregår der på Bornholm,1
1503,Fucking usle unger de kan stikke deres dåse op der hvor solen ikke skinner,1
312,"godt skrevet. føler med dig. Jeg håber meget du kommer på talefod med din ""kæreste"" igen. Har du ikke nogen venner/familie der kan hjælpe dig videre, i det mindste med et sted at overnatte. Har du overvejet at tjekke dig selv ind på et behandlings-sted ?  Håber alt det bedste for dig!! Selv om livet ser meget sort ud nu, skal der nok komme gode dage igen!!  ""always look on the bright side of life""",0
474,"Nu er du jo studerende og derfor prædestineret til at synes det er helt fint at folk der arbejder bliver brandbeskattet og udnyttet af det øvrige samfund, men det kommer til at ændre sig den dag du selv får et job og ser din første lønseddel. Bare lige et heads-up.  Er godt klar over at denne kommentar vil blive ned-bådet til Hades, men jeg føler alligevel det fortjener at blive sagt i denne debat. Der er meget der tyder på at vi fejladministrerer vore ""fælles"" penge. Kig på Sverige, flad og lav skat, ingen registreringsafgift på biler, lave afgifter generelt og de har stadig et godt og yderst velfungerende velfærdssamfund.   Der er et eller galt med den måde vi har strikket den danske velfærdsmodel sammen på i forhold til de øvrige nordiske lande, min holdning er at vi generelt får for lidt for alle de penge vi afleverer til den fælles kasse, men det er så bare mig.",0
576,Fuck Marvel for at gøre nordisk mytologi til et Star Wars lignende lorte univers med lasere og rumskibe,1
707,Dansk er bedre end Svenskerlort!,1
933,"Der var en kandidat for et par år siden, som hed @USER.. ",0
2198,Ahhh. En repost,0
3475,[Men min lære vil slå mig ihjel D:](URL,0
1998,"Hvis vi skulle til at fortælle andre lande om det, hver gang vi har det bedre, ville vi sgu få lange løg.",1
1581,hvad fanden fejler folk,1
2736,"Jeg ville fanme være godt knotten, hvis jeg skulle sidde på en satans bænk til et møde. Hvad fanden er det for noget!? Så ville jeg hellere stå op.",1
18,Meget naturlig reaktion hvis hun ikke vil have flere lortesøskende,1
486,Møgunger.,1
3209,"[VI ER RØDEEE, VI ER HVIDEE](URL",0
1761,9-4 Danskjävlar!,1
943,"Tjaa,det kan vel ikke overraske med den hæmningsløse indvandring og pivåbne grænser,vi ligger som vi har redt....",0
179,Falske anklager fra kællinger burde straffes ligeså hårdt som deres såkaldte ‘gerningsmand’,1
1834,Ikke engang superligaen kan de klare sig i. Skuffende.,0
1209,Det er jo ironisk at feministerne især forsøger at få heteronormative hvide mænd til at holde mund. Det er vel den eneste mandegruppe der går ind for ligestilling af alle. Held og lykke med feminismen i resten af verden hvis det lykkes.,0
1060,gem det 50 + år så bliver det mere værd.når alle tudekællingerne finder ud af vi kan ikke tie alt ihjel..,1
2346,"Hvis vi skal se positivt på det her, og det skal vi jo, så er jeg lykkelig, da blæsten var så venlig at tage genboens møgirriterende vindklokke med sig.",0
3525,"Du behøver slet ikke bruge tid på at retfærdiggøre, hvorfor du synes, det her er problematisk.. Det er fucked up!  Altså det minder om en eller anden gammel kommunistisk propagandastrategi. Det får mig til at tænke på det der helt absurde søjlediagram Socialdemokratiet kørte med under sidste valg, hvor man havde skævvredet det i så høj grad, at små forbedringer så kæmpestore ud (kan desværre ikke finde det..).  Tænker at det eneste rigtige at gøre, er at udstille det for dets absurditet. ",1
1609,Hur gick det då?,0
611,Du er fandme ik særligt køn,1
