id,text,label
1453,"Det er som det altid har været. Frihed er for os, ikke for de andre. Det er bestemt sjovere at gøre grin med de liberale på dette punkt, men strengt taget kunne du kunne lige så godt gøre grin med venstrefløjen: Tegningen oppefra, med uret: [Dét parti bliver aldrig stuerent], [Dit barn skal ikke påduttes et bestemt køn], [Fuck McDonald's], [Som hvid må du må ikke klæde dig som sort/brun/asiat/inder/muslim/etc/osv], [Som hvid må du ikke sige neger], [Du må ikke tegne muhammed].",1
2263,"Guf for øjnene, stolte danske tårer triller ned af mine kinder.. Bravo!",0
1425,[FUCK YOU!! INGLIN WILL RISE AGAIN!!](URL,1
1470,"Kæft, så kom idioterne der aldrig har hørt om knivstikkeri i dk!",1
2782,"\rant  Her den anden dag da jeg trillede hjem gennem Vejgaard, kom jeg til at ligge lige i måsen af en knallert med lad. Ikke bare en bette Puch med en mælkekasse, det var hele baduljen, og den fyldte hele cykelstien. Den var netop så langsom, at den ikke kunne køre ude på vejen uden at sænke trafikken, men også for hurtig til at cyklisterne kunne holde trit op ad Hadsundvej. Dette resulterede i at det forpulede skrummel kørte i røven af de foranliggende cyklister og dyttede af dem til de flyttede sig væk fra cykelstien, for blot at lægge sig bag de næste cyklister 20 m længere fremme og gøre det samme. Med alt dette i mente, har jeg derfor fået skabt mig et mindre vendetta mod tuktuk-lignende ladknallerter, der fylder en hel cykelsti.  \endrant",1
992,@USER så stopper du altså med alt det salt i pastaen!!,0
387,Shit man! Skal kattene med på ferie? Det er nok en god idé at snakke med kattepasserne om den potentielle lortesituation! God arbejdslyst!,1
3486,"Jeg fangede ikke r/denmark's fascination af kaj. Han er givet ret Awesome, men hvordan startede det herinde? ",0
2513,I det mindste repræsenterer han folket,0
967,@USER vil råde dig til at koge pasta rigtig næste gang.,0
858,Det her er vitterligt lort. 0/10.,1
1201,Ja selvfølgelig 3 drenge af fremmed herkomst??hvornår er nok,1
2199,/r/shittyfoodporn,1
1517,G-E-N-I-A-L  t,0
106,"JEG ELSKER MIT FÆDRELAND FOR HØJT TIL AT STOPPE MED AT OVERVÅGE DANSKERNE ULOVLIGT - @USER Jesus christ jeg håber ikke at der er nogen der hopper på den. Det er også bare en lorte ordstyrer. @USER holder sig *slet* ikke til spørgsmålet. Hvis @USER ikke vil svare, må ordstyreren stoppe @USER og gå videre til næste spørgsmål. Det kan ikke passe at han skal have lov til at snakke uden om i så lang tid.",1
2683,\^skinny bitches er guderne,1
3451,#BRÆND HEKSEN!!!,1
46,"fandme hul i hovedet... selvfølgeligt en ok måde at undgå at skulle finde på noget der faktisk er danskt, men som en forklaring er det som at sige at det ingen værdi har at være dansk udover at man ikke er svensker... fucking øl patter og hornmusik, prøv at starte med det... fristad og arkitektur, militær irellevans, vores evne til altid at brokke os på trods af hvor godt vi har det i forhold til andre land.....",1
1059,"Jeg er glad,at han ikke deltog, fordi han er falsk,og han vanærer disse soldater,der kæmpede for menneskes frihed og ære. Han er en plet på den amerikanske nation.",1
1916,Jeg elsker lugten af brændende klostre om eftermiddagen. Det lugter af SEJR!,0
1610,"Man kan næsten få lidt selvmedlidenhed, når man tænker på hvor fantastisk Danmark er i forhold til resten af verden. Os danskere er kendt for at have en tendens til biedermeierkultur. Det er jo præcist fordi Danmark er så skønt, at alle andre steder i verden ikke kan hamle op med Danmark. Græsset er aldrig grønnere på den anden side for den stolte dansker. ",0
730,@USER du er sku da syg i hoved...,1
307,absolut de gør intet de hører ikke hjemme i dk.,0
1597,Hvis man har drukket tilstrækkeligt mange øl og spist en masse røde pølser er Himmelbjerget præcis ligesom Mount Everest.,0
1365,Danskjävlar!,1
1903,## SÅ SMUKT AT SELV HOLGER DANSKE GRÆDER,0
291,"svanen ser fuc\*ing vred ud, de sorte markeringer giver den et ondt look lige som enhver dansker der ikke kan få sin morgenkaffe",1
495,Er det storbarmet?,0
2019,"Ignorance is bliss, danskjävlar.",1
924,"Jeg ville ønske jeg kunne anerkende [KORRUPT POLITIKER] som værende et FULDSTÆNDIG NORMALT MENNESKE ligesom alle os andre $USER, med fejl og mangler.   Nok skal man ikke skue hunden på hårene, men ELL har gjort så meget pis efterhånden at jeg ikke kan se bort fra, at han ligner et vellykket eksperiment i hvordan du kan skabe det mest hadfremmende menneske i fucking verden. Der er ingen billeder, hvor han ikke ligner en alien, der forsøger at ligne et menneske, og hans væremåde samt handlinger supplerer bare alle fordomme, som jeg måtte have alene ud fra hans ansigt.  Han er ikke engang uddannet indenfor miljøforskning, men som en tvivlsom Ph.D indenfor religion. Hvordan er det muligt at mose så ufatteligt meget komprimeret lort, ind på de få kubikmeter koncentreret gylle, som @USER væsen optager her på planeten?   Jeg ville ønske jeg kunne sige at hans død i det mindste kunne tjene jorden ved at gøde den, men er overbevist om at han ville finde en måde at fucke den endnu mere op.",1
3076,"hvorfor skal amerikanerne flytte og mellemøstlige blive?   Det er da en fordel i at dele landet med amerikanere, mens folk fra mellemøsten bare er svampe der suger systemet.",1
3456,Det bedste/værste af det hele er at foråret forsvandt. Der var snestorm 1. april og 20 grader ugen efter. Siden har det nærmest ikke været under 20 grader eller regnvejr,0
2390,Denna man är inte våran konung. Han kommer heller aldrig att bli. Svearike kommer stå som ensam segrare i slaget om Norden.,0
1079,Er de af glas så smid dem i flaskekontaneren du vil vel ikke have andre skal bruge det lort du vil jo ikke selv,1
1434,På på med madlavningen der hjemme Gud sikke en idiot,1
3595,Nä nu jävlar!,1
1235,ARRRRRRRRRRRRRRRRRRRRGGGGHHH!!! NU SKAL DE HA' MED TO-HÅNDSØKSEN!,0
1332,Så kan de fandme lære det! der er stadigvæk blodspor efter min skude!,1
218,"Næh, det er jo et symbol på at svensken bare er et stykke værktøj, der skal bruges af DANMAG",1
3301,"Du kan klarer den fyr, stort set alle min venner er på vej ud på samme spor, hold kæft hvor føler jeg mig ensom, når alt folk omkring mig vil er at snakke drugs",1
910,"Hun skal da selv have 99 år, den smatso.",1
998,"han kunne da vel for pokker havde taget en paraply med, det kan andre da finde ud af, men det er han vel for dum til.",1
1202,De skal ikke være her mere der er ikke krig i deres egen land mere så ud med alle muslimer de høre ikke hjemme her,1
0,Skyd for helvede. Afliv lortet !!! Tænk dog på hvor farlige de er. Hvert år dræbes danskere at de her djævle!!,1
3250,Tog mig på sengen,0
1316,@USER årh @USER shut up.,1
1346,"Ihhh....bliver sku så harm, hvad FANDEN skal det være godt for.",0
3355,zero til morgenmad? det fandme klamt,1
1589,"Syge kælling. Det sker mere og mere sådan nogen løgne der. Det er tragisk når en voldtægt sker. Der er intet mere krænkende, men det er sgu lige så tragisk at putte en i en sådan situation pga. en ussel løgn.",1
452,"Sikke da en bitch, som gør sådan noget, håber hun bliver straffet, og den uskyldige unge mand, får en behørig erstatning",1
1633,">Og hvis vi slår svenskerne, bliver vi glade  Den eneste relevante målsætning.",0
814,"Og Venstres vælgere bliver ved med at stemme på dem uden at kræve han går af. Det ville være sjovt hvis det ikke lige var fordi det er vores penge, og vores land det drejer sig om.  Jeg håber så inderligt at den mand fucker af, og tager hans lorte partifæller som @USER, @USER, @USER, osv osv med sig. Og ved du hvad, han kan også tage @USER med sig, selvom de ikke er i samme parti. Væk med jer.",1
3308,You fucking WHAT!?,1
1873,Selv svensken vil ikke være i sit eget fæle land.,1
2960,"Jeg ville seriøst melde dine fætre og din far til politiet, når du selv er kommet i sikkerhed. Fuck da det at de er familie... Hvis de kan finde på at banke dig indtil at du retter ind, så giver de tydeligvis ikke en skid for dig.  Den slags skal bare ikke ske i Danmark. De trænger til at komme ind og sidde i et par måneder og få at vide hvordan man opføre sig som voksne mennesker.",1
2545,Tyskerne kan kun lave tarvelige efterligninger: URL,0
461,"Hvaa, her lugter lidt af shadowban",0
810,Svin!,1
1823,JAAAHR! EMILIE! DANMARK! VI VAAAANDT!  FUCK UKRAINE! FUCK ASERBAJDSJAN! FUCK SWARJE!  VI VAAAANDT,1
1986,Helsingør.,0
435,letta er fandme det klammeste. 20 forskrllige klamme ting i en bøtte og så smager det stadigt dårligere end lurpak - og er mere usundt. og dyere.. suk,1
1651,Sverige og Tyskland bliver ført ud i krig og begynder at atombombe hinanden. Hvem vinder?   * menneskeheden,1
2594,Bullshit,1
945,@USER oh shit... jeg må hellere lære det,1
1362,Møgunger,1
3046,Drengo Målføj,0
1542,som vilde dyr angriber i flok .Fang dem luk dem i kontainer Åben hanen med evt Gas,1
1218,"Ny copy/pasta jeg tænker kan gå godt til billeder af kvindfolk eller mænd med lidt redigering:  > Føj for satan, det var dog sindssygt. Det ligner kraftædme din farfar valgte at begå selvmord, så klamt det er. Du skulle skamme dig over at vise sådan noget pis. Jeg har aldrig nogensinde i mit lange liv, set magen til lort. Bare tanken om at du kan få dig selv til at vise noget så ualmindeligt klamt, gør at jeg mister troen på os mennesker. >  > Din kone er en klam bunke kartofler i en kørestol. Hold nu kæft du kraftedme dum og klam. Du kan bare sende dine klamme lastbilvenner efter mig, din fucking stodder. Jeg fucking pifter dækkene på din kones klamme kørestol og klapper alle dine venner i gulvet. Klamme sæk. > > Spænder et reb fast i din klamme kones kørestol og sætter det fast bag på min bil, og så kører jeg fandme en tur med hende! > > Skam dig, din sæk!",1
283,Sindsyge kælling...,1
2441,"Eeew, sweden",1
831,"Han er en storskryende vatnisse, men at true mennesker og andre lande det er han god til",1
1156,Tak regeringen for det overarbejde i har med alle de kriminelle udlændinge,1
688,"Hah, roligaste skämtet jag läst idag!",0
1560,Nice,0
743,Tænker det er misbrugere der mangler penge til deres lort..,1
2106,/r/shittyhdr,1
3299,"Det er kraftedme en stor præstation der her, er helt oppe at køre!! Der skal i den grad drikkes nogen sejers bajere i aften",1
705,Støt dansk folkehjælp istedet :) røde kors direktør får ca 100.000 i løn om måneden. Dansk folkehjælp direktør ligger mellem 20-30.000,0
207,"REMOULADE, KÆLLINGER!",1
845,Jeg vil fandme da gerne drukne i koldskål,1
2521,[Hvad er dette for noget blasfemi over for kongeriget!](URL,0
371,"Ved ikke om det er blevet postet her før, fandt det på 4chan for et års tid siden.",0
919,Husk nu at betale SKAT ik,0
2136,"Lukas er da halvt irsk, det gælder næsten ikke",0
1040,"Vel sagt, de nordmænd jeg kender på uni er langt nemmere at komme i kontakt med, og langt flinkere end svenskerne.  Det samme gør sig gældende for finnere.  Det er sørgeligt at svenskerne er blevet så arrogante at høre på, og umulige at tale med.",1
865,"Sidst jeg købte en flaske af det lort var efter de begyndte at bruge stevia istedet for gode gammeldags kemikalier, så min gule saftevand smagte af lakrids og var derfor udrikkeligt.  Jeg køber aldrig mere Fun, når det skal være på den måde.",1
408,Så skal han ikke ind i Danmark igen så kan han blive i Irak,0
1735,Pølse til folket!,0
3204,Kan jeg foreslå 1865?,0
2908,"Det ser fedt ud!  Tænk engang, at det kan lade sig gøre.. Hos mig er der lige net nok til, at vi kan være to på af gangen.   Havde I ikke problemer med fluer?",0
2518,Sidste gang de vandt Eeurovisionen var i 1997. Vi vandt i 2000 og 2013.,0
2951,HAHAHAHAHAHAHAHAHA!,0
548,"Det er værd at huske på at Canada ifølge mange canadiere er på randen til økonomisk kollaps. Det går altså ikke skidegodt i landet og samarbejdet med andre lande, heriblandt USA er blevet langt dårligere med Trump m.m. Derudover driver Kina rovdrift på landet og er ved at puste endnu en boligbobble op i storbyerne pga. dårlig lovgivning, der tillader udlændinge at opkøbe canadisk ejendom for at hvidvaske kinesiske penge.  Hvis Canada havde lyttet til DF, så ville landets økonomi være langt bedre.",1
293,"Gammel aktiv i hæphop i 90’erne her.  For at være rigtig gammel og vrissen, så tror jeg at manglen på en scene, der IKKE er online baseret, betyder at meget lort bliver udsendt. Lort som ville være blevet sorteret fra til jams, battles, demobånd etc.   Det er simpelthen for let at komme ud i dag - derfor udgiver folk dagen efter de har snøvlet lidt i mikrofonen for første gang. Den var ikke gået i midthalvfemserne, hvor du blev savet over på scenen, hvis du var en online rapper (Oraklet er et fint eksempel)  Langt de fleste nye danske rappere har stort set ingen skills hvad angår lyrik, teknik og flow. Der er undtagelser.  Hvis folk skulle betale for musikken ville hovedparten af den playlist aldrig sælge noget som helst. ",1
1818,##FUCK JA! DANMARK LÆNGE LEVE!,1
2971,Hold kæft du er sej. Dyb respekt herfra!,1
880,@USER det er jo ikke deres hjemland ?,0
2064,Der mangler lige akkurat ikke noget på det billede..!,0
2751,"Jeg har aldrig set en hel CS kamp før, andet end nogle minutter. Men hold da kæft, det var vildt. Op og nedture, og det hele. Det var vildt spændende at se, selvom jeg aldrig rigtig har spillet CS før. Jeg har dog spillet meget cod2/4 på konkurrenceplan. ",0
1376,"Ring til Etnisk Ung. De er skidegode til den her slags sager - de kan også sætte dig i forbindelse med en kontaktperson, som kan hjælpe dig videre. Ring på 70 27 76 66, eller besøg www.etniskung.dk.   Lyv, hvis du skal, for din egen sikkerhed. Det er der ingen skam i. Få et lortejob et sted, eller start på et studie. Flyt hjemmefra, gerne langt væk.   Bor du i København? Læs i Aalborg.  Geografi er en kraftig faktor. Det bliver hårdt, og det er ikke din skyld, men der er ikke nogen vej udenom. Edit: husk på, at du også kan bo på kollegie under en ungdomsuddannelse.   Held og lykke, for helvede. Send en PM, hvis det er.",0
2972,"Misundelsen er uendelig stor, fedt de dropper forbi det lokale venue.   Jeg må dog indrømme at det er flere år siden jeg sidst har set stand up live, og endnu længere tid siden jeg har besøgt comedy zoo. Så chancen er nok lig 0 for at jeg havde været der uden at det var publiceret i forvejen. ",0
2704,Danske javle!!,1
1010,"Paraply betyder regnskærm på fransk. Regnvejr som undskyldning for at aflyse? Der må være en anden grund. Måske de horder af antifa og andet afskum, der vil slå Trump ihjel.",1
2500,Nu er det jo også de Ikea-aber der har lavet spillet.. Det i sig selv gør det uspilleligt.,1
3060,Stor tilykke! God jul til dig også.,0
151,"Oversættelse tak, jeg forstår ikke djævlesprog",1
1344,I samme boldgade kan nævnes Ole Ahlberg  Hans kunst er med fokus på Tintin.  URL,0
779,Skal see om jeg kan få overtalt lidt folk til at kigge forbi på papas med mig og få det tested.  Hvis der er andre der kunne tænke sig at prøve så sig til fordi tror ikke jeg for over talte mange.,0
3472,"Well, som postbud forstår jeg godt, hvorfor man ikke har interesse i at uddele pakke om aftenen/natten.  Desuden er det ikke anderledes med DHL, gls, bring etc etc.  Forstår ikke postnord hate. Som om folk ikke ved, at postnord feks er forpligtet til at udlevere post til alle adresser i Danmark. Det vil altså sige, at hvis hr Jensen der bor på Lars tyndskids mark skal have et brev, bare et enkelt, så kan det tage 10-15min at få det ordnet. Det tager tid og penge, og derfor må du få fedte dig ud af døren for at hente den pakke 😊",0
2778,Plejer altid at holde vejret på det mest strategiske tidspunkt og så dreje af. Er villig til at cykle betragtelige omveje for at undgå den slags livsnedbrydende adfærd.,0
3364,"Hej Bjarne,  Kan du svare mig om IF kan tage CHAR?",0
332,Man har ikke levet før man har fået pustet kokain op i røven af en bagerjomfru,0
1087,ja de havde sandsynligvis kioskhår,1
1695,NED MED SVENSKEN!,1
1971,#Majestætiske væsener!,0
1806,Jag säger bara /r/minecraft,0
1155,"Hold dig væk fra vores ø, du dansker lort.",1
2374,Det värsta är att det är sant också! DANSKJÄVLAR!,1
2789,"Jeg var sku ikke så heldig at have Cartoon Network, så jeg lå på sofaen og så engelske serier som EastEnders og Landsbyhospitalet. De var sindsygt kedelige.",0
191,Fuck bøsserøven Macron og længe leve mandfolket Trump,1
1358,"Hver mandag og fredag fra kl. 17.30 er der flæskedag på [Det Lille Apotek](URLæsk, hvide kartofler og persillesovs. Det er en lille fantastisk restaurant, og efter min mening Danmark's bedste når det angår klassisk dansk cuisine; ikke sådan noget ny nordisk NOMA-shit.  Med mindre du bor i én af vores kolonier (Grønland, Færøerne, Aalborg - Skåne er ikke undtaget), så har du indtil på tirsdag kl. 22.00 til at nyde vores nationalret, eller blive mødt med omgående eksil til (gisp!) Sverige.  EDIT: Min eneste kritik af restauranten er at de bruger Comic Sans på deres hjemmeside.",1
2531,## OPHYGGE TIL ALLE,0
1,Satans danskjävlar!,1
2059,"Nemt?!? Til gymnasiefester var det min tysk lære der stod i baren, jeg mit forsøg på at bestille en øl på tysk kostede en karakter...! ",0
2087,Heb ik wat gemist? Tyskerne igen på krigsstien?,0
432,Fuck nogle møgdyr det er jo ren mafia bare for at de kan støtte de åndssvage bådflygtninge,1
732,"Jeg er sgu lidt forvirret... hvad var det Danske Bank lavede lort i, denne her gang?",1
617,Norge^har^Pusur...,1
867,"Jeg mindes hvad vismanden @USER sagde i sit show ""Anden på coke"" i 2006: Netto er jo et tempel over lort Hans ord står stadig til den dag i dag",1
2415,*Danskjävel,1
202,@USER det er derfor du laver mad herhjemme,0
2949,Det er fandme fugtigt det dér!,1
3177,Man kan finde charteret her: URL,0
1831,Fuck det er godt lavet det der!,1
1152,Jeg skal gerne bruge en kasse med seks flasker.,0
9,Hvordan i helvede fik de overhovedet dit nummer!? Klamme spionland.,1
606,"Der er ingen der holder på dem, så bare smut. ",0
165,Læg den op på r/SWARJE! Så kan de lære sandheden om deres ynkelige nation!,1
3131,"Jeg tror det vil være dejlig køligt, men jeg vil have det meget meget svært, såfremt personen i billedet skulle lægge softicen der. ",0
2125,Du varmer øllet din stodder!  Men glædelig jul alligevel!,1
2151,/pol/ havde ret.,0
3267,"Hold kæft mand, det er føles som om det kun er et par år siden. Jeg har stadig ikke helt fattet at det rent faktisk skete, for mig er det stadig bare noget jeg så i nyhederne da jeg var 12. Det er som om at min hjerne nægter at tænke på hvor tæt på os det egentlig var.  I stedet for at tale om hvordan mennesker som gerningsmanden bag skulle dræbes eller straffes, synes jeg hellere vi skal tage et øjeblik, og kigge på vores medmennesker. Kigge på hvordan de har det, og være opmærksomme på om hvorvidt de har brug for hjælp.   Så meget som jeg nu engang ville elske det, så kan man ikke undgå forfærdelige gerninger som denne med 100% sikkerhed. Nogle gange starter en naturkatastrofe med et mærkeligt fænomen i havet, andre gangen i hjernen på en mand, der ikke blev holdt nok øje med.   Det varmer sku mit hjerte at se så mange personlige historier herinde, både fra danskere, men også fra brugere fra Norge og Sverige. Man kan godt glemme hvor heldige vi er i Norden nogle gange, og andre gange (som f.eks. den dag for 7 år siden) virker det næsten respektløst at kalde os det, men lige meget hvad, så elsker jeg jer sku allesammen, hold kæft hvor holder jeg meget af det sammenhold vi alle har!   🇳🇴🇳🇴🇳🇴",1
146,"Hvad kalder man en medicinstuderende, der har fået 02 i alle sine eksaminer? Læge.",1
962,Passiv aggressiv måde at kalde dig for et pikfjæs,1
2712,Af en eller anden grund er det klart de store body guards der ser mest akavet ud her. Men jeg er skuffet over manglen på hjelme! ,0
764,"Smid dem på gulvet, og tramp på dem.",1
114,Pas så mand! Han hopper bare på hende haha,0
1007,"Det er da menneskeligt og savne sin kone/mand, en dansker tager også til Thailand når de savner deres koner",0
1836,Det mest præcise jeg længe har set!,0
2279,"Kaj kom selvfølgelig op i de sociologiske konsekvenser af migmigernes stadigt eskalerende politiske indhold. Æhh.. Jeg mener, også mig tak. ",0
1862,imo har Kaj og Andrea potentiale til at gå hele vejen internationalt,0
2549,"“Hvad fatter gør, er altid det rigtige. Mest fordi han ikke er svensk”",0
2221,Hur gick det i hockeyn då? ,0
2325,"Jeg kommer fra Irland men tale en smule dansk, kan jeg ophold her også?",0
483,"De tre mænd forsøgte at stjæle Holger danske. Politichef udtaler , 'luk lortet ned forhelvede! De skide svenskere stikker af med vores kulturarv!' ",1
1878,URL,0
1926,Fuck Sverige! Bogstaveligt talt.,1
841,Hahhaaha lær det biiiiiaaaatch,1
1223,God Bedring til Dronningen,0
3341,Han kommer til at overtage fra Pind. You heard it here first.,0
2343,Grundlagde Danmark ikke mere eller mindre Norge?,0
265,Ingenting er mer gøy enn å gi svensken en skikkelig smekk på rumpen!,1
3020,Fedt indlæg,0
52,Skøre madamme!,1
2042,Det var oppe og vende for en uge siden. [Link](URL,0
1252,"Fint nok at hun er uenig, og fint nok at hun giver udtryk for det - men jeg har sgu svært ved at se værdien af at lufte babserne i fri dressur mod Trump?",0
1548,Han skal ikke have lov at komme tilbage,0
1587,"XD fair nok at lave porno, og fair nok hun er måske klog, men man er sq ikke klogere bare fordi man bruger sine patter xD sq dumt sagt xD xD men ja helt sikkert klogere end de som er dumme at betale for at se hende xD",0
2553,"Disco-dasco slut-fuel! ""Several Variants!""  I love my country.",0
817,Aber,1
1943,JA! FUCKING JA!,1
3514,"Øllebrød, senpai! ",0
1131,“Jeg er folketinget”,0
2180,Engelsken er begyndt at vågne op! MAKE IT RAIN DOWNVOTES!,0
2510,De er fandme nogle Köttbullar!  badum tschhhhh,1
2857,"Haha era danskjävlar, vad håller på ni med? Är ni tokiga eller?   Skrattade ändå, tack Danmark! Kamelåså!",1
2684,Hva' med de fuckhoveder Venstre?,1
99,"Nu er det USA, der skal der ikke beviser på ens skyld, det eneste de kan finde ud af er straf, lange fængselsstraffe og ingen penge til husleje under straf og ingen løsladelse penge",0
1538,"Det er så typisk danskere det her..  Typisk dansk sommer: ""det regner for meget, det er en dårlig sommer, Jeg rejser fandme sydpå hvor det er dejligt varmt""   2018 - rekord sommer! ""det er for varmt, der er for tørt, Jeg må ikke grille, Jeg kan ikke spille computer, min røv sveder osv. ""   Den her sommer er dejlig! Ja det er varmt, Ja det er tørt. Nyd det mens det varer. Inden længe når vi vinter også tuder danskeren over det er for koldt, for glat, for vådt und so weiter. Ingen er nogensinde tilfreds. ",1
507,Var det ham der sad i en lort?,1
3428,HVAD DRIKKER HUNDEN AF?!,0
520,"Mangel på Respekt, føj siger bare tænk at man ser sådan på sine egne landsmænd på den måde aflyse grundet lidt regn, vejert fejler ikke noget det er påklædningen og respekten for nogle der offerede sig for at vi kan leve frit. har stadig heller ikke glemt den udtagelse han kom med sidst over for en veteran, "" jeg har ingen respekt for en der lod sig tage til fange""",0
1912,HAHA DEN ÄR INTE ENS DANSK DANSKJÄVLAR FÖRSÖK BÄTTRE NÄSTA GÅNG!,1
1132,Hun er sikkert ikke den eneste kvinde som bruger bryster til tjen penge. Der findes nok også andre kvinder der bruger bryster indirekte til kom frem i verden på,1
3281,Har muligvis lavet en sang med ork puns.... URL,0
187,Han har stadig ikke lært hvordan man skal opføre sig som en Statsleder.,0
1827,URL,0
616,"Danskerne er så meget til grin! Hvad venstrefløjsere, pladderhumanister og""venligboere"" ikke har koster skatteyderne!!!!",1
2580,HURRA!  Margrethe viste mig den app.,0
1798,Wat,0
3446,"Hej Bjarne,  C++ har været mit primære/fortrunke programmeringssprog i over 10 år, så jeg vil naturligvis starte med at takke dig for dit store arbejde og for med C++11/14 at have gjort C++ til lige frem at være en fornøjelse at udvikle i.  Jeg kunne naturligvis stille dig massere af tekniske spørgsmål og give dig mange flere rosende ord, men vil tillade mig i stedet at stille dig et lidt personligt spørgsmål.  I dit interview med Paul McJones ""Oral History of Bjarne Stroustrup"" siger du mange rosende ord om  Danmark og siger lige frem at det er et af de bedste lande i verden at leve i. Alligevel vælger du ikke at bo i dit hjemland.  Kan du uddybe lidt hvad der var afgørende for den beslutning?",0
3,Fuck første maj. Busserne kører ændret rute og derfor misser jeg min forlæsning om forberedelse til eksamen. Fucking fantastisk,1
88,"Jeg vil tro, vi slår dem i udlændingestramninger",1
2187,"De skal bare vente til at vi ØØØERLAGGER dem, så kan de endelig blive representeret af det pæne og skønne Dannebrog i stedet for det patetiske svenskerbanner, der bare flyder ud i havet.",1
746,"Igen en ligegyldig nyhed fra udlandet ,vi bor i danmark tosser",1
472,Hold kæft noget 9gag lort.,1
2869,"Nu er det også lidt dumt at sammenligne hvor meget skat der er mistet over en periode på flere år med en fast årlig post, ikke?  Granted - det er stadig slet ikke ubetydelige tal, men det er bare lidt dumt at sammenligne pærer og bananer for at overdrive ens budskab.",0
1726,Danskjävlar! *hyttar med näven*,1
111,"har @USER løkke en cand.jur? Er det betragtet ""low""? ",0
