id,text,label
1200,Samtidig er der masser af kommunistisk materiale som stadig er tilgængeligt på dba. En ideologi der har kostet mange flere menneskeliv.,0
2578,Skåne > Halland & Blekinge,0
2051,##ENDNU ENGANG SER VERDEN MISUNDELIGT PÅ DEN DANSKE UOVERTRUFNE VISDOM OG KUNNEN##,0
616,"Danskerne er så meget til grin! Hvad venstrefløjsere, pladderhumanister og""venligboere"" ikke har koster skatteyderne!!!!",1
1508,Vigsø er det bedste danske jeg har hørt længe. Det andet er for meget bling-bling lort,1
885,[DRIK OG DRÆB!](URL,0
3542,"Go Jakob.. Go Formel 1!  Selvfølgelig skal vi have Formel 1 til København, hvis vi får muligheden",0
266,"Du får en upvote, men gider vi overhovedet have England tilbage lige nu? De er blevet lidt indspiste og tossede siden vi gav dem tøjlerne, specielt på det seneste. Lad os i det mindste starte med at befri Skåne og Norge.",0
1906,[NEJ! så här tillverkar man el!](URL,0
2348,Landet som bliver kaldt swedistan og som sælger granater i deres pizzariaer skulle være nordens konge?,0
2736,"Jeg ville fanme være godt knotten, hvis jeg skulle sidde på en satans bænk til et møde. Hvad fanden er det for noget!? Så ville jeg hellere stå op.",1
2321,Ingen kommentar? Hvad mon folk tænker og ikke ytrer sig om?,0
372,[Vi har allerede vundet](URL,0
905,@USER det pasta må virkelig have været dårlig.,0
1448,Så har @USER og @USER taber venner været i byen. Send regningen til de radigale,0
32,Bamses julerejse var dope.,0
3136,"Vil sgu næsten mere sige at det passer på /r/bonehurtingjuice, specielt fordi det er ubevidst.",0
2712,Af en eller anden grund er det klart de store body guards der ser mest akavet ud her. Men jeg er skuffet over manglen på hjelme! ,0
1207,"de bor i England, de bor i det fineste og dyreste kvarter, deres eneste indtægt er denne, så min ikke de indbetaler skat¿  De kan jo lige som ikke forsvare hvorledes de kan betale den dyre husleje, hvis de registeret til 0 kr. i indtægt....",0
2941,Godt gjort.,0
3267,"Hold kæft mand, det er føles som om det kun er et par år siden. Jeg har stadig ikke helt fattet at det rent faktisk skete, for mig er det stadig bare noget jeg så i nyhederne da jeg var 12. Det er som om at min hjerne nægter at tænke på hvor tæt på os det egentlig var.  I stedet for at tale om hvordan mennesker som gerningsmanden bag skulle dræbes eller straffes, synes jeg hellere vi skal tage et øjeblik, og kigge på vores medmennesker. Kigge på hvordan de har det, og være opmærksomme på om hvorvidt de har brug for hjælp.   Så meget som jeg nu engang ville elske det, så kan man ikke undgå forfærdelige gerninger som denne med 100% sikkerhed. Nogle gange starter en naturkatastrofe med et mærkeligt fænomen i havet, andre gangen i hjernen på en mand, der ikke blev holdt nok øje med.   Det varmer sku mit hjerte at se så mange personlige historier herinde, både fra danskere, men også fra brugere fra Norge og Sverige. Man kan godt glemme hvor heldige vi er i Norden nogle gange, og andre gange (som f.eks. den dag for 7 år siden) virker det næsten respektløst at kalde os det, men lige meget hvad, så elsker jeg jer sku allesammen, hold kæft hvor holder jeg meget af det sammenhold vi alle har!   🇳🇴🇳🇴🇳🇴",1
3438,Det er fandme et stærkt album! Tak for grinet :),1
645,"Han var nok bange for at regnen skulle opløse alt det stivelse, der holder hentehåret på plads, så vinden rigtig kunne lege med det og vise hvordan han reelt ser ud",0
681,"Ja mange folk der elsker at sidde og grine over evangeliske kristne og deres evolutions-benægtelse, er ofte uvidende om hvor udbredt evolutions-benægtelse er blandt danske muslimer. ",0
1178,"Hvis vi kommer i store problemer, så Anders Fogh kun en sms væk!",0
783,Vis endelige ikke Trump resultater. Kun fejl,0
3226,Det de siger er at det eneste forhold der er lovligt ifølge stærkstrømsreglementet er mellem en han og en hun.  Det er smukt ...,0
1148,"Hmm, konflikteret",0
3406,"Jamen, det tror jeg så på og glæder mig.....",0
2930,"Ikke for at forsvare folk der kører uden ringeklokke, da det jo er lovpligtigt, men hvorfor er det bedre at ringe med en klokke end at råbe ""bagfra""?",0
217,Hold nu kæft for fanden landet går jo ikke ned fordi den gamle er blevet rep lidt,0
835,Helt enig med KU. Offentlige socialister bare grådige pattebørn.,1
296,Og ikke bare til forsiden - til toppen af forsiden!,0
2059,"Nemt?!? Til gymnasiefester var det min tysk lære der stod i baren, jeg mit forsøg på at bestille en øl på tysk kostede en karakter...! ",0
1567,"Jeg har nok haft tilsvarende dårlige dage, men med meget mindre lort, så du vinder den her.",1
2353,Puha bliver helt lækkersulten,0
2938,Det er ikke nationaldag :D,0
102,Jeg stemmer for! Hvornår skal dette mageløse togt finde sted?!,0
679,Oh ffs skal vi nu til at snakke om det lort igen..,1
3596,Er det nok til at få dispensation mod det afbrændingsforbud der er lige for tiden? Destruktionen af denne vederstyggelighed bør i hvert fald være risikoen for en skovbrand værdig.,0
2389,2uhyggeligt4mig,0
1316,@USER årh @USER shut up.,1
539,Når vi engang har akkumuleret nok storhedsvanvid kunne vi angribe noget amerikansk med billeder af ikke eksisterende hospitalsregninger og kontoudtog med SU-overførsler,0
1051,God bedring,0
222,Flot Dame,0
1418,Det burde blive straffet at indgive falsk anklage og få samme dom som den anklagede stod til.,0
559,Dagens største grin!   For satan det er godt. Overlegen lort .,1
3485,heldig zeus,0
2122,"Flot præstation af svensken, **på papiret.** Men når flertallet af medaljerne kommer fra Dalar-hestedressur og 100 meter surstrømning, så falmer glansen lidt.",0
1713,"Haha, det er genialt!",0
2843,Jeg elsker det billede!,0
774,"Man er ikke nazist fordi man samler på genstande fra 2. Verdenskrig. Jeg forstår godt fascinationen i at samle på det, det tyske styre var imponerende, hvad de formåede at stable på benene.  Men af den grund, fordi man samler på genstande, kan man godt forbande og holde afstand fra de ideologier, fordi det er forkert det de gjorde.  Har selv en tysk officer kniv, den vil jeg aldrig skille mig af med.",0
3200,Lige til et stockfoto,0
1843,Det mest episke billede ever! Burde være en del af billedet for denne subreddit,0
2939,Var det virkelig sådan at Mohammad skulle forestille at se ud den gang?,0
2583,"Hør Hør, men jeg syntes også vi har brug for en demokratisk afstemning om hvor vores universelle velfærdssamfund skal opfører institutioner for de svage i samfundet. syntes personligt at vi måske skulle planlægge et togt mod /r/swarje",0
659,"> Man kan ikke sove om natten,   Det er ikke så nemt som normalt, men man kan komme langt ved at holde temperaturen så langt nede som muligt, i stedet for dyne så brug et tomt dybebetræk, en bord-blæser det ikke står for tæt på gør også meget.  Sørg for at lukke døre og vinduer, når er varmere udenfor end indenfor, og omvendt. Jeg ser skræmmende mange danskere åbne alt om dagen i forventning om at det på magisk vis køler, og lukker så snart det bliver mørkt og koldt udenfor.  > Bilen er varm som en grillovn  Jeg har en sort bil, som ofte er så varm at jeg hverken kan sidde på sædet eller røre ved rattet, når jeg skal køre. Det er ikke det store problem, hvis man har AC:  Åbn vinduet ved passagedøren, luk alle andre vinduer. Åbn/luk førerdøren 5-10 gange. Luften i bilen er nu udskiftet.  Åbn så alle vinduer og begynd at køre. I løbet af et par minutter er det nok tid til at lukke alle vinduer.  Efter køreturen, tjek at du ikke efterlader sodavand i bilen. Overvej at dække for solen, det burde virke men jeg har ikke prøvet.  > og man får generalforkølelse hvis man kører op for klimaanlægget.  Nej, det gør man ikke.  Men husk at bruge det korrekt. Det giver ikke mening at sætte den på fx 16 grader når der er 30 grader udenfor. Normal behagelig temperatur er for de fleste omkring 21 grader. Har du er velfungerende klima-anlæg, så den den på 21 grader og ellers bare auto.  Har du ikke et velfungerende klimaanlæg men i det mindste en fungerende AC, så sørg for at det ikke er koldt. Heller ikke bare på ansigtet. Sæt anlægget til at blæse på dig, og juster temperaturen så luften hverken er varm elle kold, eller måske en smuuule koldt. (Må dog gerne være dejligt koldt de første 5-10 minutter.)",0
1430,Man er vel os lidt dum vis man ikk ka tjene penge på en anden møde,0
3437,"Ork, idéer har vi jo nok af!",0
3031,et bælte af læder er en mulig løsning,0
2046,##OG DET VAR DANMARK!,0
1319,Det er så smukt :' ),0
2243,HVOR,0
2595,Gyldent stunt.  -Dét er sgu den ægte vikingeånd!,0
396,Det virker som om der er mere og mere idioti i verden,0
3147,"Fungerer det virkelig sådan?  Anyway, jeg synes sku det er plat det her.",0
2645,"/u/boobiebanger tillykke med 2. pladsen på URL""all time"". Du har lige overgået Elgiganten memet. /u/averagemonkey troede han var rigtig smart med sit trump meme, men nu kan vi kåre dig som månedens memer i stedet.  Stærkt arbejde. ",0
589,@USER bare om at makke ret!,0
886,Føj sådan nogen svin,0
714,"Nu kører du da helt ud over kanten, hvornår har dit hadeobjekt DF undertrykt kvinder og skåret hovedet af folk? Hiv nålen ud af armen og vend tilbage til virkeligheden.",0
2346,"Hvis vi skal se positivt på det her, og det skal vi jo, så er jeg lykkelig, da blæsten var så venlig at tage genboens møgirriterende vindklokke med sig.",0
849,Man kunne næsten skifte elgen ud med en asylansøger.,0
937,"Hvad har det overhovedet med sagen at gøre? Ja det ville jeg, de vi ikke bruge det som pynt.",0
3507,"2 indvandre drenge, en trommemaskine og en autotune. ",0
1187,Hahaha hold nu kæft han er kær!,1
3086,"JAKOB FUGLSANG TOUR DE FRANCE WINNER   2017 2018 2019 2020 2021  ONE NATION, FUGLSANG",0
70,Syntes man begynder at høre mere om partering af kroppe... det må åbenbart været en fetish føj brækker mig,0
2732,"Undskyld mig, men de fleste i Danmark har samme holdning til Tyskere, Svenskere såvel som Sjællændere. ",0
240,Skal vi lege: Gæt en farve ?,0
3383,Ved godt det her får downvotes og deres eksempel er måske lidt overdrevet men jeg mener de har en pointe også selvom jeg ikke ser mig selv som en skør feminist,0
3010,"Man skulle tro @USER ville elske et forslag der ville gøre Danmark mere upopulær i Mellemøsten, det er da det der er pointen med en stor del af den udlændingepolitik der bliver ført.",0
475,"Bare smæk kassen i, så kommer det nok helt automatisk ?",0
445,Det samme bør gælde for de der møgunger der skruer op for deres lorte musik på bluetooth højtalere..,1
2820,URL,0
1395,bare hun huske at betale skat og ik kommer hjem når hun bliver syg og nasser på der danske sundhedsvæsen,0
273,Jeg vil aldrig mere klage over en lorte sommer.. Bare giv mig regn..,1
1562,de er da pisse ligeglade..,0
2076,Hvordan leger man stægt flæsk med persillesovs?,0
1138,"Hollandsk, selvreizend bakmeel.....",0
111,"har @USER løkke en cand.jur? Er det betragtet ""low""? ",0
245,Dansk Guld,0
1821,"Nøj hvor er det flot. Jeg kan altså ikke undgå at poppe en semi, når jeg ser det røde flag blafre med den blå sommerhimmel som baggrund.  Skål!",0
2206,"På mit historiehold er vi begyndt at sige ""Fuck Sverige"" i stedet for skål. ",1
2314,Jeg brækkede mig lige. Bare antydningen at det pisgule flag på nogen måde kan udfordre vores smukke Dannebrog er jo sygeligtgørende for enhver.  Undskyld mig mens jeg går hen for at spise nogle røde pølser og drikke en cocio.,0
473,"Man tramper da ikke på Historie... Så er der godt nok meget der skal tilintetgøres, hvis alt der har en tragisk historie ikke må være til..",0
1735,Pølse til folket!,0
1768,URL,0
2012,"uha, jeg tror det er en farlig vej at bevæge sig ud ad: antallet af svenskens medaljer i skiløb og atletik er formentlig frygtelig meget højere end vores samlede antal i alle sportsgrene. Fx har vi kun fået én medalje nogensinde ved vinter-OL (men den var FLOT og STOR og af ÆGTE SØLV).",0
682,"Han er flyttet til Nordirak, ikke hjem til Syrien, vi tager jo heller ikke hjem når vi handler billig Nutella syd for grænsen.",0
431,[Lidt rød Aarhus :)](URL,0
1114,Det går indtil hun en eller anden dag kommer i hænderne på en tosset person eller bliver påført en kønssygdom som ikke kan helbredes.  Så det er meget risikabel levevej.,0
1529,Han er jo ikke andet end en failass reality star,0
2654,> Enjoy your velfærd.,0
2368,[Tråd på /r/SWARJE ](URL,0
1135,Der gik vist lidt for meget viking i den laban. Mon ikke han hidkaldte Odin under sit voldsorgie?,0
2248,Vi är iallafall originella och lånar inte ord som teenager och computer,0
1388,Send dem hjem og luk ikke flere ind,0
1752,"Danmark er mange gode ting, men det er nok et af de værste steder at være turist i. Huffington Post er bare hoppet på Scandijerk dae le sooo progressive omg vognen.",0
374,Excellent,0
3179,Jeg arbejder i psykiatrien; halvdelen af vores læger staver værre og begår sig mere kortfattet end det der i journalnotater. Det er så pinligt.,0
3121,"Han lægger jo også ud med at bruge [Force Choke](URLå hende lige [forinden](URL#!/02:40) (2:40). Skynder sig at sige ""Dét var ikke min skyld."" :D",0
3380,"Tænk, hvis amerikanerne blev lige så fornærmede, hver gang nogen sagde noget kontroversielt om deres land, og gik lige så meget op i at forsvare sig mod hver eneste lille ting tv-værter udlægger om dem. De ville have nok at lave.",0
2080,Hvis jeg elsker Danmark og hader gud er det så tilladt at downvote?,0
2060,For fanden da... Lad os hjælpe ham med at stjæle svensken,0
791,Til gengæld er deres evner til at tale dansk også faldt tilstødende.,0
2800,"Tag dig ikke af dem der siger den er forkert. Det er netop fordi de ikke forstår humoren i den! Kan sætte mig ind i ""fordommene"" som danner disse kategorier og netop derfor er den genial. ",0
2329,"Sverige er et godt sted, præcis som det er.  Det er sådan en fin lille eksistens som man altid kan tænke på hver gang man har det lidt dårligt, også får man det jo bedre bagefter :)",0
178,er der nogen der siger at hun ikke kan det?,0
614,Var det ikke mere rigtigt for 20 år siden?,0
80,Synes godt lige at vi kunne tage forbi /int/ en gang  URL,0
971,"Igen ødelægger de få det for de mange. Hvorfor finder samfundet sig i det. Hvis man vitterligt ved hvem det er så få fat i krapylets forældre,og start med at stikke dem en regning for hærværket. Og få dem til at forstå at de har pligt til at styre deres mindreårige børn,ellers får det konsekvenser. Og så er jeg i øvrigt ligeglad med hvem eller hvad deres forældre er....hvis de ikke betaler må det fratrækkes forældrenes løn eller overførselsindkomst.",0
15,"Idioter... selvom man ikke Kan lide manden kan man godt vise respekt for dagen idag, og anledningen",1
792,Vi kan da godt hjælpe dem op i det rigtige fly !,0
2725,"Hun smiler ret stort, mon hun har prøvet blyanten?",0
2506,Ha! Svensken erklærer kulturelt nederlag ved at erklære krig på angelsaksisk. Har I glemt jeres eget sprog?,0
1629,HVOR ER DE RØDE PØLSER??? >:(,0
3594,Smukt,0
3183,Kontekst: [URL,0
1640,**Dette** er en ægte daner  URL,0
994,Tæller det her som blackface?,0
814,"Og Venstres vælgere bliver ved med at stemme på dem uden at kræve han går af. Det ville være sjovt hvis det ikke lige var fordi det er vores penge, og vores land det drejer sig om.  Jeg håber så inderligt at den mand fucker af, og tager hans lorte partifæller som @USER, @USER, @USER, osv osv med sig. Og ved du hvad, han kan også tage @USER med sig, selvom de ikke er i samme parti. Væk med jer.",1
1170,"Lyder som den perfekte kone jo, smuk storbarmet og elsker at lave god gammeldags mad",0
181,Brænd hele lortet ned og start forfra.,1
1597,Hvis man har drukket tilstrækkeligt mange øl og spist en masse røde pølser er Himmelbjerget præcis ligesom Mount Everest.,0
1895,Naturligvis!,0
40,Nå,0
2922,"Vent, hvor pokker er Ejderen?? Jeg troede det var hele Danmark vi snakkede om her",0
2701,Kaj som memenister!,0
2828,"Hørte intet fra mit kontor i Aarhus, sad ellers og ventede på det 😞",0
519,Det sgu heller ikke okay. jeg havde sgu også blevet sur !,1
2655,+1 for krydret migmig,0
1027,Godt at se at Corydons berømte integritet er begyndt at smitte af på Børsen.,0
440,"fravær betyder bare at du en gang imellem skal ind og snakke lort til din studievejleder - intet andet.  På mit gym gjorde de vanvittigt meget ud af at sige at fravær bare ikke er i orden, og at man vil få både fjernet SU og blive smidt ud af skolen som resultat af for meget fravær.  Men skete det nogensinde? Nope.  Jeg gik i klasse med et par drenge der havde omkring de 30% i slutningen af hvert år. Fik de advarsler? yep. Fik de trusler om at blive smidt ud og få fjernet SU? yep. Var det andet end tomme trusler? Nope.  På den anden side så kan jeg heller ikke pudse min glorie for meget. Der var fandme mange dage hvor jeg på vejen hjem fra gym kunne have tanken om ""Hvad fanden har jeg egentlig lært i dag?"". Når det går op for en at du kan bruge op til 8 timer på at sidde og repetere stof du allerede har styr på/stof du forstod i første omgang så bliver det fandme svært at motivere sig selv til at stå op klokken 6:30 så man kan sidde der klokken 8-16.  Samtidig bliver det svært hvis at motivere sig selv hvis man allerede er bagud i et fag, og ved at man kommer til ikke at forstå en skid, og samtidig holde klassen tilbage (specielt i gruppe arbejde). Det eneste du opnår er at vise din lærer hvor elendig du er (mindre karakter), og lade dine gruppe kammerater i stikken.",1
2896,Underrated meme,0
3019,Hvor er Eye Q henne?,0
1473,"Nationens sikkerhed er i fare, hvis vi forbyder omskæring af drengebørn, pga. USA, Israel og muslimer, hvor flertallet er omskåret.   Så kan man tænke over, hvor frit et land vi i virkeligheden (ikke) er.   Religionshensyn og krænkelsesret står i dag reelt over ytringsfriheden. Trist. ",0
1925,SUR,0
2379,"Håber ikke at jeg bliver landsforvist, men østrigerne har drukket lige så meget som os og availability'en af alkohol er lavere end vores. Det er da dedikeret.",0
127,Godt hun er glad. Videre.,0
661,"Han er en torsk, der er så teknologisk udfordret at han ikke burde sidde i den magt han gør.",1
2510,De er fandme nogle Köttbullar!  badum tschhhhh,1
618,Hvornår er luder begyndt at betale skat,0
576,Fuck Marvel for at gøre nordisk mytologi til et Star Wars lignende lorte univers med lasere og rumskibe,1
777,"Jeg mener ikke at en mand er mere troværdig. Jeg konstatere blot det faktum at vi lever i en tid, hvor en kvinde kan sige hvad som helst og ordensmagten hopper i med begge ben. Jeg siger ikke at det sker hver gang, men det sker for mange gange.",0
2255,godt set...,0
2863,Indponereneimponerende! smid det op på /r/mapporn,0
1096,Pdykopat,0
3249,Tak for de sjove kommentarer 🤩  Here er en update: Min bror har skrevet sin egen på engelsk i stedet for danglish og går ned og får den underskrevet idag.   En lille bonus: hans kones navn var også stavet forkert 😎👍  P.s 1000 tak for mit første guld!!!,0
1773,Jeg vil så også lige sige at den svenske course først kom for et par dage siden.,0
1069,"Vi er røde, vi er hvide, og nu skal vi fandme da være stive!",1
2613,Det forklarer busserne.,0
2437,"Hvad satan, det er sgu da ikke sommer endnu, er det?",0
3060,Stor tilykke! God jul til dig også.,0
3232,Analgafler,1
720,Haha den er spot on. Jeg læner mig tilbage og venter på at tråden bliver væltet af racister.,0
1475,FUCK NU SOVER JEG BEDRE I NAT,1
453,Magen til skønhed er aldrig blevet set før!,0
2623,[Fantastisk stærkt kørt](URL,0
3006,"Ja mojn du, hol' æ kæft.",1
1015,Godt brølt brormand!,0
368,"Behold hellere tøjet på, piger",0
3373,"en vis mand sagde engang til mig:  ""Hvis du ikke kan huske en skid har det været en god fest!"" :D",0
2167,Man kan se skammen i deres ansigter.,0
3247,Du koster jo rundt med os.,0
2713,Kvalitet på /r/Denmark !?,0
3315,Alt er breaking. Det er den eneste måde døende medier konstant kan gøre opmærksomme på sig selv på telefoner og andre apperater.,0
1654,Inte ens i Danmark vill man dricka dansk glögg.,0
623,Det var klokt gjort av dig! Bra val.,0
1406,Syns da hun ser ganske dejlig ud*ssss* - Lad os se et billede af dig? Skal nok kommentere det,0
2237,Hæhæhæ,0
2071,"forstår ikke hvorfor Danmark, der ellers bliver anerkendt som en af de bedste lande til engelsk som andet sprog, bliver vist som så dårlig til engelsk",0
1429,Arme kvinde oh manden der han har ski meget alvorlige problemer....,0
766,"WHAT ?? En operation , der ikke blev udsat og patienten sendt hjem ??",0
423,Hele flygtning systemet er lavet sådan de skal blive her så ja,0
1404,I ubåden ffs,0
1535,"Kan da ikke passe, på den pæne ø",0
459,"Gu skal vi ej hjælpe dem mere, de for rigeligt i forvejen",0
2005,"Jeg kan ikke lade være med at tænke på, om man kan betale sig fra en god placering på de her lister...",0
1161,"Klog?? Ha ha for mig at se har hun taget den nemme løsning, klog ville være at tjene dine penge på andre måder. men det finder hun vel ud af, når hun engang ikke kan sprede ben for penge mere. idioti",1
2193,Risengrøden skal have lurpark på. Og kanelsukker. O g en god øl vef siden af!,0
1998,"Hvis vi skulle til at fortælle andre lande om det, hver gang vi har det bedre, ville vi sgu få lange løg.",1
2776,**Moldova**: Det er svært at finde det rigtige flag **Danmark**: Hold min øl,0
1056,Danske kundskaber og værdier er faldet i trin med at DF har fået mere magt!,0
3052,Opstemme for Danmark's bedste is!,0
2491,"Øhh... Sagde han ikke lige, at vi var blevet gode venner med Sverige igen? Er der et memo jeg ikke har fået?",0
156,"Hvis ikke der er en grund til at flygte, skal de selvfølgelig ikke flygte.",0
253,Kildekritik.... Manage,0
1694,Danskarna börjar få att Sverige är bäst,0
1330,Og det var Danmagg og det var Danmaaaag Ole ole ole,0
1310,"Nedlæg alle de indsamling. Største parten af beløbet går til administrationen, og direktørløninger. Lad Staten betale, eller EU.",0
2102,Troede det var København?,0
3550,"You go, girl! ",0
278,knullebehovet var sterkere enn frykten,0
3357,bruhhhh,0
1165,Å det' ær Frajasaaaal! Å det' ær Frajasaaaaal! *Djøøøøt! Djøøøøt!*,0
1348,Lobbyist ‘reklame’ news! Og det er stadig ulovligt!!!,0
339,Manden er idiot.. End Of Story,1
2779,Han er 100% sikkert Brøndbyfan.,0
461,"Hvaa, her lugter lidt af shadowban",0
3295,"Føj for Satan, det var dog sindssygt. ",0
2097,Tag /r/iceland tilbage!,0
692,"Hun er jo så vild! Hun træner sammen med landsholdet hver dag kl. 6 på Bellahøj Svømmestadion. Det er fedt nok at man bare kan lægge sig på banen ved siden af og prøve på at følge med.... Det lykkedes aldrig, sjovt nok, men det kan klart anbefales! Kanske jeg skulle tage et /r/DANMAG skilt med op og bede hende om at holde op? :D",0
3442,"Det er da en fin ide.   Nu er jeg personligt selv også en større kyllinge fan end oksekød. Det hænder da jeg får jeg mig en bøf eller en burger, men som udgangspunkt er jeg mest til fisk og fugl, og ellers svin - men problemet med svin er også at finde noget der er opbragt på en bare delvist ansvarlig måde.  Generelt mener jeg at kød burde koste mere, der burde produceres mindre, men til gengæld skulle kvaliteten også være deroppe af.   Men helt klart - hvorfor dog ikke? Som fødevareproducent kan jeg da godt se at det ikke er helt fedt - men som forbruger er da det i grunden mindst ligeså relevant som dyrevelfærd, kalorietal og tilsætningsstoffer. ",0
63,"Jamen så er det jo heldig jeg ved det. Med andre ord, det er er ikke @USER og @USER de skal lede efter.",0
1648,Jeg troede [den her](URL,0
2912,RIP. Han var et dansk kulturikon.,0
2509,Ja ja vi ses på havet! URL,0
2057,##GØR SOM EN DANSKER OG UPVOTE DANSK.,0
3448,Færøerne kostede Danmark mere end en millard kroner sidste år r/[URLænge Færøerne bliver i rigsfællesskabet da vi er i gang med at overtage flere og flere områder så som international affærer og luftrum.,0
3237,"Derefter siger han ""fjern den top, skat""",0
3325,"Folkemøde der holdes det samme sted, længst væk fra folket, år efter år. Brilliant!  En vattet version af Bohemian Grove ",0
249,SMUKT  Kan du linke billedet uden teksten? Så er der ny baggrund på computeren!,0
1769,Min nye skrivebordsbaggrund.,0
1682,Hvis det var et glas pis og kostede 100kr i Matadorsedler ville det være korrekt.,0
3284,Tog vi os ikke af 2 giraffer? Som begge hed Marius?,0
621,Tillykke til både Danmark og Island  - Hilsen fjeldabe,0
1626,"(Island tæller ikke, da de ikke er uafhængige)",0
2440,"Der er et svensk flag! Fy føj da, jeg vil ikke se på sådan noget, ad ad",0
935,"Nu var @USER, som er portrætteret til venstre, dog en dansk sagnkonge. Endelig ikke gør sådan en stolt dansk figur til en svensker!",0
1152,Jeg skal gerne bruge en kasse med seks flasker.,0
895,"TV2 er klart clickbait, men DR laver også clickbait artikler ind i mellem - og uanset hvad så kan jeg godt lige klare at gå ind og læse artiklen, hvis det betyder jeg kan spare licens",0
2658,lol,0
5,"Minder mig om det 25 årige black army medlem jeg mødte på OBC for nogle år tilbage, han var også stukket i låret, og samtidig på flugt fra politiet på vej til Kbh. Det vildt det stadig foregår.",0
815,Må man så give dem en på bøtten i stedet for at putte noget i bøtten?,0
787,hvad fanden foregår der på Bornholm,1
3157,Danmarks nye national ret,0
117,"Det danske flag er rødt og hvidt, og det tyske flag er møg beskidt.",1
1847,"Det er ikke engang sjovt, det er bare dybt forkert... Jeg ville ønske jeg kunne sige at jeg forventede bedre, men det er nu engang folket bag ""kulinariske specialiteter"" så som surstrømning og lutfisk",0
