id,text,label
460,Det lige som når en eller anden mand lige pludselig kommer gående med en masse blomster i armene efter at have været på en kirkegård i Århus Har sågar under mit arbejde hørt en mand aflevere en bukket hos hans afdøde bror for at se blomsterne er blevet stjålet dagen efter . Virkelig beskidt !,0
2487,ÆGTE DANER! GUD BEVARE DANEMARKEN,0
619,Ett bra skämt är ett bra skämt //en svensk,0
850,"Satan en flot tus på hendes lår, har du lavet den ",0
285,Manden skal sq da ikke bevise sin uskyld!!! Hvad hvis han havde en dag hjemme uden alibi? Nej de skal bevise hans skyld. Og det forsmåede pigebarn burde få de 99 år. Og betale hand kaution.,0
1528,Cowboy Henk på r/Denmark? Det er som en drøm der udkommer  Edit: jeg mener selvfølgelig: det stikker jo helt af,0
1723,"[Come at us, bros!](URL",0
1491,Det eneste der kunne gøre det bedre var hvis de hvide svaner fløj i formation foran en rød solnedgang.,0
1090,Giver aldig til indsamlinger. Der er alt for lidt oplysninger om hvor pengene går til,0
268,Det er EET stort bedrag....det har aldrig været deres hensigt at forlade Danmark..det er meget få der er reelle flygtninge. Alle syrerne kan i princippet godt rejse hjem nu. Landet er 95% sikkert.,0
3375,Ja tak. Og jeg kører selv mc. ,0
1845,straight up pimpin,0
1902,/r/polandball er ikke særlig glade for at man lægger deres indhold op på andre subreddits. Syntes lige jeg ville nævne det :),0
510,"Alle i min by hører udenlændinge ""danske"" rapper. Det lyder ad lort til. Kender fanme ikke til god musik i den her by, det er fucking træls!",1
29,De Vestindiske Øer?,0
2792,Lidt upassende at en pressefotograf tager billeder lige ved rustvognen til en begravelse?,0
3451,#BRÆND HEKSEN!!!,1
854,Jeg tror en da at netop *dette* Dannebrog er så flot at det har brug for et nsfw tag ;),0
2561,Hans manager må simpelthen være en af de mest talentfulde managere der findes.,0
23,"1 million sort om året, sætter sit præg på tilværelsen, ligegyldigt hvilket job ",0
2836,Glem ikke mig! Glem ikke mig!,0
2789,"Jeg var sku ikke så heldig at have Cartoon Network, så jeg lå på sofaen og så engelske serier som EastEnders og Landsbyhospitalet. De var sindsygt kedelige.",0
831,"Han er en storskryende vatnisse, men at true mennesker og andre lande det er han god til",1
3048,Kronprins Fredsdrik ftw!,0
2692,Man skal stoppe mens Kajen er god. Det her går over grænsen. Har de overhovedet popcorn derovre?,0
1118,"Overraskende. Jeg trodde at vi nordmenn var dårligst i engelsk.   Mange danskere svarer på uforståelig engelsk når jeg snakker til de på norsk, selv om jeg forstår dansk like godt som norsk etter å ha bodd i Danmark.",0
2541,"Argh rolig nu, jeg kan nu godt forstå at svensken gerne vil hedde det samme som os, men det jo bar' ærgerligt.",0
286,"husk at stave det første ord rigtigt, når nu i svarer på denne kommentar.",0
3516,"Fandme søgt migmig. Morgenmad er nok ikke det eneste måltid hun spiser, og hvad er der galt med brød. Det er da bedre end ingenting.",1
1662,"Fuck det er smukt, jeg slår helt en tåre",1
2266,Jeg har arbejdet i pølsevogn hele dagen og har slet ikke brug for at se flere pølser!,0
1127,"Det her bør være øverst, fordi han er en røv med øre og hans hoved bør være nederst, fordi han kun kan lukke lort ud.  Og det er sagt af en som er mørkeblå.",1
1452,Dygtige i kan angribe i flok... Viser jo bare i er dyr,0
2006,[Bra](URL,0
72,"Hvad fanden sagde du lige om mit lands indvadrerpolitik, din lille kælling? Jeg kan fortælle dig, at jeg dimitterede som den bedste i min årgang i frømandskorpset, og jeg har været involveret i adskillige hemmelige angreb mod IKEA, og jeg har over 300 bekræftede drab. Jeg er trænet i elgekrig, og jeg er den ypperste finskytte i hele Danmarks Riges væbnede styrker. Du er intet andet for mig end bare endnu en satans svensker. Jeg vil udslette dig med præcision, hvis lige aldrig er blevet set før på denne Jord, du skal satme mærke dig mine ord. Du tror, du kan slippe afsted med at sige sådan noget lort til mig over internettet? Tro om, bror lort. Imens vi taler, er jeg ved at kontakte mit hemmelige netværk af spioner på tværs af Norden og din stank af surströmning bliver sporet lige nu, så du må hellere forberede dig på stormen, orm. Stormen, der udsletter den ynkelige lille ting, du kalder dit liv. Du er kræftædeme død, knægt. Jeg kan være hvor som helst, når som helst, og jeg kan dræbe dig på over 700 måder, og det er bare med LEGO-klodser. Ikke blot er jeg omfattende trænet i at kunne styre min brandert, men jeg har adgang til hele Siriuspatruljens arsenal, or jeg vil bruge det til dets fulde effekt til at udslette din stakkels røv fra kontinentets overflade, din lille lort. Hvis bare du kunne have vidst, hvilken ugudeligt grusom gengældelse din smarte lille “kommentar” var ved at bringe ned over dig, så måske du havde varet din skide mund. Men det kunne du ikke, det gjorde du ikke, og nu betaler du prisen, din forbandede idiot. Jeg vil skide raseri ud over dig, og du vil drukne i det. Du er fandme død, knægt.",1
2264,Tack för 12 poäng till Sverige. :),0
3302,Noget nyt?,0
3307,Oh fuck ja! Endelig.,1
425,Fedt der er tilbud på billar! De er så gode :D,0
936,tak hr. skelet,0
2308,"##15,29 CM REN DANSK MAND.",0
1476,"Jeg mener at DFs ideologi har klare nazistiske elementer, og at DF vælgerne udmærket godt ved det, men støtter dem alligevel. Og det er jo også derfor at DF og nazisterne er to alen af ét stykke. ",0
1548,Han skal ikke have lov at komme tilbage,0
2689,Vi mangler lige Blond skiltet der blev smadret,0
808,r/agario,0
1219,Det beviser jo at kvinder lyver så vandet driver af dem når de bliver skildt,0
2943,"Rimelig ensporet holdning i kommentarfeltet. Alle der er imod juridisk abort bliver downvoted. Alle der er for bliver upvoted. Tror ikke det er sådan en debat foregår, men lad mig da lige smide en lang kommentar også:  Jeg synes juridisk abort altid er et svært emne, fordi det lidt er en case til case vurdering for mig. Skal man kunne sige ""næh det gider jeg ikk"" fordi kondomet sprang og plan b pillen ikke virkede? Skal man kunne sige nej, hvis det har været planlagt og ønsket, men man går fra hinanden eller får kolde fødder? Fordi selvfølgelig skal man kunne sige fra når man er blevet taget i røven (metaforisk) og en pige man mødte i byen prikkede hul i kondomet eller stealther. Sidstnævnte er IMO voldtægt, for det er ikke de præmisser der blev indgået. (Og ja, p-piller kan være en præmis, men ofte så spørger mænd faktisk ikke, de antager. Så frafalder den altså.)  Jeg tror også det kan være vigtigt, at kvinden skal meddele manden om graviditeten inden for en bestemt tidsramme (12 ugers tid er måske fair?) så han kan få noget betænkningstid, i tilfælde af at det var et uheld. Men så skal han også få meldt ud efter lignende tidsramme inden fødslen, så kvinden ved hvor hun står.  Bevisbyrden ligger hos begge. Og jeg synes at juridisk abort skal foregå enten gennem papirarbejde ved enighed, hvor begge skriver under, og ellers må der komme en mindre retssag ud af det. Så må det være op til en dommers vurdering.   Uanset hvad, vil man aldrig kunne gøre det perfekt, men jeg synes man skal passe på med argumentet ""jamen kvinder kan vælge at abortere og beholde, så hvorfor kan vi ikke også fravælge??"". Ikke mange kvinder (raske, ihvertfald) vælger at tvinge en mand til at få barn eller abortere uden seriøse betænkninger.  TL;DR: Jeg er enig at en form for juridisk abort for mænd skal være en mulighed, men at man skal være ENORMT påpasselig med lovgivningen omkring det. Desuden skal det i tilfælde af uenighed være en case til case vurdering af en myndighedsinstans. Der burde ikke være backsies når det kommer til børn.",0
995,Hmm ---> URL,0
745,lol,0
1005,"Af al mad, der kun fortæres ved højtider er hveder det mest kedelige som menneskeheden hidtil har opfundet.  Men fridagen er go' nok. Den skal de ikke tage fra os!",0
139,mon ikke at det samme kunne ske hvis manden indgav falsk anklage.,0
3342,"Kan vi ikke spare de gifteksperter vi har siddende i døgnvagt, og bruge pengene på bedre ting?    ""Det skulle man tro, Hr. Løkke. Men danskerne er nogle idioter, der spiser deres stueplanter.""",0
1813,we wuz,0
1193,Den orange farve forsvinder nok i regnvejr,0
1857,Hvor har man fundet sådan et skønt tog? Libyen?,0
2419,Ligger den på et lagen?,0
1887,Det svenske flag fortjener ikke bedre behandling,0
1408,"Se lige alle de kristne der råber og skriger om at OP skal tæskes pga et provokerende opslag!! Nårh nej vent, jeg tænker på muslimer. Min fejl. ",1
1216,så elakt :( ;),0
1442,URL,0
3195,Klap dig selv på skulderen!,0
2033,##UPVOTES OG RØDE PØLSER TIL ALLE MAND!,0
3198,Fantastisk. Hvis ikke jeg havde været fattig havde du fået guld.,0
1143,"mon ikke han ligger i graven om 50 + år... det er vel allerede en del værd, fordi det er et samleobjekt. Men man skal ikke igang med at glorificere nazismen ",0
2626,"Tillykke! Kan slet ikke sætte mig ind i, hvor fedt det må være, at stå med det færdige spil i hånden. Godt gået!  Bare af ren nysgerrighed, hvad mener I med ""100% danske""?",0
3095,Äö,0
135,@USER Du er også lidt derhen af med din pasta,0
1140,Der er også dem som bliver krænkede af at se et par skosåler. Hvis vi ligger under for alle krænkelsesmuligheder kan vi snart ikke røre os.,0
3337,Photoshop 0.2,0
2666,"Hvis nationaliteten faktisk er relevant, er det selvfølgelig helt fint at nævne den, men det står jo alt, som bare er tilnærmelsesvist dansk. Man kan finde ""Proud to be Danish."" crap på en Volbeat video osv. :/  Hvis en video f.eks. handler om, at en udlænding ikke fatter et eller andet i Danmark, så giver det jo meget god mening at give en forklaring på hans/hendes spørgsmål og nævne at man faktisk *er* fra Danmark og ikke bare er en udlænding med et tilfældigt gæt. Desværre må jeg give OP ret, da det er på rigeligt med videoer osv. hvor det absolut ikke er relevant.",0
1327,Rigtig god bedring til vores Dronning ...,0
1507,@USER godt du ikke har en kæreste,0
1363,da de højst sandsynligt er på kontanthjælp er det alligevel dig og mig der betaler,0
79,"Meh, jeg kunne ikke rigtig lide den.",0
83,Det er saten-ralme fugtigt detektivarbejde!,0
1666,Der må da være tale om medlidenhedskram?,0
1901,ulækkert,0
687,URL,0
1994,"Hil drot og fædreland  Hil hver en danneborger,  som virker, hvad han kan  Vort gamle Danmark skal bestå,  så længe bøgen spejler  sin top i bølgen blå",0
812,ved ikke om du stadig bor i næsteved eller omegn:),0
716,Flot krop,0
1751,##IKKE-SVENSK STOLTHED,0
3475,[Men min lære vil slå mig ihjel D:](URL,0
2278,"Det er ret dansk... Men der mangler billeder af Kim Vilfort og John ""Faxe"" Jensen.",0
743,Tænker det er misbrugere der mangler penge til deres lort..,1
1355,De skal hjem,0
1505,Sexisme og racisme?,0
3114,"Jeg har en 10-årig nevø der spiller mange af de der spil med gambling-esque tendenser. Det gør mig ret nervøs, især fordi han netop snakker om alle de aspekter ved spillene med et stort smil på læberne. Jeg tror, og håber, dog, at min bror har ret godt styr på hvad der foregår når min nevø spiller.   Alt det med loot boxes er virkelig noget svineri. Det er designet til at udnytte børn der ikke ved bedre, og folk der er disponeret til fx ludomani. Der skal virkelig strammes op. ",0
283,Sindsyge kælling...,1
3335,HVOR,0
573,Jeg skal binde dem til en seng,1
880,@USER det er jo ikke deres hjemland ?,0
497,"Glædelig jul, kære fjeldabe <3",0
1329,Krænkelse mig her og krænkelse mig der - man bliver såååå træt,0
3258,Hvad sker der i den originale scene?,0
1436,Mon det bliver oplyst til skat ?????,0
1124,Føj,0
1467,"Sålænge gøre de det efter deres eget valg, skal man respektere deres valg. Jeg ser ikke noget problem i det, de har de rette kompetencer for denne branche. Der er sgu mange,som gøre det samme herhjemme, men de skjuler det, eller de kalder det sugerbabe. Potato eller kartoffel, same shit but different name",1
1841,MALMØ ER FORSTAD TIL KØBENHAVN,0
3568,/r/faderligejokes,0
1112,Altså rolig nu. Mådke er manden syg. Har oplevet det før da jeg arbejdede i bagerbutik. Havde en kunde der stjal avisen næsten hver gang han købte morgenbrød.,0
1421,De er alle i stor fare vis de bliver sendt hjem. Altså ikke når de skal på ferie. Der holder de slemme forfølgere jo også ferie. Det gir da sig selv.,0
551,Hr Glistrup. Folk ville ikke være på dig. Se hvad der er sket. Og vi har fået nogen som hedder venligfolket som elsker dem,0
3535,"Da jeg var knægt, var der nogen af 9. klasserne der kastede med griseøjne. Uden pis.",0
3033,Fuck dig,1
1795,Like hvis I græder HVER GANG,0
2675,Et drømme scenarie,0
649,"God grund til at danskerne føler sig snydt og bedraget af politikkerne . Send dem hjem hvis de har adgang til deres land , om det er ferie eller besøg. Velfærds turister høre ikke til her i landet.",0
526,"En udmærket dag til at supplere vore planer om at tage Skåne og Norge tilbage, med en plan om at tage Estland tilbage. Det har ikke umiddelbart nogle negative sider så vidt jeg kan se. ",0
1778,NIELS IUUL!,0
3186,Det er du altså sluppet for billigt omkring,0
660,"Den er væk, nogen der har et mirror til denne meme?",0
2209,Betyder det vi kan kolonisere Sverige helt legitimt i verdens øjne for at bringe dem civilisation?  \#ScrambleForSverige,0
1497,"Hip-hip, hurra!",0
2790,Lige til r/Copenhagen,0
1188,Man får jo næsten ondt af dem... Næsten.,0
3423,"Jeg har stadig et en misfarvet krakeleret sticker med giftliniens nummer på mit køleskab selvom mit barn for længst er voksent. Det er ikke én mand i en kælder, men bare en vagthavende.  Det er forøvrigt fedt at der er et sted man kan ringe hen når ungen kommer ind og erklærer ""jeg har spist blomster.""",0
428,Havde jeg pengene ville jeg købe det. Det har jo noget historisk værdi. Og om 50 år år kunne det være meget mere værd. Ville dog ikke sælge det for en hver pris. Ville aldrig sælge det til nazister.,0
1004,Det er vi sgu blevet vandt til.,0
1661,Er det separatist flag i baggrunden?,0
1552,@USER !!! Du slap billigt,0
1100,"Trump ved ikke hvordan det er at være Soldat,han var ikke selv meget soldat.",0
1674,"Svensken i Sverige, dansken i Rio!",0
335,@USER.. Så må jeg sku godt brokke mig lidt når maden bliver for sund,0
603,Nu blev jeg sulten og letter røven fra reddit - tak.,0
1324,Hvad er det med danske bank og det der hvid vask noget? Kan nogen forklare?,0
1345,Er vi stadig verdensmestre i ungdomsdruk?,0
435,letta er fandme det klammeste. 20 forskrllige klamme ting i en bøtte og så smager det stadigt dårligere end lurpak - og er mere usundt. og dyere.. suk,1
569,Hmmm vet ikke helt hva jeg syntes om dette her du ...,0
2516,Men hvor er Svensken?,0
2775,En såkaldt “dobbelt muhammed”.,0
3587,"Bitcher du på Roskilde, så er du ikke gammel nok.",1
2710,Det genialt. Politikere lidt nok til de sikkert kunne love der ødelægger e-sport i Danmark eller lignende. Det ville jo være lidt grineren. Ikke fordi jeg ikke kan lide e-sport,0
2439,"Det ville være synd ikke at gøre dem opmærksomme på at Danmarks eksport af gris, nærmere betegnet bacon, er den eneste grund til at de hver dag kan nyde deres klassiske engelske breakfast!  Jeg er desværre selv på skiferie og kan derfor ikke deltage i dette raid af de engelske kyster :(",0
3411,Han er helt perfekt til de intro sange,0
2995,Hun er og vil altid være tabt bag en vogn.,0
1592,"Ja, men det er også snart jul i Østeuropa.",0
629,@USER der kan du selv se hvor heldig du var,0
636,Nogle der har billedet i højere opløsning?,0
420,"Det er jo heller ikke som om vi lader små børn gå alene rundt i trafikken før de har lært at færdes dér.  Klassisk at tage den mest kontroversielle sætning i hele artiklen og sætte som overskrift uden kontekst. Flot, DR.",0
1040,"Vel sagt, de nordmænd jeg kender på uni er langt nemmere at komme i kontakt med, og langt flinkere end svenskerne.  Det samme gør sig gældende for finnere.  Det er sørgeligt at svenskerne er blevet så arrogante at høre på, og umulige at tale med.",1
2686,"Javell, JAVELL, javell?",0
333,Det ville Bing aldrig gøre!,0
2136,"Lukas er da halvt irsk, det gælder næsten ikke",0
1153,Så kan man også pisse i bukserne - uden at blive våd !,0
1882,Et nationalt fyrtårn blandt juicebarer og sushi-restauranter! Hvilket åsyn!,0
2466,"Hmm .. Counter spy all up in this bitch?  Lav en liste over subs så som inglin, danmag, osv, for alle lande der kunne være en trudsel. Så tjekker vi dem efter skumle planer.  For selvfølgelig er der skumle planer. Danmag er en stor magt, alle vil have en del af citron månen!",0
1976,Jeg vil lige prøve det:  Fuck Svensken.,1
2773,Hold da op jeg synes det er hårde sager det der. Jeg håber virkelig du kommer ud af det hurtigt muligt. Det må være frygteligt ikke at kunne være sig selv når man er omgivet af sin familie.   Jeg ønsker dig virkelig alt held og lykke. ,0
908,"Kunne snildt være derfor politiet var ekstra opmærksomme mht. den sorte Volvo V90. Et par dage før 13 årsdagen, opfører sig suspekt, flygter når politiet vil tale. Hvis det var i nærheden af @USER giver det meget god mening. ",0
1820,###En smuk skibsnation,0
2267,"Danernes overlegenhed er jo ikke til at stoppe!   Måske vi skulle arrangere disse events noget oftere? Selvfølgelig ikke kun mod INGLIN, men hele over alt på reddit? ",0
3188,En scene fra Peter Madsens ubåd.,0
699,*En patriotisk tåre triller ned ad kinden på mig*,0
3017,"Idéen er god, men CO2-udledning er blot én ting, der belaster miljøet.  Det er alt for teknisk, og behæftet med fejl, at gå ind og lave sådan en måling.  I stedet kunne man overveje et miljø-mærke. Det vil dog nok skabe forvirring, da et økologisk landbrug ofte er mindre miljøvenligt, end ikke økologiske landbrug...  Bæredygtighed bør måles ud fra udledning af stoffer, der ødelægger ozonlaget, forbrug af vand, begrænsning af destruktion af natur og dyreområder, ""bi-catch"" ifm. fiskeri osv. osv... ",0
1863,Dette billede fik mig til at føle en sådan patriotisme at en tåre løb ned af min kind.,0
3203,OP's ide med tre tråde er da noget genial karmafarming!,0
110,"Når, det var ellers et cool repost, motherfuckker! URL",1
2796,"Den der giraf er jo tydeligvis også syg og misdannet, og burde have været aflivet to gange bare for at være sikker. Den ligner jo en blanding mellem en Grand Danois og en Lama. Ugudeligt!",0
1075,"Endnu et tidligere arbejderkvarter, der er ødelagt af de tidligere arbejderpartier",0
3538,"[DR.dk](URLå clickbait, så bruger [dr.dk/nyheder](URL",0
3007,SÅ DER DØMT OP-STEMME FEST!!!,0
1643,Marken er en del større end man skulle tro - det er der vi henter al malt til vores guld-tuborg.,0
1509,"ja, pu ha, vores religion for eksempel, med al dens tortur og menneske brænding - bare eet eksempel.",0
909,Dungarn lyder bare som et lorte sted på Nørrebro...,1
1702,URL,0
39,"Reklamer irriterer mig alle steder, men af en eller anden grund faktisk slet ikke i biografen. Især ikke hvis man er i biffen med en ven man ikke ser så tit. God plads til lidt sludder inden filmen/trailere starter. Ind imellem er der også en god en da",0
3481,"Er der noget der tilter min skorsten fuldstændig, så er det når det begynder at regne bedst som man har gang i grillen!",0
1510,Hurra!,0
2250,Det er så typisk danskere at være mere ekstatiske over at vi vandt EM end at menneskeheden proppede mennesker på månen.  ^^^Jeg ^^^stemte ^^^selv ^^^på ^^^EM,0
1862,imo har Kaj og Andrea potentiale til at gå hele vejen internationalt,0
337,Hahahaha @USER troede du var den eneste psykopat- der er åbenbart flere som reagere lidt voldsomt,0
1350,"Der må da være en eller anden der har et Overvågningskamera siddende, men Politiet har nok ikke tid at følge op på det, nåå men det er snart Jul, så ønsk en ny Bil.",0
1967,MEN HVOR ER SVENSKERNE MAND!!!!,0
265,Ingenting er mer gøy enn å gi svensken en skikkelig smekk på rumpen!,1
1764,Fejr det,0
2041,"HEY! Bilar er jo sådan det eneste gode der er kommet ud af Sverige og så var ham der Alfred Nobel fyren vel heller ikke værst, men så er der fandeme heller ikke mere der er værd at nævne.",1
1990,Holger Danske kniber en stolt tåre,0
3023,Epic!,0
2468,Dere kan jo ta båt fra hirtsals til Kristiansand,0
3359,URL,0
1186,Jeg var studerende på Danmark fra USA i 1994 og kan stadig snakke noget Dansk. Jeg elsker Danmark!,0
1073,Sælg hele lortet og få nogle Japanere herop så vi kan installere MagLev tog.   Fra Flensborg til Ålborg med 300km/t,1
1865,"Nu er der vel ingen risiko for at dette er ulovligt vel? Bare for at være sikker, er ikke helt opdateret på dette felt",0
199,Dronningen er altså ikke syg,0
1919,"Jeg får næsten lyst til at se De Grønne Slagtere igen, bare fordi Mads Mikkelsen er en god skuespiller.",0
2408,Jeg er har stadig ikke hørt sangen. Efter min mening lidt af en bedrift i sig selv !,0
493,[Norsk udgave af Olsen Banden](URL,0
2582,Er dette billede fra i dag? Hvor er det henne?,0
3035,r/unexpectedsmash,0
2034,Det ser sku' godt ud!,0
2270,"Hvis du med svedsken mener Mohammad, så ja. :p",0
122,"Der findes for mange syge mennesker i verden, der ikke kan finde ud af at koge pasta",0
2837,Det vare bare en lille svensker jeg fandt nede i parken.... Folk vil jo have min Kylle Rylle!,0
536,Gid Danmark var en republik.,0
2384,Er dette på /r/all?,0
512,Det er også ligegyldigt med fremmedsprog: vi skal jo alligevel lukke os mere og mere om os selv og vores egen lille hønsegård.......,0
2410,Svensken kan man ikke få at se. Det' der ikke noget at gøre ved.,0
779,Skal see om jeg kan få overtalt lidt folk til at kigge forbi på papas med mig og få det tested.  Hvis der er andre der kunne tænke sig at prøve så sig til fordi tror ikke jeg for over talte mange.,0
1033,"Syndt at det koster 200 betjente hver gang der er fodboldkampe plus alle dem der spilder tiden ved tåbelige grænsekontroller, de kunne være brugt bedre her..",0
2317,"Storartet!   Lille forslag: Tænker nogle af de tomme stole kunne gives til Dissing+Andersen + et par nobelprisvindere, Grundtvig osv. Og Vitus Bering og Knud Rasmussen på en isflage i kanalen :p",0
3289,Hilsen fra ~~G~~Frønland,0
2937,Vender tilbage til Danmark på ferie efter mange måneder her på Færøerne. Jeg kommer til at blive stegt.,0
1704,Hvorfor leger de ikke gemmeleg i Sverige?  - fordi ingen gider at finde dem,0
2986,"Hvem har taget billedet eller sagt på en anden måde, er det OC? For i så fald skal det være kandidat til månedensbillede. ",0
1172,"@USER ja lad os lave en statue af @USER, det også historie! Retard!",1
1035,Opdannebrog til venstre!,0
1373,Føj for satan,0
1792,Man bruger den til at låse svenskere med.  [Her demonstreret på misdæderlig vis på en intetanende national skat.](URL,0
2717,"Når det er sagt, så ville det ikke overraske mig, hvis Odense begynder at lave alle deres lyskryds om til en mand med en guitar. Stop nu dig selv Odense. H.C. Andersen flyttede da han var 14 år gammel - han gad dig ikke mere.",0
3162,Der er vist en som har besøgt /r/de for nylig,0
1274,Læs historien . Og tag ned ved grænsen og hils alle kriminelle udlænninge velkommen og piv ikke den dag du ikke mere kan komme på sygehuset uden at betale,0
113,Tror jeg godt han kan leve med,0
1361,Nej fadbamsen er jo under beskyttelse 24/7 så hans egen røv er sikker..,0
2315,Verdensklasse! Eller som det gamle ordsprog siger 'ja så var gode dyr rådne',0
259,Jeg antager dette ikke er et problem længere?,0
1955,"Du menar serie-onanisten? Det är lugnt, vi klarar oss.  För övrigt anser jag att /r/DANMAG bör förstöras.",0
2877,Tid til at kæmpe mod global opvarmning så. Man kan jo starte med at finde et parti med klima på programmet.,0
902,Ja min søster fik 2 blå øjne fordi hun ikke smørte smøret ud til alle 4 kanter på rugbrødet. det sætter stadig i lille mig fra den dag.,0
3281,Har muligvis lavet en sang med ork puns.... URL,0
1245,"Jeg har altid undret mig over vores placering, i de her statistikker.  Da jeg boede i skotland (2011, bevares) blev jeg fuldstændig overvældet af hvor meget (og ofte!) mine skotske venner drak sig ned. Det var seriøst hver dag, fordi byen var altid åben. Og når jeg kigger på deres FB-billeder den dag i dag, har de stadig en drink i hånden på hvert eneste billede der ryger op.  &#x200B;  &#x200B;",0
312,"godt skrevet. føler med dig. Jeg håber meget du kommer på talefod med din ""kæreste"" igen. Har du ikke nogen venner/familie der kan hjælpe dig videre, i det mindste med et sted at overnatte. Har du overvejet at tjekke dig selv ind på et behandlings-sted ?  Håber alt det bedste for dig!! Selv om livet ser meget sort ud nu, skal der nok komme gode dage igen!!  ""always look on the bright side of life""",0
2851,[kLam veStLiG imPEriAlist hÅNer LokAl bEfolKnINg](URL,0
1922,SMUKT,0
166,Hva laver en 17 årig pige i en lejlighed med så gamle mænd,0
2785,"Jeg var så satans heldig at se ham live i Skive for et par uger siden. Det var første gang jeg så ham live. Han var gammel og glad. Og han nød hvert øje blik han sad der oppe.  Kongen er død. Stor blir vor sorg, stor blir bor nød!",0
2605,Lad os især give en hånd til @USER,0
581,Biograferne tjener absolut intet på billetten 80&#37; af filmens levetid på det store lærred — de penge ryger til Hollywood. De lever af reklamer og popcorn. Og så er det jo gæstens eget valg med tilkøb som IMAX og 3D.,0
