id,text,label
2600,Lige kommet ud af arenaen. Så stolt lige nu!! Pisse godt Astralis :D,0
2972,"Misundelsen er uendelig stor, fedt de dropper forbi det lokale venue.   Jeg må dog indrømme at det er flere år siden jeg sidst har set stand up live, og endnu længere tid siden jeg har besøgt comedy zoo. Så chancen er nok lig 0 for at jeg havde været der uden at det var publiceret i forvejen. ",0
2482,"Sjovt, jeg foretrækker på modsat vis min Red Bull med vodka uden Red Bull...",0
2119,De har stavet 'konge' forkert.,0
1785,Hvilken dansk atlet fra virkeligheden refererer de dog til når de kalder hende Freja Ollegard?,0
2684,Hva' med de fuckhoveder Venstre?,1
2381,Danmark stormer frem i det store udland HVOR ER SVENSKERN?,0
2160,"Hold da op, du ska' sgu' ikke skræmme os så meget!",0
1189,Det er bare virkeligt ærgeligt at deres app er så langsom og ustabil (på Android),0
2951,HAHAHAHAHAHAHAHAHA!,0
2262,Link til tråden URL,0
49,i stolen med den trunte,1
2403,Forskerne har vidst ret.,0
66,"tillykke! håber du får et fedt 2018! hvo har du ""boet"" som hjemløs? jef er nysgerrig - pga jeg så en hjemløs ligge og sove i et rum til storskrald i mit boligområde",0
284,God bedring,0
151,"Oversættelse tak, jeg forstår ikke djævlesprog",1
2040,Bajer :DDDD,0
928,"Frækt, mums",0
731,Er det dig Ronnie?,0
301,"Kæft det er sejt. Jeg droppede selv pot da jeg begyndte på universitet. Jeg har mange venner der stadig ryger.. rigtigt meget - er bange for de ender i det samme lort som du endte med at rode med.. men det er jo ligegyldigt, hvad jeg siger til dem, det kender du nok. Jeg håber du klarer den og alt falder i hak for dig - jeg regner med at have røget min sidste pind - har fundet ud af, at jeg synes det er uinteressant - måske du finder ud af det samme? Jeg føler mig i hvert fald end del skarpere og bare gladere i det hele taget. Held og lykke fremover OP. ",1
3499,Jeg gik for to år siden fra Helsingør til Gilleleje sammen med en kammerat. Vi gik kun langs stranden hele vejen. Ganske interessant når man kommer til de strækninger hvor villaerne ligger helt ned til vandet og vi endte med at gå i vand til livet og brystet med vores rygsække (og dyrebare iphones) strakte over hovedet. Der var nogle utroligt smukke syn undervejs på turen(vi så også en død oppustet sæl) men jeg gør det ALDRIG igen.,0
500,Nej de kan rejse hjem for nogle af alle de penge de har trukket ud af vores kasse,0
2734,"Der er ikke noget der får mit pis i kog så meget som når jeg overhaler moster Bente på hendes nye elcykel, for så at se hende nærmest torpedere mig i en overhaling mens jeg holder for rødt, så hun enten kan trille over i sin evige jagt på at give cyklister et dårligt ryg, eller kan stoppe midt i fodgængerfeltet.  Når der så bliver grønt kan vi jo så gentage hele stykket igen. Man skulle tro at finkerne lærte det tredje eller fjerde gang man svajer ind foran dem efter en overhaling, tættere og tættere på hver gang...  Normalt tænker jeg altid at unge mænd er dårligst til at følge færdselsreglerne, men på cykel er det sgu kvinder i fyrrerne, hands down.",0
1390,"Fuck det, mere sol og varme, mindre regn please. 80% af de danske år er totalt lort, og så snart der kommer lidt sol så begynder alle at whine...",1
2998,"Hvorfor bliver det kaldt det største i dansk hånboldhistorie, når vi allerede har 3 OL medaljer på kvindesiden?",0
1326,"Det orange Selvbruner løber jo nok af hvis det bliver vådt!  Går ud fra hans soldater også bliver i barakkerne, hvis det regner, så må krigen vente...",0
2927,"30 år her og fuldstændig faldet i med begge hænder. Fortnite er virkelig sjovt, især DUO",0
1199,Snyde i Skat kan vi da endnu. DK er ikke de ringeste i den sportsgren.,0
146,"Hvad kalder man en medicinstuderende, der har fået 02 i alle sine eksaminer? Læge.",1
1235,ARRRRRRRRRRRRRRRRRRRRGGGGHHH!!! NU SKAL DE HA' MED TO-HÅNDSØKSEN!,0
2606,Jeg vidste ikke Frank Hvam var gået ind i brætspil-industrien,0
3260,Crime-fucking-rider!,1
1718,Va i helvete,0
3139,Alla vet ju att Oehlenschläger och Krøyer var fotbollskillar.,0
800,HELENIUS HELENIUS!,0
3011,"Hvis deres musik er så højt at alle andre kan høre det, så går der ikke længe før de mister deres hørelse win win.",0
2179,Hvad er der ændret??,0
75,Ingen respekt og så taler han om respekt for ham... NEVER!!!,0
3277,Du skal ikke være næsvis bare fordi du bruger reddit browseren,0
2098,Den danske vil altid være bedre med en god ske velfærd på,0
598,Hvad er der galt? De kan vel godt rapportere med eksotiske kulturelle genstande fra kolonierne?,0
1962,Pia fældede en tåre da hun så dette smukke billede af en grænsebom.   Hvis der nogensinde er noget der har formået at holde de hedenske horder fra øst og syd ude af vores smukke land. Så er det Dannevirke og en grænsebom,0
2847,"Jeg tænker også at der er flere afdelinger i kommunen, hvad med jobcenteret? Eller myndighedsafdelingen (dem som arbejder med serviceloven) det er nok der du bør henvende dig... ",0
3567,"Troede det var fotobutik, så gik da til twitter for at tjekke om det var rigtigt , og ganske korrekt, så var der et lille pikachu migmig! Ret cool!",0
3498,Nogen chance for at man kan få juridisk eller økonomisk støtte af URL,0
2545,Tyskerne kan kun lave tarvelige efterligninger: URL,0
2550,Hvorfor ville de lære spansk på Grønland?,0
3548,"Jeg har set mange hvis engelsk ikke just er på toppen, men det her er på et helt andet niveau...",0
3501,Det er endnu en barriere for bønder uden for EU...,0
3472,"Well, som postbud forstår jeg godt, hvorfor man ikke har interesse i at uddele pakke om aftenen/natten.  Desuden er det ikke anderledes med DHL, gls, bring etc etc.  Forstår ikke postnord hate. Som om folk ikke ved, at postnord feks er forpligtet til at udlevere post til alle adresser i Danmark. Det vil altså sige, at hvis hr Jensen der bor på Lars tyndskids mark skal have et brev, bare et enkelt, så kan det tage 10-15min at få det ordnet. Det tager tid og penge, og derfor må du få fedte dig ud af døren for at hente den pakke 😊",0
2291,"Svensken var til at se, MEN DEN KUNNE KUN BRUGES TIL AT UDDELE MEDALJERNE: URL",0
2115,[Obligatorisk bonus](URL,0
3016,"Mit eneste møde ved ham var på min snuskede stambar i Aalborg, hvor han altid kom ned og fik et par skarpe når han havde spillet heroppe. Jeg tror det var en sang jeg satte på vi lige udvekslede et par ord om. Jeg husker der i mellemtiden kom en starstruck person forbi der sagde ""wow, du er Kim Larsen, må jeg ikke tage et billede med dig?"". Hans svar var ""gu' fanden må du ej!"" Han var i fint humør og havde intet imod at snakke lidt med os almindelige dødelige og hygge sig som enhver anden på baren, men han ville have snak og ikke bare smiger fra fans, hvilket man godt kan forstå for (nok) Danmarks største stjerne.  Hvil i fred hr. Larsen",0
1306,"Igen en ubegavet kvinde , som får taletid",1
2831,Tillräckligt gammal så den har rostat och blivit röd! Länge leva Svearike!,0
1478,MacG er den bedste dronning ever!,0
797,Ja og politet gør ikke en skid og de har heller ikke ressourcer til det,1
366,Åh nej! Svensk lorteret!,1
318,Gad ellers godt se det hår blive vådt. Er der nogen frisører der kan sige hvordan man får den frisure for mit hår ser da kun sådan ud når jeg børster det for meget og jeg kan da ikke få det til at sidde fast sådan med hårspray.,0
640,Det kan ikke blive mere sandt.. faktisk er alle for gammel til det ...der er da intet der er grimmere end et reb oppe i røven ..Trusser på så tænder vi igen,0
1157,"@USER kunne da havde brækket @USER ben da han skam kogte og brændte pasterne på. Men jeg gjorde det ikke. Det vel lidt et bevis på, hvor sød jeg er? ",0
3182,Alignment: Chaotic Populist,0
2810,"Perfekt ledsaget af dagens udtalelse fra politiet  &#x200B;  "" @USER fortæller desuden, at personerne i bilen er kendt i det kriminelle miljø, og han betegner dem som ""verdens måske mest uheldige kriminelle"": """,0
2707,jeg har SMAGT en lille mundfuld rødvin tidligere i år..  tæller det?  jeg er ikke den store alkohol-fan.. men jeg smager da gerne hist og pist. (Det er efterhånden dog kun pist),0
1407,"Jeg håber ikke, at pølsevognene lukker tidligt. Jeg skal have min daglige røde pølse!",0
308,Jeg er faktisk ikke spor overrasket - hvornår har den vulgære plebejer nogensinde opført sig passende?,0
115,"I stedet for at tildække det svenske flag, burde man [UDRADERE DET](URL",1
2755,"Modargument: ved at kompensere ministre mindre, så øges deres risikovillighed til at begå korruption for økonomisk gevinst.",0
183,"Det er vel først og fremmest de lande, der har stået for bombningerne af dem, der skal rydde op. Det er dem (DK inklusiv), der har ""rodet"". Lidt ligesom man lærer af sine forældre, allerede når man er 3 år gammel, du ved. Ryd op efter dig selv",0
876,Er terrorangrebene i Europa fra muslimsk side stoppet siden i mener det er ved at dø ud?,0
595,Tror mere det er det sindsyge antal indvandrere som prøver at lære sproget deroppe,0
2484,"Til SkinkeSkuden, drenge! LØB!",0
974,Norge er sort? Troede det var Sverige?,0
2656,Nope!,0
3253,"Så er Esben klar til nye udfordringer. Det skulle vel også passe nu når han optjent en solid folketingspension på 12.000,- dkk om måneden plus det tilsvarende i ægtefælle/børnepension, samt en ministerpension på 134.000,- dkk. Vel og mærke fra 61 års alderen.  Helt klart en af de større drivkrafter i at jeg den dag i dag må siges at lide af politikerlede og stemmer blankt på det cirkus der foregår derinde på Borgen.   Vi siger tak til Esben for den dejlige indsats som folkevalgt, og tak for underholdningen for os menige, med blandt andet Vindmølle-sagen, CV-sagen, Ph.d.-plagiat, Plagiat i Christiansborg-tale, ""Kvote-konge"" sagen, ""Økologisk råderum"" sagen, ""Gylle-gate"" sagen.   God vind fremover.",0
3392,Skal vi ikke lige give en stående applaus til københavnerstangen?,0
1981,Men gider vi dele monark med de reserve bornholmere?,0
965,om jeg gad og kik på de araber sure fjolser,1
2527,Han var norsk inte svensk! Typiskt danskjävleri och fejk propaganda!,1
786,"Lad nu være at gøre det til noget stort,det er der mange der får lavet",0
3197,"Kæft der har siddet mange klar, haha.",0
1837,🤢,0
2438,*SLESVIG-holsten,0
1043,"Jeg læste med det samme det første billede som ""pludder"".",0
1234,Jeg begriber ikke at man kan være så respektløs også en ældre herre der helt sikkert burde vide bedre det jo ikke er barn,0
174,"En del af europas historie , og bør naturligvis bevares",0
2061,"Det engelske flag (du ved, dannebrog i ""inverse farver"") er ældre end dannebrog med et par årtier hvis jeg husker rigtigt. Det bliver dog ofte ikke talt med i disse lister da England er en del af UK, og der bruges Union Jack. Når det er sagt så er der ingen tvivl om hvilket flag er pænere.",0
1410,"Mit sidste år på min HF kom jeg konsekvent 6 minutter for sent hver morgen - min bus kom ganske enkelt ikke derud før det. Hvis det skulle udløse fravær, så ville det eneste måde at undgå det på være at tage en anden bus, og ankomme 45 minutter *før* første time.   Jeg fik 12 i det fag jeg havde om morgenen, og kan derved attestere at en håndfuld minutters fravær, selv på sigt, ikke betyder noget som helst. Som regel var undervisning enten *lige* eller *slet ikke* starter når jeg kom alligevel, for vores underviser var også blevet påbudt at råbe os op for at tjekke fravær, hvilket ironisk nok kostede samtlige elever langt mere tid hver dag end 2 minutter, der i så fald ellers havde udløst fravær.",0
3393,Good Times :) Indtil robot støvsugeren smilede jeg kun lidt 😂,0
304,"Jeg kan knapt klare at spise en hel af dem der, det bliver alt for meget.",0
2352,Hvorfor er prinserne og prinsesserne klædt ud som bøllerne fra sjette klasse?,0
1311,PRÆCIS!,0
2169,"Hendes Majestæt Dronningen er som en smuk, smuk svane ved siden af de grimme ællinger.",0
291,"svanen ser fuc\*ing vred ud, de sorte markeringer giver den et ondt look lige som enhver dansker der ikke kan få sin morgenkaffe",1
1720,SHÅLÅLÅ!!,0
2982,Du mener vel minuitter?,0
2099,Danskjävlar,1
508,"Det har ikke den store interesse, da det ikke rigtigt skæpper i bødekassen !",0
3207,/r/likeus,0
761,Hvad er det for en Anglosaxisk leflen? Kan vi få et dansk banner!,0
2316,"Så hjælp dog de stakkels mennesker, de har tydeligvis fået et kollektivt slagtilfælde.",0
3117,Jeg har mange venner der kører lastbil' skal være min nye go-to-trussel.,0
2643,lol,0
675,Det er på tide en del kvinder skrider tilbage til det køkken de er stukket af fra. Syge kællinger på fri fod er der squ for mange af,1
2806,Det burde have været en Snickers.. ikke Burger King,0
1250,"Og? Skulle politiet stadig ikke have lavet en grundig undersøgelse, end en antagelse? Prøv se dokumentaren Soaked In Bleach.",0
2931,Er du sød at bevise at det ikke bare er en tennisbold med ét lag guld..,0
3144,Alt med måde kan man vel sige? :),0
388,Det samme bør gælde for de der møgunger der skruer op for deres lorte musik på bluetooth højtalere..,1
2557,Jeg har aldrig set en smukkere udgave af denne meme,0
350,@USER var det ikke det samme der skete i din folkeskole ?,0
2469,HVORFOR ER DET AT DET GRIMME ENGELSKE SPROG BESUDLER DET SMUKKE DANSKE FLAG?!,0
458,"Så justitsministeren, som jeg formoder har en hovedrolle inden for bekæmpelse af stofmisbrug, har ikke den fjerneste anelse om hvor farlige de enkelte stoffer er?  De er skøre, de svenskere.",1
806,"@USER når jeg ikke gør det på den ""rigtige"" kokke måde",0
3045,"Hvis du har brug for et værelse at bo i efter du er gået hjemmefra og inden du får styr på dine sager, så skriv. Vi har et stående tomt i Nordsjælland om en måneds tid.  Jeg ville nok anbefale at finde en anledning til at komme væk, med deres accept selfølgelig nemmest (og så flytte til hemmelig adresse derefter), men ellers bare med dit kæreste eje på ryggen, og bare gå til nærmeste station og tage toget langt væk på røven. Find politiet og kommunen i den anden ende af landet. Du skal ikke risikere at blive set gå til den slags hjemme hvor du bliver overvåget..",0
2914,[Marius kunne have fået en værre ende.](URL,0
1974,"RIP Svensken, du vil ikke blive savnet.",1
3365,"Når jeg ser tykke mennesker tøffe rundt i løbesko, føles det sgu altid lidt mærkeligt...  Mest af alt fordi jeg aldrig selv har haft udfordringer med vægten. Men jeg ved hvor hårdt det kan være at komme i form som “normalvægtig”, så KÆMPE respekt herfra, for at du magter at tage al den ekstra vægt med ud og gøre noget ved det! Keep going, man!",0
2443,Desværre er Luxembourg oppe på 4.,0
1521,Send regningen til venligboerne.,0
489,"Jeg syns det er nok med pjat med Danske Bank. Bank er en finans institution og så der er ikke så meget moral i det, penge er penge og kunder er bare kunder. Banken er ligeglad hvor pengene kommer fra og hvor de havner til sidst. Alt handler om profitten. Det undrer jo ikke nogen at banken tjener på at låne penge til studerende og de gamle... hvad forventer I fra banken, at det siger “nej, vi har ikke brug for jeres penge”?",0
457,Hvis du melder en for vold eller voldtægt og det viser sig det ikke er sandt med beviser og diverse ting. Så burde du få ligeså mange år i fængslet som personen du meldte. Sådan noget shit her gør det svære for kvinder og mænd at stå frem og folk faktisk tror på dem og dem der gjorde det kommer i spjældet hvis der er sådan nogle mennesker her der gør shit Like This,1
2743,"Er den ikke gammel ?, eller det er måske fordi den ikke har været vist her på Reddit",0
1762,"|rejser sig omgående, triller en patriotisk tårer og har et stolt blik i øjnene, imens han holder en hotdog til hjertet|",0
2825,"Når du lytter til radio*  Der er maaaaaaaasser af lækkert ny dansk musik som på ingen måde lyder sådan der, men hvis man hører alt sit musik i radioen så kan jeg sgu godt forstår man er træt af ""dansk musik"".",0
2008,"Glem ikke [Anders Hejlsberg](URL#.  Bare C++, PHP, C# giver os danskere bag tre af de absolut største sprog i verden.",0
3353,Sådan har jeg når jeg er ude og løbe og der går en eller anden og ryger langt forude.. Føj,0
1125,Ud med dem,0
2833,lol,0
728,"Der er så sindssygt meget sludder på begge sider af den her debat. Det meste af det der bliver sagt i begge lejre er fuldstændigt misvisende og ofte fejlagtigt.  Edit: Undskyld. Jeg kan se på stemmerne, at det kun er Trish Regan der er galt på den ifølge reddit. My bad.",0
2650,"Er den med hætten ny? Syntes den er over alt, men kun for nyligt.",0
3377,man skal ikke undervurdere en ramadansnitte med coke på.  edit: og her taler jeg ikke om støjberg.,0
2811,"...men når der så møder 50 rasende ambassadører op og kræver regeringen afsat og loven erklæret ugyldig... skal vi så gøre under Muhammed-krisen? Eller skal vi retten ind? Kunne være rigtig rart at have SF, De Radikale og Enhedslisten svar på nu, og ikke 5 år efter. ",0
1905,"Mycket modigt, på mount everest har man i alla fall stabil berggrund under sig. :)  Du får det [här](URL",0
37,"Anklagemyndigheden overvejer at sigte damen, for de falske anklager, som kunne have givet ham 99 år. Der er da noget der slet ikke hænger sammen her. Fuldstændig vanvittigt... Hun skulle da kunne straffes op til 99 år, så man kan sætte et eksempel på, at man tager falske anklager alvorligt. Welcome to the USA, the greatest country in the world.",0
2341,Det er jo sandt...,0
409,Kan man kun bruge kort hvis ens nummerplads er SB 02 018? (Storebælt 2018),0
1760,"Danmark, den stole familiefar, Norge den succesfulde storebror, Island den smukke lillesøster, Sverige den ubehagelige onkel med sin søn Finland, den underlige fætter, som resten af familien Skandinavien ikke helt forstår hvad siger, og rygtes at have Rusland som mor...",0
3116,"Et ~~godt~~ måltid er essentielt for at man kan udføre et ~~godt~~ stykke arbejde.  Sødt som du lige skal indsætte ekstra tillægsord for at få logikken til at se dummere ud. Fortsæt dit spin.  Skynd dig at opret et borgerforslag så vi kan få en lov der dikterer, at politikere skal spise 600g frugt og grønt til morgenmad.   Gad vide om der er øget risiko for dehydrering for mennesker som ikke drikker i løbet af dagen i denne sommervarme.",0
1261,"Danmark har færrest brugere blandt de 15-24 årige i Norden Ved sammenligning med nationale tal fra andre nordiske lande ses, at Danmark i de fleste al- dersgrupper ligger højere end Færøerne og Norge, men i alle aldersgrupper lavere end Sverige og Island. Hos børn og unge mellem 15-24 år ligger Danmark lavest og hos børn under 15 år er det kun Norge, der ligger lavere. Island har, uanset køn og aldersgruppe, den højeste andel af personer med receptindløsninger på antidepressive lægemidler1 i 2016, jf. tabel 22. Andelen af børn i aldersgruppen 0-14 år med køb af antidepressive lægemidler udgør i alle lande 0,1 - 0,3 pct. med undtagelse af Island, hvor andelen er 2 pct. Hos de 15-24 årige er andelen omkring 3 pct. i Danmark, Norge og Færøerne, mens den i Sverige er dobbelt så høj (ca. 6 pct.) og i Island 4 gange så høj (12 pct.). De relative forskelle mellem landene udjævner sig med sti- gende alder. Der er flere kvinder end mænd med køb af antidepressive lægemidler på tværs af lande og al- dersgrupper med undtagelse af de 0-14 årige børn, hvor der i Norge og Island er en anelse flere drenge. Andelen af personer med receptindløsninger på antidepressive lægemidler stiger i alle lande med alderen og er højest blandt de 75+-årige. I Island har 19 pct. af mændene, 28 pct. af kvinderne og 24 pct. af alle 75+-årige haft mindst én receptindløsning på antidepressive læge- midler i 2016. I Danmark er de tilsvarende tal 13 pct. for mænd, 21 pct. for kvinder og 17 pct. for alle 75-årige. Den laveste andel blandt de 75+ årige, ses i Norge med 12 pct. Tallene fra Norge inkluderer dog ikke medicin givet på plejehjem.",0
822,Tror mere hun har en lufthavn dernede,1
1021,hvor er det dog godt at de unge mennesker har noget at få tiden til at gå med og forstår at more sig (ironi kan forekomme) … håber man finder dem og sender regningerne til dem og deres forældre,0
2118,Uden tvivl den mest kendte skuespiller i verdenshistorien!,0
3191,"Det er fordi de danske børn i folkeskolerne af en eller anden grund både bliver dårligere til at stave, og så vel også engelsk i det sammenhæng. Trist.",0
2332,Men,0
1446,Www.freehansisland.org,0
1167,"Lækkert lorteindslag v1, jeg giver d1 1/1.",1
298,"Hvad F..... foregår der i hovedet på folk?? Der er forhåbentlig noget videoovervågning, der kan vise, hvem de idioter er og så skal de have lov til at betale for deres hærværk.",0
3099,"OP! Nu må du træde i karakter, der er kun en måde at løse mysteriet på, og det er at smage hvor den sidst har været. ",0
3104,Kom ind i tråden!  URL,0
1030,Så må de hellere inviteres inden for og sparkes uden for uden samler bøtten... så kan man selv aflevere den til kræftensbekæmbelse. I stedet for dansk rødekors,0
218,"Næh, det er jo et symbol på at svensken bare er et stykke værktøj, der skal bruges af DANMAG",1
1409,URL,0
1585,Du glemmer Østeuropaer som er de værste,1
2296,Kalle er faggot..,1
2268,HVOR,0
1892,[Opdateret version](URLårsfalken.,0
3504,"Jeg har et værktøj der tillader mig at markere og kopiere tekst i billeder. Her er hvad jeg får: ""w h m""",0
1972,Det var en nordmand,0
764,"Smid dem på gulvet, og tramp på dem.",1
2857,"Haha era danskjävlar, vad håller på ni med? Är ni tokiga eller?   Skrattade ändå, tack Danmark! Kamelåså!",1
1259,"Flere nævner én med ""Nnå!"" som i nu kommer jeg efter dig men synes den er dækket af ""threat"" passer fint, om end det ofte bruges for sjovt.  Men én jeg synes der mangler er: ""Nå nånånå nå"" ;)  Som i hentydende/innuendo agtigt.  ---  A suggestive""Nå nånånå nå..."" surely there was some innuendo or ""something romantic/sexual in nature is going on here"" is sorta missing I think.",0
2832,Not Danish but Pølse,0
1488,"Det var ikke den her, hvor Danmark blev disq'et og Sverige overtog første pladsen vel?",0
1878,URL,0
1277,Er hun glad og tilfreds så kan andre jo bare flette næbbet,0
21,"Det var det. Unsubscribed, lorte sub med lorte posts.",1
3536,"Men husk nu på, at [A new normal demands new standards](URL",0
147,Agurketid????????,0
225,White trash. det en søn til DF politikker i Nordjylland - jo mere medierne gør de her beskidte mennesker berømt - jo flere vil ønske samme mediedækning som ubåd Madsen og ham White trash massemorder fra Norge,1
2865,"Prøv at sige ""Naviger til.."" i stedet for. ",0
1784,En eller anden forklar hvorfor det her skal være sjovt :S,0
2090,Certificeret fugtigt.,0
2383,"Hei! Jeg har laget banneret til /r/NORDVEI.  Bare mellom meg og dere, *jeg liker Danmark bedre enn Sverige*  EDIT: Hvor er Norsk flair?",0
442,[Sauce](URL,0
262,[Vi ved godt hvilken løsning politiet ville have foretrukket.]( URL,0
46,"fandme hul i hovedet... selvfølgeligt en ok måde at undgå at skulle finde på noget der faktisk er danskt, men som en forklaring er det som at sige at det ingen værdi har at være dansk udover at man ikke er svensker... fucking øl patter og hornmusik, prøv at starte med det... fristad og arkitektur, militær irellevans, vores evne til altid at brokke os på trods af hvor godt vi har det i forhold til andre land.....",1
704,"Ta er i akt, danskjävlar!!",1
187,Han har stadig ikke lært hvordan man skal opføre sig som en Statsleder.,0
641,Legender dør aldrig,0
243,"Hvordan i alverden kan der gå næsten et år før sigtelsen bliver droppet, når beviser for hans uskyld er klokke klare??",0
3155,Det var da godtnok nogle gevaldige *moobs*. Kaj er med på trenden med masser af smør i maden. Sådan!,0
656,De skal da bare se komme afsted lige så hurtigt som de fandt her til,0
2778,Plejer altid at holde vejret på det mest strategiske tidspunkt og så dreje af. Er villig til at cykle betragtelige omveje for at undgå den slags livsnedbrydende adfærd.,0
879,"Få dage inden, har knægten på 2,5 år ""lært"" at synge ""Køb bananer""  ""kom kun nærmer', kære frue"" og så er der bare lidt pludder derefter, indtil ""Køb bananer"" kommer igen. Han er helt tosset med den. Der kneb sig en lille stykke våd ud i øjenkrogen i går, må jeg indrømme :'(",0
1973,Kongens Have '89.. Jeg husker det som var det i går.,0
2984,Hvilken luksus biograf bruger du hvis dine billetter koster 150kr? De koster omkring 95kr her i Frede og det er en helt fin biograf.,0
125,@USER ja pas på du ikke koger broccolien for lidt,0
2188,"#DIES IST JETZT EIN DEUTSCHES UNTERLASES  #ERKENNT AIMAN ABDALLAH ALS EUREN NEUEN HERRSCHER AN   #HULDIGT KNOLLI, DIE TOLLE KNOLLE",0
3067,Ikke pænt at beskylde et barn for at ligne den ***,0
1992,Og må jeg have lov at tilføje: verdens smukkeste flag!,0
252,"@USER har da helt ret, der er intet krænkende i det.",0
2339,Synes der er lidt rigelig grønt på den der... :),0
2357,> Universial remulade  Er der en forklaring eller...?,0
2294,Og så er det fandme mørk chokolade! Alle og enhver ved jo at pålægschokolade skal være lys!,0
198,Dröm vidare! Länge prisa välfärden!,0
355,Latterlige feminister... De skulle forbydes...,1
429,@USER frisk underviser,0
1527,Han er da bare en klovn så er den ikke længere,0
1308,Og det fortsætter i det uendelige,0
