id,text,label
2187,"De skal bare vente til at vi ØØØERLAGGER dem, så kan de endelig blive representeret af det pæne og skønne Dannebrog i stedet for det patetiske svenskerbanner, der bare flyder ud i havet.",1
1183,@USER - så ved du hvad der sker næste gang du ødelægger gryder og pander i hjemme,0
1675,OG NORGE VINNER NOK EN GANG!  ALT FOR NORGE! ALT FOR KONGEN! TAKK FOR MEG!,0
3505,Der er seriøst nogle krydrede memes på det danske subreddit,0
2783,"Nej, det er Pape og alle de politikere der taler udenom!",0
502,"Også kendt, som opium med brus.",0
232,"Svensken fatter som sædvanlig ikke hvad der foregår! Mens den stolte danske gør Danmark international ære, er svensken endnu en gang for sent ude! ",0
2812,Fint hydelst til Morten samt væren fra programmerne her i formiddag : URL,0
3094,Er det ikke et forkert brug af meme?,0
3242,Den blå kiosk er fast stopp når jeg er i Tversted! Maasse guf :) Hilsen fra Norge!,0
206,/r/Neckbeardjokes,0
1457,Derfor skal vi ha grænsekontrol begge veje. Vores skattekroner fosser ud af kasse til udlandet og nu forsvinder vores egendele også.. Hvad gør politikerne ved det..? Nå jo de har fanget Britta og nu skal hun fandme steges totalt og så glemmer vi alle sammen nok alt det andet lort regeringen ikke gør en skid ved.,0
2893,"Rap lyder bare ikke godt på dansk, uanset hvem der laver det. Det er ligesom at høre rap på tysk eller hollandsk. Det er bare lidt for meget germansk i det.",0
560,"deres forældre har meget af skylden fordi deres børn får lov at passe sig selv,ja lad dem selv rydde op og betale for skaderne",0
1538,"Det er så typisk danskere det her..  Typisk dansk sommer: ""det regner for meget, det er en dårlig sommer, Jeg rejser fandme sydpå hvor det er dejligt varmt""   2018 - rekord sommer! ""det er for varmt, der er for tørt, Jeg må ikke grille, Jeg kan ikke spille computer, min røv sveder osv. ""   Den her sommer er dejlig! Ja det er varmt, Ja det er tørt. Nyd det mens det varer. Inden længe når vi vinter også tuder danskeren over det er for koldt, for glat, for vådt und so weiter. Ingen er nogensinde tilfreds. ",1
2660,Det her er hvad jeg glæder mig til hver jul,0
2039,Alcohol free zone - hvad er det for noget barbari? ,0
2976,I dag er Store Bidedag - husk at bide folk,0
338,"Kan du ikke selv se, at din formulering, er krænkende “alene af den grund at en kvinde” ville det i din optik være mere troværdigt, hvis det havde været en mand. Jeg vil på ingen måde forsvare den bitch, men kvinde eller mand, så er vi lige for loven, ihvertfald i den vestlige del af verden. Jeg er godt klar over, at det kan se anderledes ud, i visse dele af verden, hvilket jeg i den grad finder både uretfærdigt, krænkende og tilhørende en for længst svunden tidsalder.",1
3228,ok indrømmet ...jeg sad sgu og fældede en tåre da indslaget kørte her i kl 19 nyhederne ! hvil i fred Morten ,0
1479,"Lad være med i under alle omstændigheder at give nogle penge til dem. Jeg opfordre folk til at boykotte alle den slags indsamlinger, også på tv kanalerne. Det hjælper jo ikke en skid. Massere penge bliver sendt derned og det bliver aldrig nogensinde bedre",0
703,Der er noget museum i tyskland som kunne have interesse i dem.,0
2377,/r/SWARJE er den vej. gtfo -->,1
2178,JEG KAN OGSÅ SKRIVE MED ^STORT,0
1257,"Så det er altså en hadforbrydelse at angribe en ideologi? Så når fascisterne fra AFA overfalder nynazisterne, så er det både terrorisme (angreb grundet politisk overbevisning) samt hadforbrydelse (angreb grundet ideologi).  Interessant.",0
3165,F,0
1081,My god! Feel your pain too min gut. Har de her to sataner og de skider i et væk. Især den grå. Den sorte har det noget nasty langt hår ved exit og har gentagne gange måtte køre Rodalon over gulvet efter hun har taget en røvtur over hele stuegulvet for at komme af med sit tilbageblevne halløj hun stadig har siddende i bagpelsen. Go ferie! URL,0
1260,"Tror simpelthen ikke på dig... Ny bruger, tvivler på du havde villet have et brugernavn med informationer om dig selv i første omgang... Bevidste stavefejl så du lyder som en indvandrer, men perfekt kommatering.. For mange stereotypiske ting såsom ''mine store fætre bankede mig''. Desuden bruger alle arabere/muslimer betegnelsen ''kafir'' om vantro/ureligiøse og ikke munafiq, som absolut ingen kender til. At kommunen heller ikke tager det seriøst nægter jeg at tro på, når dit problem er så voldsomt, hvis det altså er rigtigt. Og at du ikke lige kan ringe til Etnisk Ung fordi du ''lige skal have min mobil igen'' lyder også bare alt sammen som et forsøg på opmærksomhed herinde...",0
1066,@USER så må hun squ da lære at lave ordentlig mad!,0
1489,Godt man ikke støtter de griske hoveder,0
1869,"Hvis du hellere vil have et kalifat end sverige, kan du fandme fucke ud af mit land din luder. ",1
2399,Forøvrigt taget fra et godt dokumentarprogram om svensk politi.,0
1695,NED MED SVENSKEN!,1
567,"Håber på en måde ikke, at en børnehaveklasse finder hovedet... eller en arm eller et ben for den sags skyld.",0
1571,"Bare rolig, jeg er sikker på at næste års sommer bliver det modsatte, og så er det den slags sommer, der er lortesommer.",0
1275,"Så længe det ikke skader dansk erhvervsliv eller samfundets allerrigeste, kommer den nuværende regering ikke til at gøre noget ved problemet. Så nej, sandsynligvis ikke.",0
3177,Man kan finde charteret her: URL,0
1775,"Hahaha, ni kan ju för fan inte ens hålla koll på er eget språk, hur ska ni kunna hålla England? ",0
1455,Odins sønner?,0
3082,Det meste af undervisningen på gym er spild af tid. Der foregår så lidt stimulering i timerne at eleverne hellere vil sidde på facebook.,0
2207,"Jeg mener billedet kommer fra en kampagne af DDRJake. Han streamer stadig på twitch og arbejder faktisk for Paradox Interactive, der har lavet spillet. Den eneste skavank er at Paradox er et svensk firma. Fy da føj da. ",0
3100,Du burde dele den på r/natureporn,0
175,Hold kæft er det der sjovt. Nu tænker jeg altids på ægge hvider i toget...,0
3244,Stay classy,0
2276,~~L2~~ K2,0
2731,Det kommer vel lidt an på hvilken type plastik?,0
3407,2edgy4me,0
946,Pølsearv er en af de danske kulturskatte som burde gemmes på nationalmuseet.,0
3230,De laver fandme også noget svedigt glögg derovre Hinsidan.,0
3148,"Sejt gået.    Altså hvis du ikke er bange for at tage toget, så vil jeg anbefale Ry-Silkeborg-Ry det er en rigtig dejlig tur.  Jeg gik den i sommers sammen med en god ven og vi brugte omkring 24 timer fordelt på dage.    Det var i sommers så det var til tider hårdt med 30-32 grader og ingen skygge, men det var fedt.  Smuk og forskellig natur, vi kom ""besteg"" Himmelbjerget som er noget af en udfordring på dag 2.  Vi modificerede vores rute lidt så vi var faktisk fri af landeveje.    Ruten leder dig rundt om Birkesø, Julsø, Borresø og Almindesø.",0
1246,Jeg har lige lavet mad. Det gik IKKE godt.Ligegyldig info,0
507,Var det ham der sad i en lort?,1
2457,KAMIKAZE!!!,0
1174,"Her havde jeg scannet lortet ind på pc, markeret og taget hendes underskrift over i et nyt dokument og skrevet det på korrekt engelsk. Gad vide om hun fik jobbet som vennetjeneste.",1
985,Opstemt for god migmig!  URL,0
2007,Hørt!!,0
2072,Det er smukt!,0
2485,PØLSEBILEN,0
395,"Da jeg vågnede i morges kløede min arm. Jeg kan se at der er er et lille hvidt rundt mærke. Tænker det må være en blodsugende svensker, som sneg sig ind på mit soveværelse og bed mig ",1
1213,"Bortset fra at det ikke stresser Dansk Folkeparti, men bare giver dem flere vælgere.",0
3204,Kan jeg foreslå 1865?,0
698,Du er vidst lidt af en *skrue* OP,0
155,Det er fandema flot!,0
305,"De små får fri på vores skole fordi en knægt blev blind for nogle år siden da han blev ramt i øjet  Edit: kun det ene øje, grammatik nazister... /s",1
843,"På nuværende tidspunkt ved politiet endnu ikke, hvem gerningsmændene er.",0
3399,En ægte verdens- og levemand har forladt os! Mine tanker går til familen. Æret være hans minde,0
3565,Det her er det bedste /r/Denmark nogensinde har produceret.  Det er ikke en kompliment.,0
130,Kan man rejse. Hjem eller ferie så kan man også blive der ??,0
2868,"synes det er flot at den danske presse er gået fra at være ""samfundets vagthund"", til at blive ""fake news"". Det er pga dårlig og usaglig journalistik at den almindelige borger ikke gider følge med i nyhederne længere. kunne være at man skulle ligge sine kræfter ved dybdegående og udfordrende jounalistik, og ikke artikler der var tilpasset facebook opslag.",0
2333,fugtigt min neger,1
605,"Det var billig sluppet, man koger sku ik pasta uden man har 100% styr på det.. Og hvis man vælger at gøre noget så uansvarlig alligevel , så er et brækket ben meget billig sluppet. Havde kogt hendes Ben",0
2956,"Tag kolde bade, køb en gasgrill, mand dig op og skru ned for klimaanlægget bilen. Køb et hus med kælder og få et arbejde på et kontor i AC'ens kølige brise. Ligesom mig.",0
216,Lad os ringe efter frømændene og Special politiet!,0
1449,Kan man se et foto af hendes tosso i høj opløsning?,0
1495,Man bliver sgu da paranoia med alle de crazy people der render rundt,0
773,Skulle have brugt Zlatan!,0
414,"@USER, hvem opfordrer til vold? Har du noget konkret bevis for at DF opfordrer til vold og mod hvem?",0
2224,"FOR HONOR ANERKENDER DANSK KRIGER, MEN HVOR ER SVENSKEN.",0
870,Ærligt hvordan er der røget 130.000 kr. på det her,0
1445,Trist. De siger det ikke hjælper med straf. Så man må finde sig i det.,0
58,Fucking smatso af en kælling,1
2101,Jeg er med. Mod england!,0
2338,"For helvede, nu er mine trusser helt gennemblødte, jeg kan sgu ikke håndtere alle de pølser!! ",0
1595,"Jo, jeg har også, og måske oftere hørt om små mandslinger, som nægter et overgreb mod en kvinde. Jeg ved godt den slags sker, desværre, og jeg sympatiserer på ingen måde, med den bitch, jeg håber hun får sin velfortjente straf. Det der støder mig, er den nedladende vending “alene af den grund en kvinde” det krænker mig, for det tror jeg aldrig vil kunne finde sted, med omvendt fortegn. Forestil dig lige det",1
3080,Amager ser godt nok spøjs ud.,0
2874,Føler den er lavet af en der har været 14 dage på ferie i Danmark.,0
2869,"Nu er det også lidt dumt at sammenligne hvor meget skat der er mistet over en periode på flere år med en fast årlig post, ikke?  Granted - det er stadig slet ikke ubetydelige tal, men det er bare lidt dumt at sammenligne pærer og bananer for at overdrive ens budskab.",0
378,"Måske er den en besked. En hemmelig besked. . .   Måske er en urgent bare det man kaldte agenter fra oldtiden. Eller måske mener de at der er et G for meget i ordet og det dermed handler om hygiene og dermed om at rydde op. Som jo er kodesprog for at Danmark igen skal erobre Sverige - det kan det næsten kun være. Men nej, nej jeg fornemmer at der ligger noget dybere i det her...   Tager man ordet Urgent i sin mund og ryster lidt med tungen som en hver anden nymoden dansebamse med feministiske undertoner imens numsen rykker på sig, ja så vil man opdage at urgent står for noget helt andet. Ja, det må næsten være Tnegru, når man ser på det baglæns. En Tnegru er ikke, modsat hvad mørke fjerdebølge-kræfter i Sverige ville lade os tro, en sort T-rex dinosaur. Nej, istedet er det meget mere dystert og ikke-racistisk.  [Tnegru er i stedet selv en hemmelig besked, begravet dybt i det engelske ordforråd](URLå dybt som en ubåd, da det ville være ret hovedløst at sige; især da dette blot er en afledningsmanøvre fra Svensken, der skal sænke Danmarks rejse til den Oplyste tilstand, da det er deres største defensive mission. Dermed ender man med et ord der ligner gurnet, nemlig [gurnard, som jo bl.a betyder fisk og denne fisk er typisk gul, da den hedder Yellow Gurnard.](URLå, at Svensken står bag: tænk på deres gule flag og det blå i det, der, ligesom fisken, repræsenterer det våde element; som igen bekræfter at ubåden er en løgn. Slå sonaren til, så dykker vi gutter...  Blob blob...Men gurnet [referer også direkte til de pilgrimme der kommer fra USA](URLå grundet disse fakta og mange andre, så kan jeg kun tolke denne ""Urgent"" besked - som trods alt er både rød og hvid som det amerikanske flag - som en hemmelig besked fra amerikanerne til os, der skulle forbipassere det Svenske censur apparat. De siger at Danmark må til at angribe Sverige og generobre ikke alene deres land fordi det er på tide at de gjorde tingene ordentligt, men fordi det er Danmarks forfædres sidste ønske: de kaldte det jo Sverige, således at fremtidige generationer kunne opdage den sorg det var, at miste den! [Da landets navn kan staves](URLølge det Svenske Internet, som vi her bruger til at afkode ders egen propaganda), [som jo betyder at græde!](URLædre, det *""urgent gurnet,""* altså det gamle netværk af agenter - men med den dobbelte betydning at man skal skynde sig, men samtidig huske på vores oldtidsagenters ønsker!   Urgent! Urgent! Urgent! ",0
739,Pink Fløjt’,0
173,Ja tak,0
2361,KOM SÅ DANMARK! KOM SÅ DANMARK!,0
204,Carsberg er lort.,1
2980,POKKERS PogChamp,0
2470,Stjæler? Det var en ren massakre mod de arrogante franskmænd!,0
1757,"Det der pis, det kan bubber ikke lide!",0
2239,"Det var smukt, OP. Jeg kneb næsten en tåre for fædrelandet.",0
2517,"Hvad andet kunne man forvente, når Svenskens nationalret ""ködbullar"" er formet som testikler!",0
2834,lol,0
940,@USER magter man heller ikke,0
1939,"Det ser ærligt talt mere tiltagende ud det nederste, nostalgi måske.",0
3533,Min chef sendte materialer til mig fra København i onsdags via quickbrev da jeg skulle bruge det i dag.  Det er stadig ikke ankommet...,0
1242,"@USER som en billig vare, tænker de tjener langt mere end dig, så hvem sælger sig selv billigst?  Disse 2 som laver noget der giver dem nydelse og som de ikke bliver nedslidt af eller dig som knogler røven ud bukserne på arbejdsmarkedet til lorte løn og nedslidt krop?",1
2505,Tabt ved Vsovs,0
3246,Jeg gad godt have det der PR job.,0
715,min kommentar er: SKRID OG BLIV VÆK,0
3430,[Repost!](URLår siden.,0
2543,"Sååå... jeg hader 'ir' mest. Men det er også rimeligt grimt, så det er vel fair nok.",0
2176,##SELVESTE DANMARKS KRONPRINS HJÆLPER TIL MED AT SPREDE KÆRLIGHEDEN FOR FÆDRELANDET!,0
3309,"Du kunne prøve hæren. der kan du tage en uddanelse og få penge mens du gør det. mener da også at man for en bolig af dem mens man er hos dem. og man behøver jo ikke at være soldat for at arbejde for hæren. Det var lidt hårdt at høre din historie og håber for din skyld at du kommer ud af det miljø så hurtigt som muligt, det med din familie er nok lidt hårdt at tænke på men det lyder som om de tænkere mere på deres tro en de gør på dig, og derfor ville jeg personligt nok sige farvel og nok stoppe med at have kontakt indtil du har bygget et liv væk fra dem.",0
2940,"Jantelagen är inte ansvarig, utan de danska generna  Edit: Snälla, ta inte all min karma :( ",0
1120,Skønt med åbne grænser,0
158,KONGEN I NORDEN,0
1936,Sounds like a deal!,0
697,"Hvornår vågner vores politikere op,vi kan ikke blive ved med at forsørge resten af verden,se at få ryddet op.",0
610,Så er det UD,0
652,kæft en lortepæl,1
2279,"Kaj kom selvfølgelig op i de sociologiske konsekvenser af migmigernes stadigt eskalerende politiske indhold. Æhh.. Jeg mener, også mig tak. ",0
3029,Det fik mig til at puste luft ud af næsten lidt kraftigere end normalt. Well done!,0
1534,"Dejligt,,det er jeg også ",0
2598,Lel hvor har du fundet den? Det er vidst det jeg ville kalde et tamt meme.,1
2146,URL,0
829,"det er ecort piger i England, de betaler skat...",0
1162,De vandt! ##NU HAR VI CHANCEN DANMARK!,0
3539,Fucking Heimdal! Næsten ingen bolde kom over Bifrost i aften,1
790,det prøves du ikke kommer bage her så skal jeg nok tag mig af dem. undskylde.,0
2784,"Tja, hvis du gerne vil have SU og undgå at komme op i fuldt pensum, så kan det være at du næste gang kommer afsted i bedre tid. Man kan jo ligeså godt øve sig i at være voksen, mens man er ung.  Edit: Det er også bedre, at du bliver væk, end at du forstyrre undervisningen for de mere ansvarlige personer, som kom til tiden. ",0
2492,Svenskar är inte så förtjusta i Nato så det är helt i sin ordning att det inte är något svenskt flagg.,0
1761,9-4 Danskjävlar!,1
2635,"Du skal tale dansk som hvis Google translate havde oversat det. ""naviger Til Gentofte hospital"" ville sikkert have virket. ",0
1799,[Det dér går bare ikke](URL,0
3382,Jeg er i Edmonton Alberta og alt hvad OP siger er FULDSTÆNDIG korrekt.  Elsker det alligevel.,0
2168,Det var det jävligaste! Vilket spott i ansiktet.,0
2320,MMMMMmmmmmmhmhmhmhmmm  ''Deeeer er et yyyyndiiiiigt laaaaaaaaaaaaaandd.....'',0
3398,ER DET ARABISK YOGHURT?,0
2472,1. Lokalisér svensken. 2. Erstat med utvivlsom forbedring.,0
3061,Bor tæt på stort græs/markareal og er mildest talt bange for vi snart må flygte. Verden går under med alle de skovbrande!,0
1472,Han var aldeles ikke nogen svensker! Han var bare almindeligt fuld!,0
1468,Landet for længe siden.. billedet er kort inden en af de sørgeligste scener i tegnefilms historien.. :'( Moar!,0
2125,Du varmer øllet din stodder!  Men glædelig jul alligevel!,1
2302,Swisserne gør klogt i at overlade titlen til fædrelandet. De skulle nødigt føle svanens sande kræfter.,0
665,"Hvad pokker er det for noget. Giver en endnu mindre lyst til at støtte når nogen banker på, for så er det jo bevist at der svindles. Man kan ikke være sikker på pengene går til det det skal?! Uanset at det er unge drenge det her, ændrer ikke på at voksne sikkert kunne finde på det også?!",0
558,Ragnerok nærmer sig? Jeg har svært ved at se Fimbulvinteren for tiden :),0
1966,"Jeg ved ikke om jeg tør afsløre det, men det er det maritime signalflag for tallet 4.",0
2161,Lad os få de bedste billeder af fødselaren frem! [Jeg starter ud](URL,0
74,Tak for invite..,0
2375,Nogen der her teksten ?,0
2173,"respondents were asked How serious you feel the level of crime is?"". The higher the value, the more survey respondents believe it is high in their country.""  Altså er det ikke kriminaliteten der er målt, men befolkningens oplevelse af kriminalitet. Men ja, de tror der er mere kriminalitet i sverige end i danmark.",0
3287,Et bad inden sengetid skulle sænke ens kernetemperatur således man sover dybere om natten :) kolde bade er fantastiske pt.,0
2134,"Svensken beviser endnu en gang at den er grå, kedelig og fantasiløs, mens at de stolte danere samt nordmændende ser leende til og vinder en samtale nemt.",0
3310,#lystmorder #diskotræsko,0
214,En ægte patriot.,0
2663,"Den er sgu fin. Det er et såkaldt trefliget spænde med hvad typisk vikingetidsornamentik. Jeg vil ikke lægge hovedet på blokken med en snæver datering, men vil skyde på at det skal dateres til 900-årene. ",0
2002,"Jodå, den har vi. ""Pucko"" är mer populär dock.",0
1351,vad var det ni rökte???,0
2994,lol,0
2697,"Det med at Venstre har betalt for nogle ting for løkke syntes jeg er lidt af en tom sag at gå efter. Venstre er en privat organisation, hvis de vil bruge pengene på deres forman på tøj/rengøring/rejser, så kan de vel gøre det. Det er kun deres egne medlemmer som de skal stå til regnskab for over det.  Går selvfølgelig ud fra at skatteforholdene er i orden for de goder/gaver han modtager fra Venstre.",0
3128,Dude yes,0
1838,Så äckligt subreddit. Stäng ned det.,0
1995,Stil op til Folketinget. Du har DANMAG bag dig!,0
3025,"Loot boxes og skin gambling, ja",0
3190,[Instaen efter en tur i Aarhus](URL,0
3341,Han kommer til at overtage fra Pind. You heard it here first.,0
2465,##DANMARK!!,0
2089,"Haha, memes oversat tll dansk er så dårligt.",0
1017,"@USER gå i seng, du er syg",1
3286,"Har jeg ""stemt posten op"" eller har jeg ""opstemt posten""? Jeg vil gerne have, det er det sidste...",0
525,Danskertråd på 4chan?,0
2227,You're welcome!,0
1318,I er okay til tider :),0
3465,Har der været offentliggjort noget om at de ville komme i går?  Skal lige have noget tid til at fordøje at jeg gik glip af Dave Chapelle på Comedy Zoo... ,0
3491,Brændt!,0
419,"ganialt, det der.",0
542,Øh ja!!! De skal da tage hjem og hjælpe med at genopbygge deres land!!!!! Det burde fanme ikke være et spørgsmål! Hvis de ikke skal genopbygge det hvem skal så??? Bye bye,0
3338,"Når du er ude, så er powerade godt. Eller vand med sukker og salt. Det genopretter elektrolytbalancen.",0
2511,En dansk är en icke-svensk. Det var gott att höra!,0
494,"ja men lad os få nogle flere muslimer til landet, de er jo så fredelige og misforståede. det er sikkert postmændene der har ægget de søde og rolige knægte fordi de er racister i den virksomhed",1
1872,"Opfordrer alle på DANMAG til at oprette en ""I'm a dane AMA""",0
3089,"Racer cyklister er de absolut værste, typisk arrogante og flokdyr. Samme kan blive sagt for XC ryttere på 40+ på de lokale Trails med 60k full suspensions, vandblærer, gopro og mens de råber af hinanden som om de kørte verdensmesterskab. Jeg har tit haft nogle interessante samtaler på de lokale trails med de her asshats. Gudskelov er det meget få af dem i MTB ved os pga. En lokal stærk og god klub, helt generelt er Mtb et godt miljø med plads til alle, også på shitty cykler og hvor man giver fysisk plads til folk kan køre modsat sporet og prøve noget dumt af og til... Men det er måske bare regionalt, for når jeg tænker efter er mængden af asshat proff XC ryttere ved Hareskov og Hillerød satme også for høje - Gad vide om det er racercyklister som får sig et afbræk??",1
254,"Hurtig Google søgning fandt jeg dette, til den der vil købe.  URLøvrigt en rigtig fin og god vin, der er blandt de 25 bedste Bordeaux vine i Danmark. Scorer også rigtig højt på Vivino og har vundet priser mm.",0
221,Giv dem et par flader når de kommer forbi,0
1337,Garnet tåler jo ikke regn og blæst. Han er så utålelig respektløs,0
403,"En afskyelig idelogi. Desværre finder der idag lige så afskyelige ideologier, som dog helt absurd legitimeres af at kalde sig “religion”.",0
2721,Brænd det flag!,0
2467,14>13 && 29>28,0
1502,"Det er på tide det her migmig laver en /r/thanksobama, vi kommer ikke tættere på virkeligheden end dette. ",0
1194,Dødsstraf kan hjælpe mange kvinder.,0
1481,"Synet af den danske superellipse, i sandhed den smukkeste af de geometriske former, varmer mit stolte røde og hvide hjerte.  Et dansk åndehul i et svensk kaos.",0
534,Hold hold hold. Det er Tobias og hans kumpaner igen. Ja og Ole var ham med kniven. Jo jo den er god nok. Sådan en flok racister det skriver her,1
2739,"Fuckit, har upvoted dummere i dag.",1
1797,"Dette er en glædens dag, tid til at finde Øllerne frem!",0
3021,Ni danskar har ju tappat förståndet helt och hållet,0
3069,vi må håbe resten af EU har mere hjerne.,0
361,"a, det findes der flere eksempler på. Nazister er voldsparate, og jeg tror at du ved det. ",0
1037,Synes hun har en okay pæn krop... men vil gerne se din Gitte @USER for den må være perfekt...,0
650,"Indsend frøerne ledet af Pingo, og svensken vil ikke engang nå at kløjs i påskmusten, før landet er underlagt dansk suverænitet!",0
1756,Og uændret! URL,0
3058,Hvis æ dæj her? /Vendsyssel represents,0
1028,Hvorfor er svensken så humorforladt og skindød? Og lad da så for helvede Skåne komme hjem.,1
3111,Det er Erikses.,0
306,"@USER har kun læst halvdelen af artiklen, men de fleste kommentar alene for, at more mig over folks, til tider, kryptiske indlæg. Og du ramte lige ned her.",0
3113,"Undskyld, hvad? Hvordan er loot boxes gambling? ",0
2944,[Muslim](URL,0
2791,Memen er ekstra bra fordi bilen er Norsk. :D,0
1881,Sådan et sveskn kors burde forbydes. Føj!,0
485,"Er nogle af disse spiller på dansk? Jeg prøver at øve min dansk og som jeg kan godt lide computerspiller, troede jeg at det ville være en god måde at bruge sproget :)",0
2290,Jeg er helt færdig HAHAHAHAH,0
3415,Du har glemt svinekød på den nedeste!,0
1518,"Rystende at denne Moustafa er rejst fra sin kone, det er jo i deres optik et farligt land at opholde sig i, lad os sørge for at han bliver sammenført med sin kone, i deres hjemland.",0
1025,Sugerør,0
2901,"ked af at hører om din situation, nu blev du jo introduceret til koranen i en tidlig alder, som 7 årig som du selv siger, hvilket nok mere har været i din forældres interesse end din egen, hvis de så ikke acceptere at det ikke er noget for dig, er det jo frihedsbedrøvelse, vær fri, vær dig selv, dine forældre burde helt klart støtte dig, selvom du ik vil være muslim, men man ved jo aldrig hvordan de selv har haft det i deres opvokst, kom væk, skab dit eget liv, så ka du jo beslutte dig om du vil banke på deres dør om 10 år og se om de stadig har den samme holdning, hvad angår din ven, så fuck ham eller dem? Rigtige venner støtter squ en ligemeget hvad, om det så er pga religion eller i nødenstund, håber du finder et nyt sted at bo, får stiftet din egen familie og ikke mindst finder nogen gode venner rundt omkring dig, nu har jeg aldrig selv været religiøs, men jeg har flyttet langt væk fra mit hjemsted, for at starte en ny tilværelse alene, uden næsten nogen penge på lommen, ;Det er hårdt, men det kan skam godt la sig gøre,  Held og lykke! :) ",1
2768,Ej nogen mægtig gud og *Kaj*ser og folkehøvding står os bi.,0
910,"Hun skal da selv have 99 år, den smatso.",1
1701,##JEG GRÆDER AF NATIONAL STOLTHED.,0
3328,"Den svenske tråd er ganske rørende. Vi driller og jorder ofte vores nordiske naboer, men det er fantastisk at se hvor stærk sammenholdsfølelsen er når det gælder.   URL",0
1533,Det er en døende pølse. Ingen køber dem i pølsevognen.,0
