id,text,label
329,Her i landet kan vi jo glæde os over at vi i stedet har [Trine Bramsens vise ord](URL#!/00:07:45) til at forklare kongerigets politik på det område.,0
1073,Sælg hele lortet og få nogle Japanere herop så vi kan installere MagLev tog.   Fra Flensborg til Ålborg med 300km/t,1
2839,URL#t=1m24s,0
3551,Det var mega sjovt at se.. det var i det hele taget et akavet interview..,0
882,"Hvordan kan EU sikre at vi har fri adgang til alle de amerikanske medier, hvis US indfører det her?  Hvis netflix osv bruge amerikanske servere, aka amerikansk ISP, så er de vel fucked for alle? Er det ikke derfor det er så stort et problem for hele verdenen at US skal til at stemme om det lort ENDNU en gang? Eller misforstår jeg det helt?",1
639,Det kommer an på om de virkelig er flygtninge eller immigranter.,0
3,Fuck første maj. Busserne kører ændret rute og derfor misser jeg min forlæsning om forberedelse til eksamen. Fucking fantastisk,1
2564,Hvor er originalen?,0
484,"@USER Jeg har ingen undskyldninger for at syntes, at National Socialismen er den bedste styreform. @USER, hvad gøre islam til en bedre styreform end den Nationale Socialisme?",0
1241,Sniffe kokain af bagerens røvhul hørtes ut som et godt gammelt dansk ordtak for å bli tatt ved nesen eller bli bløffet eller noe.,0
2709,/r/PeopleFuckingDying,1
1567,"Jeg har nok haft tilsvarende dårlige dage, men med meget mindre lort, så du vinder den her.",1
1790,Jeg elsker dig OP. Jeg håber du får et langt og lykkeligt liv.,0
743,Tænker det er misbrugere der mangler penge til deres lort..,1
363,"Hvor ser du at jeg forsvare kommunisme? Det gør jeg ikke. Men er lidt træt af den der whatabout som et forsvar for nazisterne. Det er en ekstremt latterligt og hjernedødt argument. Og det samme ville de være hvis i var kommunisme som brugte nazisme som et argument. I øvrigt er alle ismer noget lort, og skidt for mennesker. Så tror jeg ikke at jeg kan udtrykke mig tydeligere.",1
2772,Tydeligvis en reklame for Doom Eternal.,0
824,Fandme heller ikke noget værre end udkogt pasta.,1
1523,"@USER, kan du komme med nogle konkrete ting, eksempelvis hvor i Danmark DF'ere gasser jøder? Fakta på enevælde? Samarbejder de med muslimer som under 2.verdens krig? Du bliver simpelthen nød til at komme med noget konkret, ellers har jeg meget svært ved at tage dine udtalelser alvorligt.",0
2524,Det nederste billede er så meget smukkere!,0
837,Gæt en etnicitet.,0
1028,Hvorfor er svensken så humorforladt og skindød? Og lad da så for helvede Skåne komme hjem.,1
1180,Jeg kunne aldrig gætte lorten. Til gengæld var Dr. Pjuskebusk min favorit!,1
1542,som vilde dyr angriber i flok .Fang dem luk dem i kontainer Åben hanen med evt Gas,1
1831,Fuck det er godt lavet det der!,1
1309,@USER ro og orden i Afrika. tror du selv på den. de har altid ført stamme/ hullabulla krige der nede. og det vil de altid gøre.,1
197,Förlåt mig fader då jag har syndat. Idag gav jag en uppbåt till en mejmej på r/denmark.,0
467,"Du er lige tyben på en kummunist @USER så vidt jeg ved har de slået mange millioner mennesker ihjel, i det hellige kommunistisk navn , husk at når du peger på andre er det altid en finger der peger på dig selv, og lige for at præciserer er jeg venstre mand, men kan kan godt tåle andre partier, selv sf og andre der ligger langt til venstre",1
3076,"hvorfor skal amerikanerne flytte og mellemøstlige blive?   Det er da en fordel i at dele landet med amerikanere, mens folk fra mellemøsten bare er svampe der suger systemet.",1
787,hvad fanden foregår der på Bornholm,1
2647,"Som barn spillede jeg et eller andet adventure-agtigt spil, som jeg simpelthen ikke kan huske titlen på. Der blev snakket dansk, men jeg er ikke 100 på at spillet var dansk produceret. Man styrede en lille knægt, som ikke kunne sove om natten, og så skulle man på bedste point and click maner udforske huset og haven. Jeg tror måske der var en lille ånd eller spøgelse som hjalp én.   Det der ved at drive mig til vanvid, at jeg ikke kan huske titlen. Håber nogen her kan genkende hvad jeg skriver!",0
3342,"Kan vi ikke spare de gifteksperter vi har siddende i døgnvagt, og bruge pengene på bedre ting?    ""Det skulle man tro, Hr. Løkke. Men danskerne er nogle idioter, der spiser deres stueplanter.""",0
707,Dansk er bedre end Svenskerlort!,1
682,"Han er flyttet til Nordirak, ikke hjem til Syrien, vi tager jo heller ikke hjem når vi handler billig Nutella syd for grænsen.",0
133,hvorfor mener du DF'ere er nazister???,0
1224,"Jeg føler vi er et overset segment som *også* er imod cykelløb, marathoner og triatlons inde i byen. Det kan sgu da ikke passe at jeg ikke kan komme ud, bare fordi 5000 idioter har bestemt sig for at løbe en tur sammen. ",1
810,Svin!,1
1512,@USER det kan være farligt ikke at kunne koge past,0
2685,Det må være den bedste nyhed i lang tid. Jeg håber de henter en ind ude fra der rent faktisk ved hvad de snakker om.,0
1761,9-4 Danskjävlar!,1
855,Der skal jo store lønninger til - Øv man ikke kan sætte et foto på jeres kommentarer -men måske er det en grund til det,0
1251,Han EJER ikke respekt for nogen eller noget....han er megaloman og psykopat,1
2990,Med hård G. Ligner jeg en fanme svensker?,1
1873,Selv svensken vil ikke være i sit eget fæle land.,1
3594,Smukt,0
685,"Fucking højrøvet tåbe. Det var da USA'S største fejl at vælge det fjols som president, hold kæft en tegneserie figur",1
141,Er blyanter blevet større eller er ~~@USER~~ børn blevet mindre siden jeg startede i skolen?,0
1202,De skal ikke være her mere der er ikke krig i deres egen land mere så ud med alle muslimer de høre ikke hjemme her,1
654,Føj for satan! Hold jeres pedo onkel på den anden side af vandet!,1
3264,"Det virker jo ikke. Hvor er politikerne? Hvis de andre lande kan stoppe folk med at ryge, hvorfor kan vi så ikke??",0
1726,Danskjävlar! *hyttar med näven*,1
798,Fra DR's forside:  > **Donald Trump godkender offentliggørelse af omstridt notat**  > USA's præsident går imod anbefalinger fra FBI og Justitsministeriet og godkender offentliggørelsen af notat.  Hvilket omstridt notat er der mon tale om? Det kan man ikke vide før man klikker sig ind på artiklen.  En ikke-clickbait titel ville være mere i stil med:  > Donald Trump godkender offentliggørelse af notat vedrørende FBIs uretmæssige overvågning  Det er altid let at sortere imellem titler og lige finde et lille eksempel som styrker ens egen overbevisning.,0
1535,"Kan da ikke passe, på den pæne ø",0
1930,URL,0
3267,"Hold kæft mand, det er føles som om det kun er et par år siden. Jeg har stadig ikke helt fattet at det rent faktisk skete, for mig er det stadig bare noget jeg så i nyhederne da jeg var 12. Det er som om at min hjerne nægter at tænke på hvor tæt på os det egentlig var.  I stedet for at tale om hvordan mennesker som gerningsmanden bag skulle dræbes eller straffes, synes jeg hellere vi skal tage et øjeblik, og kigge på vores medmennesker. Kigge på hvordan de har det, og være opmærksomme på om hvorvidt de har brug for hjælp.   Så meget som jeg nu engang ville elske det, så kan man ikke undgå forfærdelige gerninger som denne med 100% sikkerhed. Nogle gange starter en naturkatastrofe med et mærkeligt fænomen i havet, andre gangen i hjernen på en mand, der ikke blev holdt nok øje med.   Det varmer sku mit hjerte at se så mange personlige historier herinde, både fra danskere, men også fra brugere fra Norge og Sverige. Man kan godt glemme hvor heldige vi er i Norden nogle gange, og andre gange (som f.eks. den dag for 7 år siden) virker det næsten respektløst at kalde os det, men lige meget hvad, så elsker jeg jer sku allesammen, hold kæft hvor holder jeg meget af det sammenhold vi alle har!   🇳🇴🇳🇴🇳🇴",1
2560,Jeg elsker dig!,0
1595,"Jo, jeg har også, og måske oftere hørt om små mandslinger, som nægter et overgreb mod en kvinde. Jeg ved godt den slags sker, desværre, og jeg sympatiserer på ingen måde, med den bitch, jeg håber hun får sin velfortjente straf. Det der støder mig, er den nedladende vending “alene af den grund en kvinde” det krænker mig, for det tror jeg aldrig vil kunne finde sted, med omvendt fortegn. Forestil dig lige det",1
721,Jeg har en stærk mistanke om at hans navn er Mohammed,0
438,Lad gerningsmændene betale regningen hvis politiet finder dem,0
725,"Det næste skridt er så opfordring til vold imod denne syndebuk. Denne fase er politikerne i DF for længst gået i gang med. Og det er ikke overraskende, idet vold er hjørnestenen i nazismen.",1
582,"Nogle gange er selfie perfekte. hvad f•• bilder hun sig ind at prøve at ødelægge hans liv , håber hun få en dom ",0
1853,Jag kan bara hålla med.,0
885,[DRIK OG DRÆB!](URL,0
3355,zero til morgenmad? det fandme klamt,1
954,Sikke en svag regering vi har i landet. Hvornår gør de noget?,1
736,"Ja - lad os brænde Middelaldercentret ned, de har både træhesten og gabestokken stående, godt nok som kopi, men de stakkels mennesker der har siddet på den eller stået i den.",0
3208,Orkanvind?  Orkanmedvind!  odfd,0
432,Fuck nogle møgdyr det er jo ren mafia bare for at de kan støtte de åndssvage bådflygtninge,1
2180,Engelsken er begyndt at vågne op! MAKE IT RAIN DOWNVOTES!,0
2285,"Er der ikke også en der hedder ''the dane'' til den der Madsen MG?  Forresten, så har vi et maskingevær i spillet, mens svensken kun har en ynkelig pistol. Det siger noget synes jeg!",0
124,Folkens læs artiklen og se at der var en grund og han sende en anden,0
1434,På på med madlavningen der hjemme Gud sikke en idiot,1
841,Hahhaaha lær det biiiiiaaaatch,1
1008,Syg mennesker,0
2639,Hvorfor ser hun så skide sur ud???,0
3301,"Du kan klarer den fyr, stort set alle min venner er på vej ud på samme spor, hold kæft hvor føler jeg mig ensom, når alt folk omkring mig vil er at snakke drugs",1
3093,"Nu ved jeg godt, at vi lige har fået banneret lavet om til Olsen Banden, men kunne vi evt lave det om til Ole Thestrup for at ære hans minde?",0
225,White trash. det en søn til DF politikker i Nordjylland - jo mere medierne gør de her beskidte mennesker berømt - jo flere vil ønske samme mediedækning som ubåd Madsen og ham White trash massemorder fra Norge,1
1859,fuck sverige,1
532,Ja tak! Det er simpelthen så ulækker en forretningsmodel. Lavet udelukkende for at ramme børn og teenagere.   Har hadet på det i COD siden de indførte det lort. Men så længe folk køber dem forsvinder det ikke... ,1
1698,SÅ MANGE UPVOTES!,0
1023,fucking lortememe,1
353,"Eller folk der er ""ligeglade"" med hvad man skal have at spise, men ligegyldigt hvad man foreslår er der altid noget galt... ""Det fik jeg i sidste uge"", ""det synes jeg ikke lige"", ""Nej det er for stærkt"", ""nej det tager for lang tid"".",0
2332,Men,0
764,"Smid dem på gulvet, og tramp på dem.",1
1069,"Vi er røde, vi er hvide, og nu skal vi fandme da være stive!",1
2716,"128 varme emails af single russiske mødre der vil date dig, og 63 opkald fra microsoft der vil fixe din computer",0
1695,NED MED SVENSKEN!,1
794,Slap af en psykose ex,1
2125,Du varmer øllet din stodder!  Men glædelig jul alligevel!,1
1165,Å det' ær Frajasaaaal! Å det' ær Frajasaaaaal! *Djøøøøt! Djøøøøt!*,0
742,"Baseret på data, der på ingen måde er repræsentativt og lider under seriøse problemer med bl.a. selektionsbias. Det opdager man dog kun hvis man ikke blot læser firmaets fine farvefulde veldesignede slides i starten, men også læser det med småt i slutningen af rapporten. Men EF har da fået sig da lidt gratis reklame, hvilket vel også var formålet",0
668,"Som randrussianer, I approve. Værste lort. Butikker kommer og lukker til højre og venstre. Intet kan køre særlig længe",1
2752,OPROB,0
2679,"Jeg ville rigtig gerne dele en fadbamse med Bertel. Eller måske en god flaske portvin. Eller en 27 år gammel Whisky.  Han virker som en mand man kunne have lange gode samtaler med, siddende foran en brændende kaminovn, i et par wingback chairs iført sin yndlingsblazer i tweed med læderlapper på ærmerne.",0
435,letta er fandme det klammeste. 20 forskrllige klamme ting i en bøtte og så smager det stadigt dårligere end lurpak - og er mere usundt. og dyere.. suk,1
1156,Tak regeringen for det overarbejde i har med alle de kriminelle udlændinge,1
2165,Har de efterladt en flaske sprut til os?,0
1851,Men va gulligt! Att ni tror att er serieonanist kan mäta sig med KNUGEN AF SVEA RIKE. Dröm på.,0
1497,"Hip-hip, hurra!",0
1819,SÅDANMARK,0
489,"Jeg syns det er nok med pjat med Danske Bank. Bank er en finans institution og så der er ikke så meget moral i det, penge er penge og kunder er bare kunder. Banken er ligeglad hvor pengene kommer fra og hvor de havner til sidst. Alt handler om profitten. Det undrer jo ikke nogen at banken tjener på at låne penge til studerende og de gamle... hvad forventer I fra banken, at det siger “nej, vi har ikke brug for jeres penge”?",0
305,"De små får fri på vores skole fordi en knægt blev blind for nogle år siden da han blev ramt i øjet  Edit: kun det ene øje, grammatik nazister... /s",1
2339,Synes der er lidt rigelig grønt på den der... :),0
1502,"Det er på tide det her migmig laver en /r/thanksobama, vi kommer ikke tættere på virkeligheden end dette. ",0
291,"svanen ser fuc\*ing vred ud, de sorte markeringer giver den et ondt look lige som enhver dansker der ikke kan få sin morgenkaffe",1
2188,"#DIES IST JETZT EIN DEUTSCHES UNTERLASES  #ERKENNT AIMAN ABDALLAH ALS EUREN NEUEN HERRSCHER AN   #HULDIGT KNOLLI, DIE TOLLE KNOLLE",0
1850,Ahlgrens bilar är gott som fan!,0
2377,/r/SWARJE er den vej. gtfo -->,1
3451,#BRÆND HEKSEN!!!,1
2858,Jeg elsker Danmark for meget til at overholde loven i danmark  ~ @USER  wtf,1
1208,Men giraffen skulle jo være den her;  URL,0
1413,hvis DF’ere er nazister er du landsforrædder.,1
4,"Har en gang fået et trælår af min kæreste, fordi damen overfor mig havde verdens dybeste udskæring. Det var som et sort hul der tiltrak alt lys. Senere, efter højlydt skænderi på hovedgaden, checkede hun op på alle sine drengevenner. Alle havde selvfølgelig checket kavalergangen ud hvert minut, fordi man er et menneske. Jeg blev tilgivet, tak drenge......",0
2598,Lel hvor har du fundet den? Det er vidst det jeg ville kalde et tamt meme.,1
1351,vad var det ni rökte???,0
2331,er det på the Greasy Spoon? kan anbefales!,0
611,Du er fandme ik særligt køn,1
110,"Når, det var ellers et cool repost, motherfuckker! URL",1
1059,"Jeg er glad,at han ikke deltog, fordi han er falsk,og han vanærer disse soldater,der kæmpede for menneskes frihed og ære. Han er en plet på den amerikanske nation.",1
576,Fuck Marvel for at gøre nordisk mytologi til et Star Wars lignende lorte univers med lasere og rumskibe,1
2078,For satan hvor jeg savner det shit der.,1
2129,Va? Det gick ju bra första meningen men han måste ha svalt tungan.,0
3160,godt gået!,0
2333,fugtigt min neger,1
1285,De forældre har ikke lært opdragelse. Så de kan ikke lære kioskhår om opdragelse,1
1860,Jeg ved sgu ikke om jeg havde lyst til at få at vide Malmö nu var vores ansvar.,1
1888,Det ægte svar er selvfølgelig god gammeldags dansk /r/FULLCOMMUNISM,0
1218,"Ny copy/pasta jeg tænker kan gå godt til billeder af kvindfolk eller mænd med lidt redigering:  > Føj for satan, det var dog sindssygt. Det ligner kraftædme din farfar valgte at begå selvmord, så klamt det er. Du skulle skamme dig over at vise sådan noget pis. Jeg har aldrig nogensinde i mit lange liv, set magen til lort. Bare tanken om at du kan få dig selv til at vise noget så ualmindeligt klamt, gør at jeg mister troen på os mennesker. >  > Din kone er en klam bunke kartofler i en kørestol. Hold nu kæft du kraftedme dum og klam. Du kan bare sende dine klamme lastbilvenner efter mig, din fucking stodder. Jeg fucking pifter dækkene på din kones klamme kørestol og klapper alle dine venner i gulvet. Klamme sæk. > > Spænder et reb fast i din klamme kones kørestol og sætter det fast bag på min bil, og så kører jeg fandme en tur med hende! > > Skam dig, din sæk!",1
2527,Han var norsk inte svensk! Typiskt danskjävleri och fejk propaganda!,1
2041,"HEY! Bilar er jo sådan det eneste gode der er kommet ud af Sverige og så var ham der Alfred Nobel fyren vel heller ikke værst, men så er der fandeme heller ikke mere der er værd at nævne.",1
1167,"Lækkert lorteindslag v1, jeg giver d1 1/1.",1
1342,Sorte aber,1
1117,"Hahaha, hvor er jeg enig! :D  Selveste [Kongen af Hundige har lavet et meget moderne NSFW-nummer](URLå personligt gerne, at det blev årets Roskilde-hit foran alt det andet lort.",1
1068,meget flot lavet xD,0
162,Det er simpel hen ikke i orden vis respekt for de døde og fam,0
1679,"Hvordan fuck er de kommet frem til det, er vi ikke de første på banen når cowboyderne er på krigsstien? Vi har sku' da aldrig fortjent en 5. eller en 3. plads. Fake news Costa Rica er røget fra en 1. plads til en plads omkring de 30, og de har ikke haft militær i over 50 år, vi har været involveret i minimum 3 krige i den tid, jeg forstår tydeligvis ikke fred.",1
1415,"Jeg sad bag nogle unge piger i toget en dag der snakkede om de havde sex med mænd for helt ned til 200 kr. Wow sagde de, det er nemt at lave penge. De lignede nogle på 12 år men var vel 15 16 år. Sørgeligt tænkte jeg.",0
920,Fløjtepuster er blot et fisefornemt term for dolkegris,0
3255,Tror den er lidt ligegyldig for de fleste. Men måske en oversigt på fødevare-/miljøstyrelsens hjemmeside kunne være på sin plads. For at have en nem måde at finde ud af det på derhjemme hvis man er lidt nysgerrig.,0
408,Så skal han ikke ind i Danmark igen så kan han blive i Irak,0
958,"@USER Du er helt betændt i kysen, men der er håb, Oringes personale i Vordingborg står klar til at hjælpe dig.",1
1295,"Over 1000 ! Det er 3 om dagen hele året, hvis hun da aldrig giver sig selv en fridag. Hvis man så siger 8 timer’s hvile i døgnet, er der 16 timer tilbage til at arbejde i, eller lidt over 5 timer pr. kunde iberegnet transport (escort/kør selv).... mig eller lyder regnestykket helt fucked up ?",0
3418,Flaske migmig,0
90,"Gir slet ik noget til det,så for min skyld ka de alle være falske",0
330,Han er et kæmpe fjols.,1
3494,Tillykke! Man må føle sig mega stolt over endeligt at stå med sådan et færdiglavet produkt i hænderne.,0
957,"Jeg håber, der bliver lavet face swap på dette billede - og gerne mellem @USER og papegøjen.",0
2690,Så må du glæde dig til næste sommer for det siges denne sommer klima er her for blive. Så en lige så stræk sommer forventes til næste sommer.,0
3070,"Har du nogensinde mødt andre store programmører som F.eks. Bill Gates, Donald Knuth eller Sir Tim Bernes-lee?",0
1127,"Det her bør være øverst, fordi han er en røv med øre og hans hoved bør være nederst, fordi han kun kan lukke lort ud.  Og det er sagt af en som er mørkeblå.",1
2081,"Yep endnu en dagli kæde jeg ikke handler i! Er det her et mareridt? Ligesom da jeg var i runde torn og jeg kunne se over til sverige. Det var skræmmende, men det var heldighvis bare et mareridt, håber aldrig jeg skal se det gudforladte sted igen!",1
647,Tosse. Skulle have fløjet med helikopter. Han skulle have lov til at gå,1
338,"Kan du ikke selv se, at din formulering, er krænkende “alene af den grund at en kvinde” ville det i din optik være mere troværdigt, hvis det havde været en mand. Jeg vil på ingen måde forsvare den bitch, men kvinde eller mand, så er vi lige for loven, ihvertfald i den vestlige del af verden. Jeg er godt klar over, at det kan se anderledes ud, i visse dele af verden, hvilket jeg i den grad finder både uretfærdigt, krænkende og tilhørende en for længst svunden tidsalder.",1
2266,Jeg har arbejdet i pølsevogn hele dagen og har slet ikke brug for at se flere pølser!,0
369,"Kondolere til kvindes børn, nære familie og andre pårørende. Frygteligt tragisk og det må være enormt svært at forsøge forstå. Knus.",0
1651,Sverige og Tyskland bliver ført ud i krig og begynder at atombombe hinanden. Hvem vinder?   * menneskeheden,1
525,Danskertråd på 4chan?,0
1242,"@USER som en billig vare, tænker de tjener langt mere end dig, så hvem sælger sig selv billigst?  Disse 2 som laver noget der giver dem nydelse og som de ikke bliver nedslidt af eller dig som knogler røven ud bukserne på arbejdsmarkedet til lorte løn og nedslidt krop?",1
577,De får ikke en krone under nogen omstændigheder. Jeg gider ikke finansiere de skyhøje lønninger.,0
1300,"Det er jo et gammelt trick blandt lorteunger.. Det ses jo også foran div supermarkeder hvor der sælges kort til SOS børnebyerne osv.. For et par måneders tid siden blev jeg stoppet foran LIDL af tre unger der spurgte om jeg ville give 50 kr for et kort, jeg sagde nej, stod så i indgangen og hørte de samme unger spørge den næste om han ville give 30 kr for det samme kort. Jeg nævnte at de sgu da godt lige kunne vente til jeg var uden for hørevidde inden de hustlede videre",1
2497,Smid denne over på /r/Denmark også!,0
3220,"Skideflot. Et stk. upvote til Dem, mon signor. ",1
191,Fuck bøsserøven Macron og længe leve mandfolket Trump,1
