id,text,label
1010,"Paraply betyder regnskærm på fransk. Regnvejr som undskyldning for at aflyse? Der må være en anden grund. Måske de horder af antifa og andet afskum, der vil slå Trump ihjel.",1
493,[Norsk udgave af Olsen Banden](URL,0
884,"Og så vil de have 169,95 kr for det lort? De må være sindsyge.",1
381,overarbejde !!!? sjældent gør de ret meget ved indbrud. fokus ligger på de dybt kriminelle som kører 10-15km/t for stærkt på motorvejene,0
57,Smid dem på den anden side af grænsen hvor de kom fra og byg et hegn som Trump,1
704,"Ta er i akt, danskjävlar!!",1
2383,"Hei! Jeg har laget banneret til /r/NORDVEI.  Bare mellom meg og dere, *jeg liker Danmark bedre enn Sverige*  EDIT: Hvor er Norsk flair?",0
483,"De tre mænd forsøgte at stjæle Holger danske. Politichef udtaler , 'luk lortet ned forhelvede! De skide svenskere stikker af med vores kulturarv!' ",1
2335,"Det var faktisk ret flot at kigge til Sverige i går. Månen var fuld og Øresund stille, så den spejlede sig flot i vandet. Og så var det mørkt, så man kunne ikke se Sverige.",0
3260,Crime-fucking-rider!,1
1270,Sikke en syg skid!,1
533,Jeg tror han er uden for det man kalder pædagogisk rækkevidde.,0
2374,Det värsta är att det är sant också! DANSKJÄVLAR!,1
295,phwoaarrrrr,0
3592,"det ligner en tatovør har brækket sig udover malone, som i øvrigt er halvt hamster",0
2888,"Jord og beton arbejde er pisse hårdt og skal gøres rigtigt første gang, da det er svært at flytte beton og jord efterfølgende. Jeg har respekt for den vigtige arbejdsopgave de gør. ",1
3057,Hun er genial,0
1294,Det var en god migmig :) Vær hilset bror nord.,0
3125,500 gram til 14 kr i netto. En klassiker,0
46,"fandme hul i hovedet... selvfølgeligt en ok måde at undgå at skulle finde på noget der faktisk er danskt, men som en forklaring er det som at sige at det ingen værdi har at være dansk udover at man ikke er svensker... fucking øl patter og hornmusik, prøv at starte med det... fristad og arkitektur, militær irellevans, vores evne til altid at brokke os på trods af hvor godt vi har det i forhold til andre land.....",1
1032,"Sjovt du bruger udtrykket ""lortesommer"". I går modtog min mor et opkald fra et nummer hun ikke kendte hvor vedkommende blot sagde ""det er lortevarmt"" og straks lagde på derefter.",1
3302,Noget nyt?,0
204,Carsberg er lort.,1
345,"Foretrækker dog isterningebakken, den kan bruges igen!",0
3149,"Upvotes ikke oversat til opstemme :( 3/8,5, opstemt alligevel",0
2857,"Haha era danskjävlar, vad håller på ni med? Är ni tokiga eller?   Skrattade ändå, tack Danmark! Kamelåså!",1
347,"Jeg studerer selv i England, i en af de dyreste byer i landet - i forhold til Danmark så ligner det LORT. Hjemløse og folk tabt af systemet over alt, skrald over det hele, alle mine venner er ved at drukne i studie lån og meget misundelige på min SU, biler på den forkerte side a vejen... Jeg kunne blive ved. Vi er ikke perfekte i Danmark, men hold op hvor er det markant bedre end andre lande. ",1
293,"Gammel aktiv i hæphop i 90’erne her.  For at være rigtig gammel og vrissen, så tror jeg at manglen på en scene, der IKKE er online baseret, betyder at meget lort bliver udsendt. Lort som ville være blevet sorteret fra til jams, battles, demobånd etc.   Det er simpelthen for let at komme ud i dag - derfor udgiver folk dagen efter de har snøvlet lidt i mikrofonen for første gang. Den var ikke gået i midthalvfemserne, hvor du blev savet over på scenen, hvis du var en online rapper (Oraklet er et fint eksempel)  Langt de fleste nye danske rappere har stort set ingen skills hvad angår lyrik, teknik og flow. Der er undtagelser.  Hvis folk skulle betale for musikken ville hovedparten af den playlist aldrig sælge noget som helst. ",1
510,"Alle i min by hører udenlændinge ""danske"" rapper. Det lyder ad lort til. Kender fanme ikke til god musik i den her by, det er fucking træls!",1
276,@USER Hold munden din.,1
346,"Ohhhhh shit, shots FIRED!!! Eller... jeg mener, åhhh lort, skud affyret!!!",1
875,"Jeg havde umiddelbart tænkt lørdag formiddag/middag, vi har jo trods alt en times forspring på angelsakserne. Det vigtige er at vi kan blive enige om nogenlunde samme tid, så vi kan angribe overvældende. Desuden synes jeg vi bør holde angrebet til kun at vare lørdag, vi er der ikke for at erobre, men blot hærge.  Vi kan da lige udnytte denne tråd til at holde mønstring over skibene; Hvem er klar og hvad skyts bringer I?  Som jeg fik sagt i den anden tråd, synes jeg ikke vi skal poste alt muligt lort og vise hvor store idioter vi er, men holde det nogenlunde høfligt og blot gøre opmærksom på hvor meget vores to folk har haft med hinanden at gøre (dog gerne til dansk fordel). Hvis vi gør det høfligt, er der også en chance for at deres mods ikke bare sletter hele lortet.  F.eks. regner jeg personligt med at poste URL""Did you know, that England was once part of the North Sea Empire, ruled over by the Danish King Cnut?""  Edit: Og så måske senere poste en TIL om Anders Lassen, en dansker som modtog Victoria Cross, deres højeste militær hædersbevisning.  Og hvis man ikke kan finde noget at poste selv, så er det vigtigt at man støtter ved at upvote andre danske posts.",1
1115,"Jeg bor i USA, er der nogen der ved hvordan man kan loade siden så den tror jeg er i Danmark? Proxy eller noget?",0
3104,Kom ind i tråden!  URL,0
831,"Han er en storskryende vatnisse, men at true mennesker og andre lande det er han god til",1
1324,Hvad er det med danske bank og det der hvid vask noget? Kan nogen forklare?,0
2053,"At kalde Racial profiling er måske lige i overkanten, men udover det er jeg med ham. Ned med svensken og alt det der.",1
2049,Fakta: Sjælland er udkantssverige.,0
695,/r/skraldet,0
3394,Tag min upvote!,0
811,@USER Ja det kunne politiet lære noget af efter ransagning,0
1590,Bare få dem offentlig gjort så kan forældrene se hvad deres unger render og laver,0
799,hvorfor i den fucking store helvede skal man fejre kristne helligdage for at blive dansker er danskere ikke vildt ateistiske jeg mener jeg kunne forstå om det var i afrika eller noget ekstremt kristent noget manden lever jo i en boble,1
1406,Syns da hun ser ganske dejlig ud*ssss* - Lad os se et billede af dig? Skal nok kommentere det,0
1182,"> ”Vi kan jo ikke faktatjekke alting. Og når det handler om, at der er meget varmt på sygehuset, og en mand kommer ud og siger, der altså var 37 grader, der hvor han lige har været, så citerer vi ham for det,” siger han.  Fuck en omgang lort at fyrre af. ""Vi kan ikke faktatjekke alting""... Njah, måske ikke men måske man kunne starte med lige at FAKTATJEKKE DET FUCKING UDSAGN HELE DIN LORTEARTIKEL BYGGER PÅ?  Sig mig lige en gang, hvad fanden er det de underviser på journalisthøjskolen nu om dage? ",1
937,"Hvad har det overhovedet med sagen at gøre? Ja det ville jeg, de vi ikke bruge det som pynt.",0
2474,Hvordan ser man forskel på om det er en hund eller en svensker der er blevet kørt over?   Der er bremsespor foran hunden.,1
907,[Det er bare PostNord](URL,0
2022,"Op, aldrig brug jpg til at linke en animation. tak.",0
1322,Der er tale om tre unge mænd af udenlandsk afstamning Surprise surprise,1
3598,JAAAAAAAAAA GUUUUUUUUUUUUUUUUUUULD!,0
1332,Så kan de fandme lære det! der er stadigvæk blodspor efter min skude!,1
480,"Man skal sgu koge og stege maden ordentligt. Næste gang så gør det selv, supermand.",0
1364,I'm gonna bet it's æbleskiver.,0
1599,Lorteunger..,1
2065,URL,1
1501,Gad vide om der ikke kunne være et museum som ville være en interesseret aftager.,0
845,Jeg vil fandme da gerne drukne i koldskål,1
3491,Brændt!,0
1083,"Føj for satan🤮🤢 det var dog sindssygt.👏🏻Det ligner kraftædme din farfar👴🏼 valgte at begå selvmord🔪, så klamt det er.😣🤯 Du skulle skamme dig🙅🏼‍♀️ over at vise sådan noget pis🤮💦. Jeg har aldrig nogensinde i mit lange liv,👌🏼set magen til lort.💩🤮 Bare tankenom at du kan få dig selv👉🏼👩🏼🧔🏼 til at vise noget så ualmindeligtklamt😖, gør at jeg mister troen🙌🏼 på os mennesker.😔👬👭👫 Din kone👫 er en klam bunke kartofler🥔 i en kørestol. ♿️Hold nu kæft🤬 du kraftedme dum🤦🏼‍♀️ og klam.😖🤮 Du kan bare sende📬 dine klamme🤢 lastbilvenner🚛 efter mig,👏🏻din fucking stodder. 😡Jeg fucking pifter dækkene🔪 på din kones klamme kørestol♿️ og klapper👏🏻👊🏼alle dine venner i gulvet.😡 Klamme sæk.👏🏻🤢 Spænder et reb⛓ fast i din klamme kones kørestol♿️ og sætter det fast🔐 bag på min bil🚗💨, og så kører jeg fandme en tur med hende!🚗💨⛓♿️ Skam dig, din sæk!👏🏻😡👊🏼🤢  Credit til u/depresso_excesso",1
1689,"Er der en sauce? For jeg tænker at Norge vel teknisk set ikke er EU, hvilket kunne dels være til skyld for vores høje tal",0
3209,"[VI ER RØDEEE, VI ER HVIDEE](URL",0
1307,Det er lort!,1
430,Hva fanden er der galt med folk??!!,1
3059,r/kidsarefuckingstupid,1
672,"Det minder mig om den creme, som havde koffein i og kunne bruges til mørke rander under øjne. Det blev solgt på at koffein var det aktive ingrediens i mod mørke rander. Folk åd det råt. \*suk*",0
3034,"Ej, du fortjener fandme guld for det indlæg!",1
2005,"Jeg kan ikke lade være med at tænke på, om man kan betale sig fra en god placering på de her lister...",0
2088,EN RIGTIGT DANSKER!,0
52,Skøre madamme!,1
858,Det her er vitterligt lort. 0/10.,1
3516,"Fandme søgt migmig. Morgenmad er nok ikke det eneste måltid hun spiser, og hvad er der galt med brød. Det er da bedre end ingenting.",1
3124,This må være the best tråd ever.,0
1970,Allt blått är Sverige.,0
1088,"Køb jer dog en fucking blæser tudefjæser. Som om i nogensinde har været i en vandtæt dragt fra top til tå med gasmaske på i det her vejr, der er varmere de fleste andre steder i verden end her.. 😂",1
1254,"Ja ja, hun er en idiot og hun lyver, men er det virkelig så svært at forstå hovedpointen?  Det minder nærmest om Fox News agenda, som folk vælger at misforstå det, fx denne tråd.  Hendes pointe:  Dem som siger at socialismen fungerer, peger altid på lande som Danmark, hvor det siges at det går rigtig godt.  De peger aldrig på lande som Venezuela, hvor det åbenlyst går af lort til.  Hun ville så påpege at drømme-eksemplet Danmark ikke er så godt som folk tror.  Hun siger dermed ikke at Danmark er lige så dårlig som Venezuela, eller at de kan sammenlignes.",1
1772,Hallo! Vi kan godt lide vores norske brødre,0
486,Møgunger.,1
1604,Downstemt for svenskerflag.,0
303,tvivler på at manden ikke kommer kun pga lidt regn i året.. tror i virkelig at det er den eneste grund? fordi så er i da lige så dumme som i påstår at trump er...,1
3360,Hun må gerne være tyk for min skyld men fakta kan hun ikke benægte.,0
1046,@USER shit. Heldigvis kan vi begge finde ud af at lave det ordenligt.,1
2836,Glem ikke mig! Glem ikke mig!,0
1416,"#*Sorte Fredag*  Forældrene var endelig faldt i søvn, Martin tog forsigtigt dynen af og satte fødderne på det kolde trægulv.  Han rakte ud efter sin grønne feltlygte på natbordet i mørket og satte det røde filter på linsen ""*Det gør soldater jo hvis de ikke vil opdages om natten*"" tænkte han imens han skruede det røde filter på og rejste sig.  Martin listede hen til sit tøjskab og fjernede en stak Anders And blade fra nederste hylde og hev en Jansport taske ud.  Han kiggede sig omkring og lyttede, ingen måtte opdage ham. Han åbnede forsigtigt lynlåsen for ikke at larme og lagde indholdet ud på gulvet.  1x låg til en af de store tupperware skåle, check.  1x rulle gaffatape, check.  1x rulle husholdningsfilm, check   Martin stoppede et øjeblik og tænkte ""*Det er ligesom i Olsen Banden!*"" før han fortsatte med at sikre sig der var styr på tingene, for hvis ikke der var styr på det hele før i morgen. . .  1x lille saks, check.  1x par nytårsbriller, check.  1x af de masker fra værkstedet som far bruger når der er støv, check.  1x netto pose, check.  1x par af mors opvaskehandsker, check.   ""*Det hele er her, godt..*"" tænkte Martin, han var nervøs men klar, klar til I morgen..  Martin satte stakken af Anders And blade ind i skabet og puttede tingene ned i tasken igen, han tog igen et kort øjeblik til at lytte om forældrene var vågnet op men der var stille.   Han skubbede tasken ind under sengen og lagde sig ned igen, efter han havde slukket sin lygte lå han i mørket med én hånd omkring den ene skulderstrop på tasken.   ""*Hvorfor ville de dog gøre sådan noget mod os?!*"" tænkte han..   Martin sad og spillede playstation hjemme ved Lille Lars da de første gang hørte dommedagsbeskeden.   Lars havde lige været på toilet og kom ind på værelset hvid som et lagen og han kampsvedte, han kiggede over på Martin og lod sig selv falde indtil han sad på gulvet med ryggen mod døren.  ""*Martin.. M-min bror, han sagde de kaster med nødder!*""  Martin satte pause på GTA og kiggede underligt men alligevel lidt bekymret på Lille Lars, ""*hvad mener du med de kaster nødder?!*"".  ""*De kaster med nødder Martin! Nødder! Du forstår ikke..*""  Lille Lars stoppede sig selv og kiggede ned mod gulvet et par sekunder, han tog en dyb indånding og kiggede op på Martin der nu så endnu mere bekymret ud.  ""*Da jeg var på toilettet.. Og kom tilbage.. Jeg hørte Jason og hans ven snakke om det..*""  Lille Lars begyndte at fortælle hvad han havde hørt, Martin lyttede ivrigt.   ""*FUCKING NØDDER?! AHAHA*""  ""*DU en fucking nød! haha!*""  ""*Nøøh, du så sjov hva'?*""  ""*Men hvorfor skal vi så kaste med nødder?*""   ""*Det den der fucking hipsterfamilie fra København du ved, de flyttede ind på Grønmarksgade, jeg siger dig Mark, fucking bybørn.. De ka' ikk' en skid*""  ""*Ja ja, jeg ved godt du hader tjøffenhawner' men fortæl nu færdig pikhoved*"" sagde Mark, Jason grinte af kommentaren og fortsatte.  ""*Okay så anyways du ved, de går op i sundhed og alt det der pjat, så de fik overbevist lærerne om at det ville være bedre for alle hvis vi kastede med nødder i stedet for karameller, fucking racister!*""  ""*Hvordan er det racistisk din fucking mongol?!*"" er det sidste Lille Lars hører før han lukkede døren til sit værelse, og nu sad de der, Lille Lars og Martin.   *De 2 eneste børn på Gyllebygaard Skole med nøddeallergi.*   De havde brugt hele ugen på at planlægge og samle ting til ""Sorte Fredag"" som de havde valgt at kalde det.   ""*Kom sååå, vååågn op skat, du skal i skole snart*"" Det var Martins mor, han smilte til hende og sagde ""*Go'morgen*"", i hans hoved var ""*Go'morgen*"" dog ikke ligefrem en af de første 5, 10, eller endda 100 tanker der fløj rundt i det øjeblik.  Han fik skubbet lidt havregryn ned på trods af kvalmen og nervøsiteten, det var næsten ved at ryge op igen da hans far kørte over et vejbump lige før de ankom til skolen.  ""*Sorte Fredag.. Så det nu*"" tænkte han efter at have lukket bildøren og sagt farvel til far, han spejdede efter Lille Lars og så ham sidde på sin taske bag en lille busk ved indgangen, han løb der over.  Martin og Lille Lars gav hinanden et hurtigt nik med hovedet og fortsatte ind i skolen og hen imod sløjdlokalet, de nåede heldigvis der hen før folk var begyndt at gå mod deres klasseværelser, som planlagt.  Martin låste døren og vendte sig rundt mod Lille Lars ""*Så gør vi det*"".  De hældte alle deres ting ud på gulvet og begyndte at fordele, klippe, måle, og klistre alle tingene sammen. Der var kun 5 minutter tilbage før klokken ringede men de var næsten klar.  ""*Hjælp mig lige med masken og nettoposen*"" sagde Martin, Lille Lars hjalp ham med at få masken på og posen over ører og nakke og hals og klistrede det hele sammen med gaffa.  De kiggede på hinanden, de var klar, det var tid.. Om bare 2 minutter startede Sorte Fredag.  Martin tog sit Tupperware skjold i venstre hånd og rakte Lille Lars' skjold til ham, Lille Lars havde fået idéen om at lave skjoldene efter at have set 300! med sin bror nogle uger før.  Det var dog Martins idé med dragterne, ""*ligesom i Fallout!*"" Det syntes han alligevel var lidt sejt fundet på.  De tog et sidste kig på hinanden før de krammede, måske for sidste gang.  Martin låste døren op igen og åbnede ud til gangen, der var stille før stormen og helt øde der ude, Martin gik først ud.  Lille Lars tog sit første skridt ud mod gangen da de hørte det, det gav dem begge gåsehud.  ***Det var ringeklokken.***",0
169,Sindsyge kælling. Hun burde sgu spærres inde i meget lang tid,1
2755,"Modargument: ved at kompensere ministre mindre, så øges deres risikovillighed til at begå korruption for økonomisk gevinst.",0
3296,Slapper af AF,0
2809,Kommer det bag på nogen? Det er jo fucking varm rødvin med müsli i. Det er jo ækelt,1
2234,Det var lige før jeg faldt ned af stolen! NSFL!,0
3543,"Godt forsøgt, IS!",0
561,Missilerne burde være røde pølser!,0
591,"Jeg vil hellere give de 3 unge drenge en skilling, end at støtte op om røde kors og deres utallige skandaler.",0
72,"Hvad fanden sagde du lige om mit lands indvadrerpolitik, din lille kælling? Jeg kan fortælle dig, at jeg dimitterede som den bedste i min årgang i frømandskorpset, og jeg har været involveret i adskillige hemmelige angreb mod IKEA, og jeg har over 300 bekræftede drab. Jeg er trænet i elgekrig, og jeg er den ypperste finskytte i hele Danmarks Riges væbnede styrker. Du er intet andet for mig end bare endnu en satans svensker. Jeg vil udslette dig med præcision, hvis lige aldrig er blevet set før på denne Jord, du skal satme mærke dig mine ord. Du tror, du kan slippe afsted med at sige sådan noget lort til mig over internettet? Tro om, bror lort. Imens vi taler, er jeg ved at kontakte mit hemmelige netværk af spioner på tværs af Norden og din stank af surströmning bliver sporet lige nu, så du må hellere forberede dig på stormen, orm. Stormen, der udsletter den ynkelige lille ting, du kalder dit liv. Du er kræftædeme død, knægt. Jeg kan være hvor som helst, når som helst, og jeg kan dræbe dig på over 700 måder, og det er bare med LEGO-klodser. Ikke blot er jeg omfattende trænet i at kunne styre min brandert, men jeg har adgang til hele Siriuspatruljens arsenal, or jeg vil bruge det til dets fulde effekt til at udslette din stakkels røv fra kontinentets overflade, din lille lort. Hvis bare du kunne have vidst, hvilken ugudeligt grusom gengældelse din smarte lille “kommentar” var ved at bringe ned over dig, så måske du havde varet din skide mund. Men det kunne du ikke, det gjorde du ikke, og nu betaler du prisen, din forbandede idiot. Jeg vil skide raseri ud over dig, og du vil drukne i det. Du er fandme død, knægt.",1
813,Er jeg den eneste der kan relatere det nydannede feministparti med denne her video?,0
407,I skal også finde ud af hvad i skal kræve i [danegeld](URLære i fred efter vikingerne's magtdemonstration.,0
2342,URL,0
998,"han kunne da vel for pokker havde taget en paraply med, det kan andre da finde ud af, men det er han vel for dum til.",1
2504,"Holy fuck, fik lige en orgasme takket være dette billede.",1
2893,"Rap lyder bare ikke godt på dansk, uanset hvem der laver det. Det er ligesom at høre rap på tysk eller hollandsk. Det er bare lidt for meget germansk i det.",0
2932,Smirking ~~bitch~~ bastard from ~~Highgarden~~ Høje-Taastrup.,1
166,Hva laver en 17 årig pige i en lejlighed med så gamle mænd,0
349,DANSKJÄÄÄÄVLAR!!!,1
630,Svenskens sprogfærdigheder: ½ Dansk + ½ Norsk + ½ Finsk + ½ Engelsk = 2 sprog. Svensken taler faktisk ikke noget sprog rent - Derfor den besynderlige lyd der kommer ud af dem.,1
3502,"HVOR VAR DU KLOKKEN LIDT OVER 11, HVOR VI SKULLE POSTE OM SIRENERNE?! Jeg kunne godt have brugt den frø. :\(   Men hey, vi kunne overhovedet ikke høre sirenerne på Aalborg Politigård, så skulle tyskerne invadere, kommer det til at gå mere bag på os end på Jer. ",0
890,"Syge kælling, hun skulle i fængsel for det stunt. ",1
980,Håber de fucking hunde blir kneppet,1
1216,så elakt :( ;),0
187,Han har stadig ikke lært hvordan man skal opføre sig som en Statsleder.,0
873,"Folk kommer til at få det vildt over hvor organisk deres organiske vanilje i virkeligheden er hvis sådan noget her kom til at ske...  Tænk at betale negere for at plukke en lille frugt for derefter at sejle dem over på den anden side af jorden for at pakke dem enkeltvis i plastic og karton for derefter at sælge dem til en kunde der bærer lortet hjem i en plasticpose.   Men folk er jo ligeglade, så hvorfor skulle vi ikke være det?",1
528,du synes lige det var på sin plads at shame hendes udseende ? Rimelig lavt,0
867,"Jeg mindes hvad vismanden @USER sagde i sit show ""Anden på coke"" i 2006: Netto er jo et tempel over lort Hans ord står stadig til den dag i dag",1
2718,"@USER er en uudholdelig hykler. Optræder altid påtaget puritansk som om hans tro på gud alene, forbyder ham at træffe amoralske, egoistiske valg. Han er et Dansk førsteklasseseksemplar på en Republiansk Evangelical.   Greatest of Esben gennem de første 7 år i Folketinget:  * Fusket med sit CV så hans første 5 år på Norsk Missionskole blev erstattet af ""Københavns Universitet"" (hvor han slet ikke var optaget før bagefter)  * Ph.D Plagiat som efterfølgende fik en tvivlsom frifindelse  * Plagieret Christiansborgtale  * Kvotekonge sagen (Esben er valgt i vestjydsk valgkreds)  * Misvisende informationer op til vedtagelse af landbrugspakke",1
1376,"Ring til Etnisk Ung. De er skidegode til den her slags sager - de kan også sætte dig i forbindelse med en kontaktperson, som kan hjælpe dig videre. Ring på 70 27 76 66, eller besøg www.etniskung.dk.   Lyv, hvis du skal, for din egen sikkerhed. Det er der ingen skam i. Få et lortejob et sted, eller start på et studie. Flyt hjemmefra, gerne langt væk.   Bor du i København? Læs i Aalborg.  Geografi er en kraftig faktor. Det bliver hårdt, og det er ikke din skyld, men der er ikke nogen vej udenom. Edit: husk på, at du også kan bo på kollegie under en ungdomsuddannelse.   Held og lykke, for helvede. Send en PM, hvis det er.",0
1454,Stort set hele top 50 plejer at være lort. Gudskelov kan jeg selv vælge noget [ordenligt musik] (URL,1
1261,"Danmark har færrest brugere blandt de 15-24 årige i Norden Ved sammenligning med nationale tal fra andre nordiske lande ses, at Danmark i de fleste al- dersgrupper ligger højere end Færøerne og Norge, men i alle aldersgrupper lavere end Sverige og Island. Hos børn og unge mellem 15-24 år ligger Danmark lavest og hos børn under 15 år er det kun Norge, der ligger lavere. Island har, uanset køn og aldersgruppe, den højeste andel af personer med receptindløsninger på antidepressive lægemidler1 i 2016, jf. tabel 22. Andelen af børn i aldersgruppen 0-14 år med køb af antidepressive lægemidler udgør i alle lande 0,1 - 0,3 pct. med undtagelse af Island, hvor andelen er 2 pct. Hos de 15-24 årige er andelen omkring 3 pct. i Danmark, Norge og Færøerne, mens den i Sverige er dobbelt så høj (ca. 6 pct.) og i Island 4 gange så høj (12 pct.). De relative forskelle mellem landene udjævner sig med sti- gende alder. Der er flere kvinder end mænd med køb af antidepressive lægemidler på tværs af lande og al- dersgrupper med undtagelse af de 0-14 årige børn, hvor der i Norge og Island er en anelse flere drenge. Andelen af personer med receptindløsninger på antidepressive lægemidler stiger i alle lande med alderen og er højest blandt de 75+-årige. I Island har 19 pct. af mændene, 28 pct. af kvinderne og 24 pct. af alle 75+-årige haft mindst én receptindløsning på antidepressive læge- midler i 2016. I Danmark er de tilsvarende tal 13 pct. for mænd, 21 pct. for kvinder og 17 pct. for alle 75-årige. Den laveste andel blandt de 75+ årige, ses i Norge med 12 pct. Tallene fra Norge inkluderer dog ikke medicin givet på plejehjem.",0
1908,Men... Hvor er svensken?,0
31,Også bedre uden,0
9,Hvordan i helvede fik de overhovedet dit nummer!? Klamme spionland.,1
154,derfor skulle hele familen også kunne sendes retur hvor de kom fra hvis deres børn og unge gentagende gange har lavet lort i den,1
49,i stolen med den trunte,1
179,Falske anklager fra kællinger burde straffes ligeså hårdt som deres såkaldte ‘gerningsmand’,1
2220,Speak danish or die!,1
367,25-årig mand stukket ned i Albertslund af en gruppe ukendte [PK-filter-start => signalementløse ] gerningsmænd.,0
2312,Og vi er stolte af det,0
147,Agurketid????????,0
803,Danmark suger! /Sverige ,1
2206,"På mit historiehold er vi begyndt at sige ""Fuck Sverige"" i stedet for skål. ",1
1377,det fortjener hun også. Føj for en ulykke at gøre. Aldrig har jeg set noget værre,0
981,Ja hvorfor ikk tjene på det man er blevet givet helt gratis ved fødsels og alligevel gir væk. Os andre der dumme nok til at gøre det gratis,0
2669,Eller en Anaconda fra Elite: Dangerous computerspil?,0
2582,Er dette billede fra i dag? Hvor er det henne?,0
790,det prøves du ikke kommer bage her så skal jeg nok tag mig af dem. undskylde.,0
1503,Fucking usle unger de kan stikke deres dåse op der hvor solen ikke skinner,1
2729,Kk?,0
1976,Jeg vil lige prøve det:  Fuck Svensken.,1
886,Føj sådan nogen svin,0
3006,"Ja mojn du, hol' æ kæft.",1
3232,Analgafler,1
1365,Danskjävlar!,1
2684,Hva' med de fuckhoveder Venstre?,1
286,"husk at stave det første ord rigtigt, når nu i svarer på denne kommentar.",0
2256,10/10 ordspil i titlen OP,0
3387,OMG THIS IS SO AWESOME!    Det ligner noget nær det hyggeligste man kan bruge sin tid på!,0
2978,Vi har i øvrigt også brug for et dansk alternativ til ‘WTF’.  HF [**H**vad **F**anden] er ikke ret sexet.,1
3308,You fucking WHAT!?,1
