id,text,label
257,Det var en lidt uheldig stavefejl størrelsen taget i betragtning.  Godt at lortet faldt.,1
987,"Tak, fordi du ikke vanærede @USER ved at sætte @USER grimme fjæs oven på ham. ",1
339,Manden er idiot.. End Of Story,1
265,Ingenting er mer gøy enn å gi svensken en skikkelig smekk på rumpen!,1
1869,"Hvis du hellere vil have et kalifat end sverige, kan du fandme fucke ud af mit land din luder. ",1
36,Hvor kan jeg se de patter???,0
1974,"RIP Svensken, du vil ikke blive savnet.",1
1943,JA! FUCKING JA!,1
1922,SMUKT,0
2469,HVORFOR ER DET AT DET GRIMME ENGELSKE SPROG BESUDLER DET SMUKKE DANSKE FLAG?!,0
965,om jeg gad og kik på de araber sure fjolser,1
3438,Det er fandme et stærkt album! Tak for grinet :),1
3254,Hold kæft hvor ser det hygge ud. Fed idé!,1
3063,HVER fucking tirsdag...   ^(er tartelettirsdag) ,1
226,De skal have en gratis enkelt billet ! vi gider ikke et danmark fyldt med velfærdsturister og om 50-100år overtal af muslimer med hjernedød mentalitet der ikke hører til i norden.,1
267,"hvor er det smukt :,)",0
3478,"Sjovt du siger det, lavede samme nummer her den anden dag da jeg gik fra Sorø til Vestsjællands Paris [URL",0
1212,@USER hvem skriver du til,0
1840,"Synes Danskere, at Struenseeer en forræder?   Jeg er ikke dansker, undsklyd.",0
2043,Antallet af folk der oplevede EM 92 live > Antallet af folk der oplevede månelandingen live  *såååå komplekst*,0
1826,"Jeg stemmer for ""det sagde svensken også igår!"" jokes!",0
1060,gem det 50 + år så bliver det mere værd.når alle tudekællingerne finder ud af vi kan ikke tie alt ihjel..,1
1223,God Bedring til Dronningen,0
2872,Er det ikke hende der blev kaldt for en blå kost? Eller er jeg helt galt på den?,0
1168,"Jeg synes idéen er glimrende. Har i ikke en prins eller prinsesse vi kan gifte med Prins Christian? Så kalder vi lortet Danmark-Norge, lader København være hovedstad, med Oslo som sekundær hovedstad (tænker nogle ministerier kan ligge der) og invaderer Svensken snarest muligt. I skal nok lige lære sproget igen, men jeg kan godt med til at bruge jeres tal officielt (på penge og sådan). I producerer også noget fantastisk humor, det sender vi live på DR1 hver fredag i stedet for XFactor. I har også en masse oliemilliarder vi kan smide efter grøn omstilling og en togbro fra Jylland til Norge (så skal man ikke gennem Sverige for at komme med toget til Norge). Nå ja, vi kan også godt begynde at sige kanske i stedet for måske:)",1
1414,HVOR,0
3067,Ikke pænt at beskylde et barn for at ligne den ***,0
916,DU MENAR DEN BILLIGA SKITEN MAN DRICKER NÄR ALLT ANNAT ÄR SLUT?,1
283,Sindsyge kælling...,1
2069,Skulle nok have været “nogen har rørt mine hertugdømmer” meeeen,0
2516,Men hvor er Svensken?,0
1882,Et nationalt fyrtårn blandt juicebarer og sushi-restauranter! Hvilket åsyn!,0
3539,Fucking Heimdal! Næsten ingen bolde kom over Bifrost i aften,1
1979,"Låt bli den svenska marken, danskjävel!",1
1081,My god! Feel your pain too min gut. Har de her to sataner og de skider i et væk. Især den grå. Den sorte har det noget nasty langt hår ved exit og har gentagne gange måtte køre Rodalon over gulvet efter hun har taget en røvtur over hele stuegulvet for at komme af med sit tilbageblevne halløj hun stadig har siddende i bagpelsen. Go ferie! URL,0
2105,"Hvorfor vælge så kedeligt et billede, når Jylland er et af de smukkeste områder i Danmark? OP har sikkert aldrig været der, så her er et par forslag.  [Rubjerg Knude](URLøerne](URL",0
2895,"Gad vide om hans næste arbejde bliver McKinsey, eller McKinsey",0
3000,Det er fandme de bedste nyheder idag. Vi burde dele en skål,1
554,Ja typer som sigøjnerbossen hilser venligfolket velkommen,1
2803,"Det er sjovt, at medierne prøver at tegne et billede af at danskerne er et curling folk, når det ikke kunne være længere væk fra sandheden. Vi har det stik modsatte af curling forældre. Ingen andre lande har så stor en rate af unge, der flytter hjemmefra så tidligt som i Danmark. Hvis man prøver at sammenligne det sammenhold, som familierne har i Danmark, med en gennemsnitlig muslimsk familie, så er det sgu også ret tydeligt, hvem der overvåger sine døtre og hvem der siger ""bare giv den gas til Roskilde, Tinna."". Familien som institution er næsten ikke eksisterende i Danmark. Staten og sociale medier har overtaget størstedelen af de roller, som familien engang stod for. Vi har brug for flere curling forældre i Danmark, ikke færre.",0
243,"Hvordan i alverden kan der gå næsten et år før sigtelsen bliver droppet, når beviser for hans uskyld er klokke klare??",0
649,"God grund til at danskerne føler sig snydt og bedraget af politikkerne . Send dem hjem hvis de har adgang til deres land , om det er ferie eller besøg. Velfærds turister høre ikke til her i landet.",0
2971,Hold kæft du er sej. Dyb respekt herfra!,1
2612,"Jeg indstiller dig til at Cavling med det samme! Ej men uden pis, så er gennemsigtighed virkeligt noget af det vigtigeste, især i tider som disse. Man skal kunne stole på de folkevalgte. Jeg sætter selv min stemme ved Socialdemokratiet, og vil gøre det uanset, men jeg synes bestemt at metoder som den de har benyttet sig af her er over stregen.  Det egentligt også lidt pudsigt at de politiske partier bliver ved med at gøre disse ting. De må da for pokker vide, at det bliver opdaget, og de må da også vide, at gennemsigtighed er noget af det folk vægter højest i disse tider. Der kunne de altså lære lidt fra Alternativet; meget kan man sige om dem, men på dét punkt er de altså foran de andre partier.",0
2280,Nogen opdatering på dette? Vil vildt gerne have den mod! :-D,0
3065,Hvad med knallerter? Synes det er oftere at de støjforurener.,0
516,Musikere har Groupies.Trump har fået sin første. Grab-me... !!! !!! !!! Ønsket om at blive taget lever stadig... Håbet.... Der kommer helt sikkert en detaljeret RAPPORT på disken... -i tre eksemplarer! Den pæne... Den frække.... Den Uartige!(Classified) Der vil gå dage med at få alle detaljer med... Hvad stod der på E Cuppen?,0
617,Norge^har^Pusur...,1
395,"Da jeg vågnede i morges kløede min arm. Jeg kan se at der er er et lille hvidt rundt mærke. Tænker det må være en blodsugende svensker, som sneg sig ind på mit soveværelse og bed mig ",1
1810,HVOR ER SVENSKEN?,0
2277,"I DET MINDSTE ER ""FLAGET"" BESKIDT SOM DET LAND DET REPRÆSENTERER.  PÅ EN MÅDE ER SKILTET SANDT - THI SVERIGE BØR RETTELIGEN TILHØRE DANMARK!",1
458,"Så justitsministeren, som jeg formoder har en hovedrolle inden for bekæmpelse af stofmisbrug, har ikke den fjerneste anelse om hvor farlige de enkelte stoffer er?  De er skøre, de svenskere.",1
1154,De skal bare hjem,0
3307,Oh fuck ja! Endelig.,1
1901,ulækkert,0
989,Bogstaveligt talt uspilleligt.,0
3202,"Selvfølgelig er hun i Venstre, det behøvede hun da ikke at nævne.",0
1839,Danskjävlar,1
1131,“Jeg er folketinget”,0
441,"Feminisme burde blive ulovligt at dyrke, og kvinderne skal have frataget stemmeretten, alle de steder de har stemmeret. Straffen for feminisme, skal være en tur i Peter Madsen’s ubåd, MED Peter Madsen, saven og skruetrækkeren.",1
1475,FUCK NU SOVER JEG BEDRE I NAT,1
245,Dansk Guld,0
1019,Hans gulne paryk kunne jo skifte farve og konens sminke ville løbe ned på frakken,0
581,Biograferne tjener absolut intet på billetten 80&#37; af filmens levetid på det store lærred — de penge ryger til Hollywood. De lever af reklamer og popcorn. Og så er det jo gæstens eget valg med tilkøb som IMAX og 3D.,0
924,"Jeg ville ønske jeg kunne anerkende [KORRUPT POLITIKER] som værende et FULDSTÆNDIG NORMALT MENNESKE ligesom alle os andre $USER, med fejl og mangler.   Nok skal man ikke skue hunden på hårene, men ELL har gjort så meget pis efterhånden at jeg ikke kan se bort fra, at han ligner et vellykket eksperiment i hvordan du kan skabe det mest hadfremmende menneske i fucking verden. Der er ingen billeder, hvor han ikke ligner en alien, der forsøger at ligne et menneske, og hans væremåde samt handlinger supplerer bare alle fordomme, som jeg måtte have alene ud fra hans ansigt.  Han er ikke engang uddannet indenfor miljøforskning, men som en tvivlsom Ph.D indenfor religion. Hvordan er det muligt at mose så ufatteligt meget komprimeret lort, ind på de få kubikmeter koncentreret gylle, som @USER væsen optager her på planeten?   Jeg ville ønske jeg kunne sige at hans død i det mindste kunne tjene jorden ved at gøde den, men er overbevist om at han ville finde en måde at fucke den endnu mere op.",1
241,Dyp dem i surströmming og rul dem i fjer. Vi tager ikke let på landsforræderi!,1
252,"@USER har da helt ret, der er intet krænkende i det.",0
573,Jeg skal binde dem til en seng,1
701,"@USER hvis hun ikke kan koge pastaen rigtigt, fortjener hun heller ikke et ben",1
816,##FÆLDER EN TÅRE,0
387,Shit man! Skal kattene med på ferie? Det er nok en god idé at snakke med kattepasserne om den potentielle lortesituation! God arbejdslyst!,1
757,Er folk blevet fuldstændig vanvittige ??? Man brækker da ikke et ben pågrund af pasta der er kogt forkert ! Så er man godt nok syg i hoved,0
1243,Satans løgskærende ninjaer på banen igen,0
168,Svin,1
457,Hvis du melder en for vold eller voldtægt og det viser sig det ikke er sandt med beviser og diverse ting. Så burde du få ligeså mange år i fængslet som personen du meldte. Sådan noget shit her gør det svære for kvinder og mænd at stå frem og folk faktisk tror på dem og dem der gjorde det kommer i spjældet hvis der er sådan nogle mennesker her der gør shit Like This,1
3276,Rest in peace? Til Kim Larsen? Seriøst? Hvad fanden er der nu galt med “hvil i fred”?,1
1816,Mina Danska släktingar åker på semester till Sverige varje år. :),0
3577,Gad vide om konduktøren stadig tager mønter eller om de er skiftet til billet.,0
1329,Krænkelse mig her og krænkelse mig der - man bliver såååå træt,0
951,Sommerhuse der bare vent!,0
922,det bliver vildere og vildere i lille DK,0
3326,Det fandme en fugtig migmig det der,1
1818,##FUCK JA! DANMARK LÆNGE LEVE!,1
1729,"Subs invaderet og succesfuldt overtaget:  Svensken = 0  Det brave danske folk = 1  Prøver de overhovedet, eller ligger de fordrukne i dårlig kirsebærlikør?",0
2402,##Osten skal høvles på dansk manér!,0
2947,"Nogle gange er politik altså virkelig komisk. Folk opfører sig som børn. “Ja eller nej?” hvorefter han rodet svarer på adskillige minutter, alt er kaos, i stedet for at virke mere troværdig og bare sige ja/nej. ",0
2099,Danskjävlar,1
2777,Kan jeg få 2g btc til en 100 lap?,0
910,"Hun skal da selv have 99 år, den smatso.",1
719,Hvad er en god joke?  * Sverige,1
970,Fortnite er fandme da også noget lort...   :>,1
445,Det samme bør gælde for de der møgunger der skruer op for deres lorte musik på bluetooth højtalere..,1
211,En ven i gym havde altid det med. Han kaldte det en leverlort (med mayo),1
660,"Den er væk, nogen der har et mirror til denne meme?",0
822,Tror mere hun har en lufthavn dernede,1
3089,"Racer cyklister er de absolut værste, typisk arrogante og flokdyr. Samme kan blive sagt for XC ryttere på 40+ på de lokale Trails med 60k full suspensions, vandblærer, gopro og mens de råber af hinanden som om de kørte verdensmesterskab. Jeg har tit haft nogle interessante samtaler på de lokale trails med de her asshats. Gudskelov er det meget få af dem i MTB ved os pga. En lokal stærk og god klub, helt generelt er Mtb et godt miljø med plads til alle, også på shitty cykler og hvor man giver fysisk plads til folk kan køre modsat sporet og prøve noget dumt af og til... Men det er måske bare regionalt, for når jeg tænker efter er mængden af asshat proff XC ryttere ved Hareskov og Hillerød satme også for høje - Gad vide om det er racercyklister som får sig et afbræk??",1
3399,En ægte verdens- og levemand har forladt os! Mine tanker går til familen. Æret være hans minde,0
2739,"Fuckit, har upvoted dummere i dag.",1
1334,"Det kan være at hun tænkte at Bill Clinton udlevede sine sexfantasier i det hvide hus , så måske Trump også skal have muligheden",0
1040,"Vel sagt, de nordmænd jeg kender på uni er langt nemmere at komme i kontakt med, og langt flinkere end svenskerne.  Det samme gør sig gældende for finnere.  Det er sørgeligt at svenskerne er blevet så arrogante at høre på, og umulige at tale med.",1
3595,Nä nu jävlar!,1
3350,"Har det regnet? Jeg sover på min altan for tiden pga. varmen, og jeg har sgu ikke mærket noget.",0
1279,Hvor er de røde pølser?,0
476,Hun skal ind og sidde resten af hendes klamme liv den møg kost,1
1306,"Igen en ubegavet kvinde , som får taletid",1
314,Du har det godt @USER,0
735,Ak ja. Generation ondt i røven slår til igen,1
815,Må man så give dem en på bøtten i stedet for at putte noget i bøtten?,0
932,"Og her bliver hele pressen nødt til at se indad og erkende, at jo mere de omtaler psykopaters adfærd, jo større risiko er der for at andre psykopater vil kopiere hvad de ser. Vi taler mord, parteringer, stenkast osv..... Kriminalitet er et personligt valg, x alle straffe med 10, så tænker folk sig måske lidt om?",0
442,[Sauce](URL,0
1087,ja de havde sandsynligvis kioskhår,1
697,"Hvornår vågner vores politikere op,vi kan ikke blive ved med at forsørge resten af verden,se at få ryddet op.",0
2094,##GUD BEVARE R/DANMAG.,0
835,Helt enig med KU. Offentlige socialister bare grådige pattebørn.,1
1912,HAHA DEN ÄR INTE ENS DANSK DANSKJÄVLAR FÖRSÖK BÄTTRE NÄSTA GÅNG!,1
3073,"Det er på grund af det her, jeg bruger Reddit.",0
2344,Presist!,0
2960,"Jeg ville seriøst melde dine fætre og din far til politiet, når du selv er kommet i sikkerhed. Fuck da det at de er familie... Hvis de kan finde på at banke dig indtil at du retter ind, så giver de tydeligvis ikke en skid for dig.  Den slags skal bare ikke ske i Danmark. De trænger til at komme ind og sidde i et par måneder og få at vide hvordan man opføre sig som voksne mennesker.",1
159,"Fuck perkerne. ses på 4chan, tabere.",1
3103,Tor er også en korrekt stavemåde.  Vi er jo ikke ugudelige englændere.,1
452,"Sikke da en bitch, som gør sådan noget, håber hun bliver straffet, og den uskyldige unge mand, får en behørig erstatning",1
1067,"Hun skulle satme ind og sidde i meget lang tid, samt kæmpe erstatning til ham fordi hun har skadet ham. Kunne have ødelagt ham og hans families liv. Møgso",1
165,Læg den op på r/SWARJE! Så kan de lære sandheden om deres ynkelige nation!,1
2441,"Eeew, sweden",1
1274,Læs historien . Og tag ned ved grænsen og hils alle kriminelle udlænninge velkommen og piv ikke den dag du ikke mere kan komme på sygehuset uden at betale,0
1529,Han er jo ikke andet end en failass reality star,0
1863,Dette billede fik mig til at føle en sådan patriotisme at en tåre løb ned af min kind.,0
546,Norge er nu ikke så slemt igen... AKA Svensken ain't got shit on us...,1
1187,Hahaha hold nu kæft han er kær!,1
88,"Jeg vil tro, vi slår dem i udlændingestramninger",1
261,"**En skål for vore faldne landshelte fra det store lærred! Ove, Paul, vi savner jer sgu!**",0
1538,"Det er så typisk danskere det her..  Typisk dansk sommer: ""det regner for meget, det er en dårlig sommer, Jeg rejser fandme sydpå hvor det er dejligt varmt""   2018 - rekord sommer! ""det er for varmt, der er for tørt, Jeg må ikke grille, Jeg kan ikke spille computer, min røv sveder osv. ""   Den her sommer er dejlig! Ja det er varmt, Ja det er tørt. Nyd det mens det varer. Inden længe når vi vinter også tuder danskeren over det er for koldt, for glat, for vådt und so weiter. Ingen er nogensinde tilfreds. ",1
2847,"Jeg tænker også at der er flere afdelinger i kommunen, hvad med jobcenteret? Eller myndighedsafdelingen (dem som arbejder med serviceloven) det er nok der du bør henvende dig... ",0
3269,Med Dean Martin samme år:  URL,0
447,"Jeg kørede taxa, fik en ung pige på måske 20 år i taxaen. Hun sagde adressen som var en kort tur over en bro. Midt på broen vil hun pludselig at jeg skal køre hende en tur på 100km. Jeg siger til hende at det bliver ret dyrt og om hun er sikker på hun har råd til en sådan dyr tur. Så siger hun om jeg ikke kører hende skal hun melde mig for voldtægt.. WTF! Vi havde altså kørt i kun 5 minutter... Vel sådan blev det ikke, jeg svarede, nå så det siger du... Tænker vi skal have dette klaret op i med det samme så jeg ringer politiet fra taxaen og siger til politiet at jeg kommer med en ung kvinde der vil anmelde mig for voldtægt. Men jeg ved ikke hvornår jeg skulle have udført den voldtægt hun kom i bilen for 5 minutter siden. Hun bliver nu nervøs, men jeg kører direkte til politiet. Her får politiet udskrift af min kørsel og de anholder selvsagt hende.",1
2801,Jag ger en stödröst!,0
2683,\^skinny bitches er guderne,1
548,"Det er værd at huske på at Canada ifølge mange canadiere er på randen til økonomisk kollaps. Det går altså ikke skidegodt i landet og samarbejdet med andre lande, heriblandt USA er blevet langt dårligere med Trump m.m. Derudover driver Kina rovdrift på landet og er ved at puste endnu en boligbobble op i storbyerne pga. dårlig lovgivning, der tillader udlændinge at opkøbe canadisk ejendom for at hvidvaske kinesiske penge.  Hvis Canada havde lyttet til DF, så ville landets økonomi være langt bedre.",1
2199,/r/shittyfoodporn,1
1390,"Fuck det, mere sol og varme, mindre regn please. 80% af de danske år er totalt lort, og så snart der kommer lidt sol så begynder alle at whine...",1
1178,"Hvis vi kommer i store problemer, så Anders Fogh kun en sms væk!",0
1145,"Invitere dem da indenfor, og giv dem så en stor rövfuld.",0
1201,Ja selvfølgelig 3 drenge af fremmed herkomst??hvornår er nok,1
3194,"Genialt lavet! I øvrigt, et meme der **må** være startet af Ramos' brændte straffespark mod Bayern. ",0
893,Jamen hvad pokker er det der sker for folk som ham ? Han er jo bindegal,1
3393,Good Times :) Indtil robot støvsugeren smilede jeg kun lidt 😂,0
876,Er terrorangrebene i Europa fra muslimsk side stoppet siden i mener det er ved at dø ud?,0
2594,Bullshit,1
0,Skyd for helvede. Afliv lortet !!! Tænk dog på hvor farlige de er. Hvert år dræbes danskere at de her djævle!!,1
751,100% enig  jeg har droppet alle danske radio kanaler undtagen p1 og radio24syv... bare for at undgå det. jeg plejede ellers at høre en del P3. men nu spiller de kun dansk lortemusik.,1
507,Var det ham der sad i en lort?,1
209,"Ja løget mindst om, ud af alle de ting der bliver løget med er muligt, men derfor er det skam stadig meget. Tror blot på det sidste år jeg har hørt om det 3-4 gange, og det er 3-4 gange for meget.  Hvordan man end vender og drejer det, så er det en syg kællings løgn.",1
1969,Elge er Svenske tanks!,0
1433,"så må vi se om du tør fucke ris op næste gang vi skal have ris, jeg sir’ det bar’",1
926,"@USER det var sådan noget du kunne finde på, da jeg åbenbart stegte pandekager dårligt",0
923,Ja Hold da op hvor er du klog,0
1139,Var vi de eneste røvhuller som dyppede karamellerne i et tyndt lag olivenolie og satte dem i køleskabet? Det var som at kaste med sten xD,1
3339,[Han kneppede jo de unger synder og sammen](URL,1
1118,"Overraskende. Jeg trodde at vi nordmenn var dårligst i engelsk.   Mange danskere svarer på uforståelig engelsk når jeg snakker til de på norsk, selv om jeg forstår dansk like godt som norsk etter å ha bodd i Danmark.",0
2415,*Danskjävel,1
1743,Bonus points til Danske North (FC. København og Nordisk Film's nye hold) som også nåede til ~~semifinalerne~~ kvartfinalerne.,0
130,Kan man rejse. Hjem eller ferie så kan man også blive der ??,0
3206,Nævn en mere ikonisk duo!,0
1722,Skulle ikke undre mig om Australien vinder :p,0
3497,"Det kan godt være den er gammel, men den vil for evigt være sjov!  Det vil det meste af SATW egentlig",0
1926,Fuck Sverige! Bogstaveligt talt.,1
2486,Sådan går det når svensken stiller op med en bumset teenager med klisterhår!,1
1585,Du glemmer Østeuropaer som er de værste,1
544,"Normalt synes jeg Marx var lige højreorienteret nok. Men på dette punkt kan jeg mærke en ekstremt liberal tilgang til emne. Til denne debat vil jeg sige, at krænkelseskulturen er en af de dummeste importer, vi har gjort os fra Nordamerika.  Jeg afventer personligt, at vi kollektivt vedtager, at det er fløjtende ligegyldigt om man er født med tap eller ej, hvad farve man har, og hvem man bedst kan lide at kysse på.  Nej, vi vil ikke have hate crimes. Nej, vi gider ikke se på passiv humor på bekostning af andre. Men man skulle fandme tro, at Danmark havde assimileret den Mellemøstlige aversion overfor selvironi. Hvilket er noget beklageligt eftersom selvironi er et ret stort interpersonligt fænomen for danskere.   Men er en joke om, at nogen gange ventede jeg lidt længe på, at min eks gjorde sig klar på bekostning af hende? Eller er den relaterbar for andre mænd og kvinder, der godt lidt kan se, at der (for mange) er noget om snakken? I virkeligheden siger jeg jo med en sådan kommentar, at jeg fandt hende naturligt smuk og glasuren overflødig.  Jeg bliver så evigt træt af, at man skal have bonuspoint for at være født som noget specielt, hvor specielt på nymarxistisk vis blot betyder anderledes fra den mest dominerende gruppe; den hvide heteromand. Jeg tænker, at det må være rimeligt, at alle har lige vilkår, og at alle må deltage i den kultur vi har her på stedet. Lad os nu i stedet for at skælde ud på alle jokes prøve at isolere dem, der er sagt med had, fra dem, der ikke er.  Jeg var engang på en Tinder-date med en såkaldt queer feminist. Hun sagde en masse ting, som jeg i årevis har set nærmest ordret fremført i debatter fra USA og Canada. Bomben smed hun dog først til sidst, da hun sagde, at alle mænd er sexister og alle hvide mennesker er racister. Fordi begge grupper angiveligt vinder på, at andre er dem undertrykt.  Og det er da bare super, at man skærer alle over én kam på den måde. Så jeg er åbenbart som hvid mand racist. Ligesom Hitler. Det er super, at regnbuebevægelsen er så blind overfor gråzoner.   Det handler selvfølgelig om, at sprogpsykologien fra de franske filosoffer fra 60erne lærte os, at sproglige udtryk har deres endelige effekt hos modtageren. Derfor træder vi ofte folk over tæerne uden at vide det, når vi sådan går og joker ""som man altid har gjort"". En fin tanke at ville være progressiv og optimere sprogets brug. Men humor kan ikke bandlyses uden konsekvenser.   /rant",1
1042,"Hvad har den mand overhoved gjort, som er til gavn for andre end ham selv. Han er ikke en skid bedre, end mange af de danske toppolitikerer",1
917,@USER så er det altså sidste gang du koger min pasta for længe..,0
1161,"Klog?? Ha ha for mig at se har hun taget den nemme løsning, klog ville være at tjene dine penge på andre måder. men det finder hun vel ud af, når hun engang ikke kan sprede ben for penge mere. idioti",1
1662,"Fuck det er smukt, jeg slår helt en tåre",1
37,"Anklagemyndigheden overvejer at sigte damen, for de falske anklager, som kunne have givet ham 99 år. Der er da noget der slet ikke hænger sammen her. Fuldstændig vanvittigt... Hun skulle da kunne straffes op til 99 år, så man kan sætte et eksempel på, at man tager falske anklager alvorligt. Welcome to the USA, the greatest country in the world.",0
2926,"Tusind mange gange tak for det dejlige grineflip jeg fik dér. Er du råden, hvor er det sjovt. ",0
1889,###DANSKEN ER EN DEJLIG MAND!!!,0
534,Hold hold hold. Det er Tobias og hans kumpaner igen. Ja og Ole var ham med kniven. Jo jo den er god nok. Sådan en flok racister det skriver her,1
1499,teknik-viking?,0
817,Aber,1
675,Det er på tide en del kvinder skrider tilbage til det køkken de er stukket af fra. Syge kællinger på fri fod er der squ for mange af,1
2680,"Nooo, ikke trafikdengsen :(",0
472,Hold kæft noget 9gag lort.,1
355,Latterlige feminister... De skulle forbydes...,1
1422,"Jf. figuren drak 95,3% af kvinder alkohol i 2016.   I 2015 udgjorde muslimer 4,7% af befolkningen.  Tilfælde? I THINK NOT!",0
1455,Odins sønner?,0
2759,HOLD KÆFT SVERIGE SKAL VÆRE GLADE FOR AT DE KUN TRAK ITALIEN,1
2019,"Ignorance is bliss, danskjävlar.",1
1998,"Hvis vi skulle til at fortælle andre lande om det, hver gang vi har det bedre, ville vi sgu få lange løg.",1
194,##SVENSKEN KAN SLET IKKE FØLGE MED.,1
3140,"Har aldrig haft problemer med postnord og er faktisk ret glad for deres tracking side!   Jeg tror måske bare at det kører godt i mit lokalområde (ved Vejle), hvor oplever folk typisk postnord problemer?  Oh altså 30 kr forsendelse fra Japan men 40 kr forsendelse indenfor DK.. det giver ingen mening!",0
775,Imens de holder i en fotovogn og drikker cafe eller har stoppet en scooter der køre 5 km/t for hurtigt,0
2569,"Jeg var blot tre år, sommeren '92. Mig og min familie var i Spanien på campingferie under finalen. Da vi kørte hjem, lærte jeg mine første tyske ord: ""Deutschland, Deutschland, alles ist vorbei, alles ist vorbei..."".",0
1465,"Er der koldt og mørkt i den sorte grav?   eller stråler himlen som det klareste rav?   er der sang og musik i de dødes land?   og swinger det, pianomand? ",0
115,"I stedet for at tildække det svenske flag, burde man [UDRADERE DET](URL",1
2885,Er der nogen der kan fortælle mig hvilken skole det stammer fra? Kunne godt finde på at køre forbi og dumpe et par hundrede karameller...,0
2910,Der er sol-hadere og så er der sne-hadere  [URL,0
3030,"“Hvorfår er vi ikke i seng, drenge?” r/suddenlygay",0
741,Fucking god humor,1
273,Jeg vil aldrig mere klage over en lorte sommer.. Bare giv mig regn..,1
2151,/pol/ havde ret.,0
842,@USER kæft et ensom liv du å have,1
